Predictions_prob_1,Predictions_prob_0,text,speech_par_id,uncertainty,already_annotated,already_sampled,drawn,label_yl,label_bb
0.550800926,0.449199074,"America, together, we cannot fail. Not now. Not when we have a crisis to solve and an economy to save. Not when there are so many Americans without jobs and without homes. Not when there are families who can't afford to see a doctor, or send their child to college, or pay their bills at the end of the month. Not when there is a generation that is counting on us to give them the same opportunities and the same chances that we had for ourselves.",2008-10-01-crosse-wisconsin-1_33,0.101601853,FALSE,,uncertainty,1,1
0.375030224,0.624969776,"Confidence and trust must also, once again, mean respect for the aspirations of all citizens, veterans and non-veterans alike, for health care, education, housing, and employment. We must focus our attention on policies which have left nearly 600,000 Vietnam-era veterans without jobs and our VA Hospitals overcrowded and understaffed. Can we imagine that a president who speaks of national security two years ago vetoed a bill to provide for veterans of Vietnam the same educational benefits enjoyed by veterans of World War II and Korea? That this same administration first opposed, and then failed to enforce, laws intended to help our veterans secure job training and employment? That this same administration earlier this year failed to support cost of living increases in pensions and other benefits, only signing a bill passed by the Congress as the election approached?",2404_3,0.249939553,FALSE,,uncertainty,0,0
0.58027809,0.41972191,"Was it really true that when Abraham Lincoln walked the corridors of the White House in an old night shirt and a pair of scuffed carpet slippers, mourning the casualties, or sat in the White House war room where the newfangled magnetic telegraph ticked out occasional news of battle--was it really true that we were a nation of a few more than just 30 million? Can it be that there are enough fearful and doubting people today who have lost their American faith, that say that a nation of more than 200 million, with fabulous wealth and technology, beyond the dreams of man, confronted with poverty long neglected, with protests and demonstrations, cannot do what is right? Do they really fear to do what is necessary to bring the depressed minorities of black American, Spanish-speaking Americans, and those of small minorities, black or white, into the full and faithful dream of America?",2042_20,0.160556179,FALSE,,uncertainty,0,0
0.529601762,0.470398238,"A hundred thousand Americans. I'll say it again, in a year in which most advanced countries, all of our competitors have long since provided basic health care for all their citizens and found a way to control health care costs, over a hundred thousand Americans a month are losing their health insurance in America. And they want this election to be about whether they should have four more years.",3044_8,0.059203524,FALSE,,uncertainty,0,0
0.000167501,0.999832499,"In the week to come, the Senate faces an historic opportunity to take chemical weapons out of military arsenals and help keep them out of the hands of terrorists. The Senate will vote on ratification of the Chemical Weapons Convention. By voting for this treaty, the Senate can help to banish poison gas from the Earth and make America's citizens and soldiers much more secure.",3199_5,0.999664998,FALSE,FALSE,random,0,0
0.00019359,0.99980641,"We stepped up a constant stream of weapons and munitions to Batista--justified in the name of hemispheric defense, when, in fact, their only real use was to crush the dictator's opposition, and even when the Cuban civil war was raging--until March of 1958--the administration continued to send arms to Batista which were turned against the rebels--increasing anti-American feeling and helping to strengthen the influence of the Communists.  For example, in Santa Clara, Cuba, today there is an exhibit commemorating the devastation of that city by Batista's planes in December of 1958.  The star item in that exhibit is a collection of bomb fragments inscribed with a handshake and the words:  """"Mutual Defense--made in U.S.A.""""",1588_16,0.99961282,FALSE,FALSE,random,0,0
0.000167509,0.999832491,"And he did. He indicates now he supports the President on Quemoy and Matsu. He indicates now that he didn't really mean that the President should have apologized. He was only talking about it theoretically, and he indicates now that he didn't really mean that the federal government should intervene in Cuba. He was only talking about what we're already doing, as a matter of fact--giving moral support to the cause of freedom in Cuba and all around the world.",1854_34,0.999664982,FALSE,FALSE,random,0,0
0.559316234,0.440683766,"Today, it is comparatively safe to break the law. Today, all across the land, guilty men walk free from hundreds of courtrooms. Something has gone terribly wrong in America.",2169_10,0.118632467,FALSE,,uncertainty,1,1
0.603177311,0.396822689,"That's why I am running: to end the decades of bitter failure and to offer the American people a new future of honesty, justice and opportunity. A future where America, and its people, always – and I mean always – come first. Aren't you tired of a system that gets rich at your expense?",2016-08-18-charlotte-north-carolina_15,0.206354621,FALSE,,uncertainty,1,1
0.382903036,0.617096964,"I can assure you that if we are elected in November, that we will carry on in this country the same policies which have distinguished for so many years other great Democratic administrations, the equality of opportunity for our people, the protection of their rights, better housing, better schools, better attention to the needs of the people of the United States. And I can assure you in so doing that we will build in this country a stronger America which will make its influence felt around the world. I ask your help. Give us your voice, your hands, your help in this campaign, and we are going to win it.",1493_3,0.234193928,FALSE,,uncertainty,0,0
0.000145366,0.999854634,"When I was in Kansas City and making an acceptance speech, I made a commitment. I will not concede a single state; I will not concede a single vote. We are going to have a national campaign, and we are delighted to be down here in Louisiana, Mississippi, Alabama, and Florida. We want your help, and we are going to win.",2440_1,0.999709267,FALSE,FALSE,random,0,0
0.470558981,0.529441019,"The record is there and it's clear.  The highest Hispanic unemployment rate in decades, especially among young Hispanics, an all-out attempt to slash bilingual education.  They successfully trashed the Civil Rights Commission and turned it away from being a conscience of our country; and tried to fire Bambi Cardenas, the only Hispanic member of that commission.  They fought to weaken the Voting Rights Act and every Hispanic knows that that's the source of strength, and that's why we have a Cisneros, and a Pena, and Anaya, and the congressman that we rejoice in here this evening.  They turn the clock back on appointments of Hispanic Americans to the judiciary and in positions of power throughout the administration.  And that's why the stakes are so high in this election.  This election will decide what happens to all the progress that we've made over these last two decades.  Will we move forward, or will we slide back?  That choice is that important and that clear.  This election is nothing less than a referendum on your future and our nation's future.",2728_5,0.058882039,FALSE,,uncertainty,1,0
0.000284464,0.999715536,"Mr. Nixon is getting increasingly disconnected with reality.  Two days ago he accused me of speculating in the London gold market and affecting the price of gold.  The point of the matter is I want him to come tomorrow to Michigan and tell the people of Michigan what he is doing and what this administration is doing to put people to work.  What plans have they had for automation?  This administration has never discussed it.  And yet do you know in this state and country, we are going to have to find 25,000 new jobs a week, every week, for the next ten years, to get full employment, at a time when machines are taking the jobs of men.",1671_4,0.999431071,FALSE,FALSE,random,0,0
0.381929855,0.618070145,"Secondly, I do not believe that the United States is increasing its economic growth and development at a fast enough rate to provide full employment in the state of Pennsylvania and full employment in the United States.  This matter of so-called growth is at the heart of your job.  This country has grown in the last eight years on the average of 2 1/2 percent a year.  That means that we have increased our strength each year 2 1/2 percent, but because machinery has come in, because our productivity has increased at a faster rate even than our economic growth, it means that in 1960 4.5 million people are out of work.  We are going to face the same problem in 1961, 1962, 1963, 1964 and 1965.  Some of you may work in the glass factory.  You know that every year we increase the productivity capacity of our glass factories, and if we don't provide economic growth at least twice what we now have, you are not going to find as many people working in the United States as work today.  We have 50 percent of our steel mills producing, 50 percent stand idle, and yet we produce almost as much steel today as we did with 100 percent of capacity seven years ago.  The reason is that new machines make it possible to produce more steel.  Therefore, not as many men are needed, and, therefore, 100,000 steelworkers are out of work.",1618_4,0.23614029,FALSE,,uncertainty,0,0
0.00053001,0.99946999,"I run for the presidency in the most serious time in the life of our country, and the issues involve the security of everybody here.  In the next 10 years, this globe around us is going to move in the direction of freedom or going to move in the direction of slavery.  The communist system is militant, hopeful, confident, optimistic, and it has been able to identify itself all too successfully with the desire of these people in the underdeveloped world to live a better life.  We have not done so.  Cuba is only a phase of a great struggle which will take place in the next decade.  We talk about Mr. Castro.  The great issue is what is the rest of Latin America going to do, Mexico, Panama, Bolivia?  Why should the president of Brazil in his campaign feel it necessary to make a trip not to Washington but to Havana in order to get Mr. Castro's blessing to be elected president of Brazil.  ",1656_8,0.998939981,FALSE,FALSE,random,0,0
0.438306174,0.561693826,"At a moment like this, the last thing we can afford is four more years of the tired, old theory that says we should give more to billionaires and big corporations and hope that prosperity trickles down to everyone else. The last thing we can afford is four more years where no one in Washington is watching anyone on Wall Street because politicians and lobbyists killed common-sense regulations. Those are the theories that got us into this mess. They haven't worked, and it's time for change. That's why I'm running for President of the United States.",2008-11-02-columbus-ohio-6_6,0.123387653,FALSE,,uncertainty,1,0
0.418048382,0.581951618,"     For four years the FHA programs, passed by Congress to make it possible for poor and middle-income families to purchase homes, have served as engines of destruction in Detroit, Chicago, St. Louis, and here in New York. Manned by political hacks and favor-seekers, FHA has become a sewer of bribery and fraud, infested by corrupt officials, real estate speculators, and shady mortgage companies. Greedy middlemen have picked the FHA clean, leaving urban America with a vast array of abandoned houses and a vast army of homeless families.",2275_15,0.163903235,FALSE,,uncertainty,0,1
0.000139061,0.999860939,"And my answer is that that could happen unless we have, as we should have, the kind of leadership that recognizes that the interests of the United States must always come first as we consider our foreign policy problems. Now, let me be quite specific. Where a conflict is involved, involving smaller nations, we'll say like the Pakistan-India crisis, then I think the United Nations is the ideal forum to settle that kind of a conflict. And we should turn to the United Nations in every possible case and use it to settle these little conflicts which otherwise might spread into big ones.",2168_21,0.999721879,FALSE,FALSE,random,0,0
0.000530127,0.999469873,"Recently, Mr. Reagan has been implying that to look straight at our country's challenges is to run down America.  He's wrong.  There isn't one political party that believes in America and one that doesn't.  There isn't one party that believes in American greatness and one that doesn't.  There isn't one party that believes in the family and one that doesn't.  There isn't one party for strength and one for weakness, and there isn't one party that stands for God and one that doesn't.  As Americans, we are together on every one of those issues, and we should not be divided by anyone.",2715_21,0.998939745,FALSE,FALSE,random,0,0
0.438306174,0.561693826,"At a moment like this, the last thing we can afford is four more years of the tired, old theory that says we should give more to billionaires and big corporations and hope that prosperity trickles down to everyone else. The last thing we can afford is four more years where no one in Washington is watching anyone on Wall Street because politicians and lobbyists killed common-sense regulations. Those are the theories that got us into this mess. They haven't worked, and it's time for change. That's why I'm running for President of the United States.",2008-10-31-moines-iowa-1_6,0.123387653,FALSE,,uncertainty,1,0
0.582040456,0.417959544,"Some may feel that their life is wholly unaffected by this decision, that their job is secure, that their rent is paid, that their taxes are paid, and all are likely to be the same, whichever man and whichever candidate holds this high office.  But I want to make it clear that every American is affected by what happens.  Our prestige abroad, what other people think of us, is not of importance only to those Americans who work abroad.  The sign """"Yankee go home"""" does not apply only to our diplomats and our soldiers.  The great struggle in the world is not one of popularity, but one of power, and our power in considerable measure depends upon our ability to influence other nations, to identify ourselves with them, upon their willingness to associate with us, upon their willingness to follow our leadership.  When Mr. Nixon says our prestige has never been higher, I say he is either misinformed or misleads.  For our own administration, this summer, in polls taken in ten countries of the world, has proved that the people of the world, the great majority believe that the balance of power is shifting against us, and that by 1970, in nine out of ten countries polled, polls which the USIA now has, in nine out of ten countries the majority of the people thought the Soviet Union would be stronger in 1970 than the United States.  Do you know what that means:  that means that people who are now undecided may not be so willing to follow our leadership in the future, may hang back, may be neutral, may be uncommitted, may vote against us in the United Nations, may stand aside as we become gradually weaker.  I want the people of the world and Mr. Khrushchev to know that a new generation of Americans has taken leadership of this country and that this free society speaks with power, force and decision.  ",1704_7,0.164080912,FALSE,,uncertainty,1,1
0.526076549,0.473923451,"Because together, we cannot fail. Not now. Not when we have a crisis to solve and an economy to save. Not when there are so many Americans without jobs and without homes. Not when there are families who can't afford to see a doctor, or send their child to college, or pay their bills at the end of the month. Not when there is a generation that is counting on us to give them the same opportunities and the same chances that we had for ourselves.",2008-10-02-rapids-michigan-2_25,0.052153097,FALSE,,uncertainty,1,1
0.000120024,0.999879976,"We set up a tuition tax credit so that middle class families can get a $10,000 tuition credit over 4 years to help their kids go to school. Now we've got to build on that progress. And you've got a choice. And the other side, they're proposing to gut education to pay for more tax breaks for folks like me.",2012-09-13-rally-golden-colorado_34,0.999759953,FALSE,FALSE,random,0,0
0.432299625,0.567700375,"We knew that inflation, the quiet thief, and record interest rates were stealing our future. We knew that our national military defense had been weakened. So, we decided to rebuild and be strong again to be prepared for peace. It was a second American Revolution, and it's only just begun.",2876_8,0.135400751,FALSE,,uncertainty,1,0
0.636850807,0.363149193,"We have two choices to make.  That is what I am trying to say to you. We have a choice to make now in America.  It is whether or not we shall continue now as a nation of nation builders, of bridge builders, or whether we shall back into all the old bad habits, the old antagonisms, the doubts and the suspicions, the failure and the despair, that divide human beings from one another.",2010_12,0.273701615,FALSE,,uncertainty,0,0
0.614106789,0.385893211,"With our economy at risk, and our future in the balance, the greatest risk in this election is to repeat the same mistakes of the past. We can't take a chance on the same losing game. We need a President who will change this economy so that it finally works for your family. We need a President who will fight for the middle class every single day, and that's exactly what I'll do when I'm President of the United States.",2008-09-29-remarks-westminster-colorado_10,0.228213577,FALSE,,uncertainty,0,0
0.574914351,0.425085649,"Today they produce about 44 percent of what we produce, and yet they maintain a Communist defensive, a great military power, and increasing their power in Africa, Asia and Latin America.  I come as a citizen of the United States and say that what we are doing is not good enough.  It is my responsibility as leader of the opposition party in 1960 to state that the decision which the American people will make in 1960 is between a political party which looking at the world around us and at our country says it is good enough, and a political party looking at the world around us and our own country which says it is not good enough.  Our effort is not good enough.  We are not moving ahead fast enough.  We are not building our strength in relation to that of the Communists with sufficient vigor.  That is a decision which you as voters of the state of Kentucky will have to address yourselves to, to which party, to which political philosophy, to which viewpoint, do you believe, after making your own careful judgment?",1591_8,0.149828701,FALSE,,uncertainty,0,1
0.403246714,0.596753286,"These aren't Democratic values. These aren't Republican values. They're American values. We believe in them. They're who we are. And if we honor them, if we believe in ourselves, we can build an America that's stronger at home and respected in the world.",2004-07-29-national-convention-boston_65,0.193506572,FALSE,,uncertainty,0,0
0.478579654,0.521420346,"Every day I think about how much is at stake for this country. This isn't just the fight of my life, it's the fight ofour lives – together – to save our country. I refuse to let another generation of American children be excluded from the American Dream. Our whole country loses when young people of limitless potential are denied the opportunity to contribute their talents because we failed to provide them the opportunities they deserved. Let our children be dreamers too.",2016-08-18-charlotte-north-carolina_12,0.042840693,FALSE,,uncertainty,1,1
0.386693848,0.613306152,"And we didn't take that long, slow, sad walk through the streets of Atlanta behind the body of Martin Luther King to hear today, sixteen years later, that the march for civil rights and economic justice is over, when we know it has just begun. Now, I've been pretty tough on Mr. Reagan.  He said something the other day that I agreed with in part.  He said, """"You ain't seen nothing yet.""""  And when you look at his administration, when it comes to civil rights, we ain't seen nothing at all.  When it comes to jobs and economic opportunity, we ain't seen nothing yet.  When it comes to human rights, we ain't seen nothing yet.  When it comes to any of those things that call for a just and caring president, something he ought to have done, we ain't seen nothing yet.  And if he's re-elected, if you think he's done damage to that Supreme Court, you ain't seen nothing yet.  And if you don't like what he tried to do to Social Security and school lunch and student loans and help for the poor and the disadvantaged and the handicapped, re-elect him and you ain't seen nothing yet.  If you didn't like the way they handled that tax situation, where if you make $200,000 dollars a year, he gave you $60,000 in tax relief; if you made $30,000 a year or less, all things considered, your taxes went up; where they gave the rich a free Lincoln every year and the poor a hubcap; elect Mr. Reagan, and you haven't seen anything yet.",2715_13,0.226612305,FALSE,,uncertainty,0,0
0.4678604,0.5321396,"And in that connection, let's just set the record straight.  My opponent has--and again I quote him, and I'm going to quote him without notes, because I know what he said.  He has referred to the fact that in education in America, education in America has become second, that science in America is second.  He has said that our economy is going to become second, that we're drifting away as far as our prestige.  He has also indicated that as far as the U.S. position generally in the world is concerned, that we've been standing still, and that our opponents have been moving ahead.  It's time to set the record straight, and I set it straight today.  ",1833_11,0.0642792,FALSE,,uncertainty,0,0
0.4372261,0.5627739,Now we are faced with perhaps the greatest challenge in our nation's lifetime. Will our naval strength and our maritime strength grow once again to the level required by a great and strong nation? Will we be able to bring back to our shores the vital imports which fuel our transportation system and provide the raw materials for our industries? Will we be able to deliver our export products to foreign buyers? Will the world's greatest land power--the Soviet Union--preempt our traditional maritime supremacy?,2681_18,0.1255478,FALSE,,uncertainty,0,0
0.385582253,0.614417747,"So every time you see an ad, """"that one vote"""" ought to be a paid political commercial for Bob Torricelli and everybody else who had the courage to put America's future over short-term demagoguery. We're better off today than we were four years ago. How could anybody dispute that?",3224_10,0.228835494,FALSE,,uncertainty,0,0
0.475200064,0.524799936,"Last week, he blamed OPEC for unemployment. Mr. Carter is simply wrong--Japan and West Germany import almost all their oil, and their unemployment rates are less than ours. But more important, he doesn't want to take responsibility for the effects of his own policies. As I said earlier, anyone who can't--or won't--learn from the past is doomed to repeat it. Look at the high unemployment, high inflation, and high interest rates which surround you and ask yourself: can you really afford four more years of this?",2678_6,0.049599873,FALSE,,uncertainty,1,1
0.000261482,0.999738518,There is only one goal worthy of their hopes: a drug-free America. No compromise. No excuses. No uncertainty. No ambivalence.,3314_34,0.999477035,FALSE,FALSE,random,0,0
0.438306174,0.561693826,"At a moment like this, the last thing we can afford is four more years of the tired, old theory that says we should give more to billionaires and big corporations and hope that prosperity trickles down to everyone else. The last thing we can afford is four more years where no one in Washington is watching anyone on Wall Street because politicians and lobbyists killed common-sense regulations. Those are the theories that got us into this mess. They haven't worked, and it's time for change. That's why I'm running for President of the United States.",2008-10-27-campaign-closing-argument_7,0.123387653,FALSE,,uncertainty,1,0
0.486804049,0.513195951,"Some of you may recall that I, after taking the oath of office, said, """"I have not been confirmed by your ballots, but I ask that you confirm me by your prayers."""" You did, and things have been turning for the better in America. We have gone through a tough economic problem, but inflation is cut less than half. We have four million more jobs today than we had eighteen months ago. We, I think, have restored trust and faith in the White House. And I'm proud to say that there's not a single young American fighting or dying on any foreign soil today.",2533_6,0.026391903,FALSE,,uncertainty,0,0
