,Unnamed: 0,Speech_id,par_id,text,party,term,comp,label,drawn,high_pride_yl,low_pride_yl,auth_yl,high_pride_bb,low_pride_bb,auth_bb,disagree
164,164,2004-09-27-education-springfield-ohio,52,"[At this point, Mr. Tombaugh made brief remarks.] The President. Yes, see, one thing that's important about accountability is it lets you determine whether the curriculum you're using is working. If you're using a lousy curriculum, you're going to get lousy results. And it helps schools adjust. It helps teachers understand whether or not the systems they use work. This is a tool. This is a helpful tool. Measurement is good. I've heard all the excuses. Listen, I was a Governor at one time, and you heard them all, """"Oh, all they're doing is teaching the test""""—I'm sure you've heard that—or """"They're testing too much.""""",rep,2004,TRUE,not populist,randomly,0,0,0,0,0,0,0
165,165,1377,35,"The advertising men who manage the President's campaign get paid on a fixed return that hasn't been changed for fifty years. They would be outraged at the thought of a flexible fee. They, too, have a support price.",dem,1956,FALSE,not populist,randomly,0,0,0,0,0,0,0
166,166,2023,6,"Well, we have a big program ahead of us, and I'm not going to try to take up the whole evening of that program.  This is a gala.  This is supposed to be a lot of fun.  And I know my friend Buddy Hackett is over here, and he is going to do a job for us tonight .  We are looking forward to that.  I'm going to get right down to business tonight, because we have some business to do tonight.",dem,1968,FALSE,not populist,randomly,0,0,0,0,0,0,0
167,167,2007,6,"Now, Ralph would be here except for one reason:  I appointed him to go to the Interparliamentary Conference.  I don't know, I guess I wasn't quite so sure I was going to get the nomination or I wouldn't have sent him away.  But, he is a very prominent senator and we like to have good people represent our country abroad in these international conferences and he is away, but he will be back, and if any of you need to have a little political injection, Ralph has told me that he is prepared with the needle to do the job and he will be back here to help us out.",dem,1968,FALSE,not populist,randomly,0,0,0,0,0,0,0
168,168,2834,13,"Now, my opponent by the way, seems to have that liberation confused with the Soviet invasion of Afghanistan. He said what we did in Grenada eroded our moral authority to criticize the Soviets. I've never had any problem criticizing them. ",rep,1984,FALSE,not populist,randomly,0,0,0,0,0,0,0
169,169,3325,6,"I understand he went to sleep reading mine--and Howard's. So let's lay it out on the table, folks. This is about America, and it's about America's future. And I certainly don't want to offend any Democrats here. My parents were Democrats, and they're the best people I even knew. In fact, they didn't change for a while. And now they're both gone. But this is important business. This is not partisan. It's not about Bob Dole. It's not about Bill Clinton, as I said. It's a decision you will make. And Tennessee, as Howard pointed out and Jimmy pointed out, is a key battleground state. If we win Tennessee and Kentucky we're going to be there. We may get there another way, but I know we'll be there if we win Tennessee and Kentucky. And that means getting out the vote. It means encouraging people to take a look at our economic plan. This is not a gimmick.",rep,1996,FALSE,not populist,randomly,0,0,0,0,0,0,0
170,170,2004-10-09-st-louis-missouri,11,"And he'll do something else, what's needed. The high cost of medicine is making it hard for small businesses to expand, for people to keep their health care. He understands like I understand, these frivolous lawsuits are driving good doctors out of business and driving up your cost of medicine.",rep,2004,FALSE,not populist,randomly,0,0,0,0,0,0,0
171,171,1802,9,"This means we can never be satisfied with what we're doing because the situation changes, we've got to take advantage of new inventions as they come along, we've got to step up our defense forces as the Soviet Union moves in new directions, we've got to be sure that the time never comes that an American President is at a conference table where the man on the other side of the table says """"I'm stronger than you are and I can blackmail you.""""  And so, one, we will keep America strong militarily, and the second thing we will do is this.  We will be firm in our diplomacy.  We know this man as I emphasized.  We know that he doesn't react like the leaders of the free world.  We know that the naive and well-intentioned people who suggest that a concession here or a concession there will lead to peace forget the lessons of history.  My friends, we learned in Korea, we learned in dealing with Hitler, that whenever you're confronted with a dictator the way to peace is to strengthen strength and firmness, and the way to war is through weakness, both militarily and diplomatically.  We stand for strength and firmness and that's what we're going to continue, and that's what the American people are going to vote for on November 8th. ",rep,1960,FALSE,not populist,randomly,0,0,0,0,0,0,0
172,172,2751,25,"Never in modern history has there been a choice or a difference like this facing the American people.  When you reach for that voting lever, you actually hold your future and our future in your hands. If you pull their lever, you will pave the way for government intrusion into the most intimate decisions of your life.  But if you don't want politicians writing your prayers, running your private lives, then pull the lever that says Mondale-Ferraro.",dem,1984,TRUE,not populist,randomly,0,0,0,0,0,0,0
173,173,955,24,"I presume he has not had the opportunity I have had to observe their growth and great accomplishments during the past twenty years. He has picked up these strange ideas from the men around him--bitter obstructionists who oppose these programs in Congress and who seek now to divert attention from the record with baseless, hollow warnings about iron-fisted regimentation, and a sinister government. In short, the General has fallen victim to the same old Republican oratory we've been hearing for the past twenty years.",dem,1952,FALSE,not populist,randomly,0,0,0,0,0,0,0
174,174,1764,7,"And, as Mr. Khrushchev is visiting the United States today as he is attending the United Nations' General Assembly, it is well for us to look at the meeting there and to look at him to see what kind of man we are dealing with and what kind of policy America must follow if we are to avoid war. So, first, because he is a man who understands power and respects it, because he is a man who will use power if he can get away with it, to accomplish his ends, we must make sure that he never believes he is strong enough and that we are weak enough that he could start something without risking national suicide on his own part. And, so, the first necessity of leadership in these critical years ahead is that the United States must continue to be what she is today--the strongest nation in the world.  And, my friends, we must continue to maintain that advantage that we presently have, and the next president must be prepared to ask the American people for whatever was necessary to maintain it because through that strength in our hands, we serve the cause of peace.  We serve it because we will never use it in aggression.  We will only use it to deter those who would threaten the peace or threaten the freedom of others.",rep,1960,TRUE,not populist,randomly,1,0,0,1,0,0,0
176,176,1598,13,"Franklin Roosevelt said in his second inaugural address, """"This generation of Americans has a rendezvous with destiny.""""  I believe in 1960 a new generation of Americans who fought for freedom on all fronts in World War II have now come to where they have a rendezvous with destiny, that their generation must bear its responsibilities of leadership.  I want Khrushchev to know that a new generation of Americans has assumed the leadership, a generation of Americans that is not satisfied to be second best, that wants to be first, not first, if, but, when, or sometime, but first, period.  ",dem,1960,FALSE,not populist,randomly,0,0,0,0,0,0,0
177,177,3345,31,"And why doesn't John Huang...[missing text]...this guy that made, raised four or five, who knows how many million dollars, from all these foreign sources--have a press conference--tell the American people where the money came from. First they said they would. Now they say they won't. First they said they would. Now they say they won't.",rep,1996,FALSE,not populist,randomly,0,0,0,0,0,0,0
178,178,2083,12,"VOICES:  Boo, boo, boo, boo. VICE PRESIDENT HUMPHREY:  That third-party candidate has two issues, two issues that he talks about. VOICES:  Law and order.",dem,1968,TRUE,not populist,randomly,0,0,0,0,0,0,0
179,179,2938,5,"And Harry Truman went out all across this country, campaigned up and down and across America, and even election night, the """"Chicago Tribune"""" in one the most famous front pages ever in the history of this country, put out an early edition saying, """"Dewey Defeats Truman."""" My friends, it's not the pollsters who vote on Election Day, it's the people.  And I think the American people are getting a little tired of being told how they're going to vote.  They're going to make the decision.",dem,1988,TRUE,not populist,randomly,0,0,0,0,0,0,0
180,180,3295,6,"And she said, I don't mind those people having that debate back there, but if we're really going to be pro-life and pro-child, I wish they'd all come along with me and adopt some of these kids. We need to build a better life. And not very long ago I had the honor of signing the minimum wage bill, which Senator Harkin talked about, which also did some wonderful things for small business--made it easier for small business people to take out pensions on themselves and their employees, and for employees to take the pension from job to job, and made it easier for self-employed people to buy their own health insurance, and gave them more tax relief for doing it. But that bill had another little-known provision, which I'm particularly proud of. And on the day I signed that bill I thought of that woman holding that child, because that bill gives a $5,000 tax credit to Americans who will adopt children who need a home.",dem,1996,TRUE,not populist,randomly,0,0,0,0,0,0,0
181,181,1649,9,"My judgment is that the Republican party as presently constituted and presently led has not demonstrated either in the past or during this campaign that they have this kind of competence.  Mr. Nixon could not run on the program that he runs on if he recognized our times.  He could not run on the program that our power and prestige is at its height, that of the communists at the lowest it has been, that everything is all right and being done in its proper measure.  The very fact that he chooses that as his campaign indicates that he could not suddenly reverse in 1961 and determine on action.  If he really believes these things he says, in my opinion he disqualifies himself.  If he does not believe them, and runs on that program, he makes the same mistake that Stanley Baldwin made in England in 1935 which almost destroyed Great Britain, by misleading the people of England in 1935.  He prevented them, by not telling them the truth, he prevented them from arming at a time when it might have been possible to prevent the disaster of Munich.",dem,1960,FALSE,not populist,randomly,0,0,0,0,0,0,0
182,182,3311,13,"If we are going to get a handle on crime, teen pregnancy, drugs--all these things that threaten young people, we better take a look at education. We better break this hammerlock the unions and the bureaucrats have on education, and give the schools--and give the schools--we are going to give the schools back to the teachers and back to the parents. That's where they ought to be: back to the teachers and back to the parents.",rep,1996,FALSE,not populist,randomly,0,0,0,0,0,0,0
183,183,2004-10-25-remarks-greeley-colorado,37,"The President. He believes that instead of leading with confidence, America must submit to what he calls a """"global test."""" Audience members. Boo-o-o!",rep,2004,TRUE,not populist,randomly,0,0,0,0,0,0,0
184,184,3198,19,"Let me just mention something else. When Dawn introduced me and talked a little bit about herself, I thought to myself: I wonder how many nontraditional students there are who have to balance work and school and taking care of kids. I bet a lot of you do. I never go into a crowd of ordinary Americans that I don't hear somebody talk to me about how one of their biggest concerns is how they can succeed in their work life and succeed in raising their children in their home life.",dem,1996,FALSE,not populist,randomly,0,0,0,0,0,0,0
185,185,2004-10-16-beach-florida-0,0,"The President. Thank you all for coming. Thank you all for being here on a beautiful Florida Saturday afternoon. Laura and I are honored so many came out to say hello. We're here to ask for your vote and ask for your help. As Jeb said, it's nearly voting time, and we're counting on you to get your friends and neighbors to the polls. Everybody ought to vote in this country. In a democracy, we have a duty to vote. So round up everybody you can find, head them to the polls, and remind them, if they want a safer country, a stronger country, and a better country, to put me and Dick Cheney back in office.",rep,2004,FALSE,not populist,randomly,0,0,0,0,0,0,0
186,186,2004-09-10-discussion-portsmouth-ohio,106,"Let me spend a little time on Afghanistan. I think it's such a hopeful story. First, we're safer. See, Al Qaida trained thousands of people in Afghanistan. They found a soft spot, is one way to describe it, and they exploited it. And they—Al Qaida loved the Taliban. These guys were so backwards, it's unbelievable. They'd whip these mothers in town squares, and they wouldn't educate the girls. That's their view of the future. Imagine a society that's like that. No wonder these thugs were able to burrow in, into that society. They were parasitical. They were like parasites with the idea of eventually becoming the host themselves.",rep,2004,FALSE,not populist,randomly,0,0,0,0,0,0,0
187,187,1689,5,"Do you know that ten years ago we brought more foreign students to the United States than we do today under the governmental program?  Do you know the Soviet Union broadcasts ten times as many programs in Spanish to Latin America as we do?  Do you know we had more people stationed in West Germany in 1957 than throughout all of Africa?  I don't believe that this administration has been foresighted.  I don't believe that they have understood the kind of revolutionary world in which we live.  If they had, we would not be second in space.  We would not find ourselves today with six new countries of Africa, all members of the United Nations, that do not have a single U.S. diplomat in residence in any of the countries.",dem,1960,FALSE,not populist,randomly,0,1,0,0,1,0,0
188,188,2016-11-02-fairgrounds-orlando-florida,2,"That I can tell you because we have worked very hard, all of us, you, me, everybody. And it's very historic what's happening. I'd like to begin today by thanking all of you for joining me. This has been an incredible journey and we've all done it together. We're almost at the end.",rep,2016,FALSE,not populist,randomly,0,0,0,0,0,0,0
189,189,3202,31,"If we do it wrong, the present system will be better for the poor than the new system. But the problem is, the old system would never let people be liberated. If we do it right, we can liberate people who have been isolated and downtrodden and ignored and turned away from, and we could ease our conscience by saying, well, at least they're getting a welfare check.",dem,1996,FALSE,not populist,randomly,0,0,0,0,0,0,0
190,190,2932,3,George Bush doesn't care that working women earn only 64 cents for every dollar that men earn.  I want to put equality where it belongs--in your paychecks. George Bush doesn't even know that almost 40 million Americans--mostly working people and their families--don't have a dime's worth of health insurance.  I'm going to make sure that every job in America comes with basic health insurance.,dem,1988,TRUE,not populist,randomly,0,0,0,0,0,0,0
191,191,3097,18,"Not far from here, you know, is the birthplace of Will Rogers, the man who said he wasn't a humorist, he just watched the government and reported what happened. Well, I don't know what he'd say about Governor Clinton. Maybe he would say that here's a guy with the gall to promise the moon to America while the sky is falling down in his own backyard. But I really believe we can do better, and I say America deserves better. ",rep,1992,FALSE,not populist,randomly,0,0,0,0,0,0,0
192,192,2749,2,Did you see the debate last Sunday night?  That was the beginning of the victory march for the Mondale-Ferraro campaign.  This race is now red-hot.  The crowds are getting bigger.  The Republicans are getting more nervous.,dem,1984,FALSE,not populist,randomly,0,0,0,0,0,0,0
193,193,3286,33,But America has been different and America must be different. That's why when people start expressing their hatred of the federal government I stood up for the federal employees and reminded people they're our friends and neighbors--they're people like Sylvester. They're our neighbors and friends.,dem,1996,FALSE,not populist,randomly,0,0,0,0,0,0,0
194,194,3212,27,"Folks, I look at this community, I look at this school, I remember everything I've read about it. I saw that Air Force Colonel bragging on you. I know you sent student volunteers to work in the White House. I think of all the things you have done and built here, and it looks to me a pretty good picture of what America ought to be like as we start the twenty-first century.",dem,1996,FALSE,not populist,randomly,0,0,0,0,0,0,0
196,196,2775,31,"Well, wherever the new patriotism came from, there can be no gainsaying its arrival. Maybe you've seen the television show """"Call to Glory"""" that celebrates Air Force officers serving in the """"twilight struggle"""" of the cold war. Or maybe you've heard country singer Lee Greenwood's new song, """"God Bless the U.S.A.,"""" whose first verse says it so well:",rep,1984,FALSE,not populist,randomly,0,0,0,0,0,0,0
198,198,1054,5,"I think, regardless of political considerations, that it is essential that if we are going to win in the long term this conflict with Communists--this conflict with a society that seeks to spread itself over the entire globe--that we must recognize that until we find the means--and until we find cooperation in the means of restoring a sense of well-being to peoples who know little of freedom in the terms that we understand it, that we will have a very threatening and a hostile enemy. That is why one can believe that the importance of bolstering our defenses by the foreign aid programs--Point Four, and things of that kind--are essential if we are going to hope to frustrate the designs of this godless tyranny throughout the world. I thank you so much for affording me this opportunity of participating even briefly in the ceremonies. I count you very fortunate indeed to have this splendid housing development in your neighborhood; and I can add that I am very jealous of it. I should like to be participating in a similar project in Chicago where we too have desperate need of the advantages of public housing.",dem,1952,TRUE,not populist,randomly,0,0,0,0,0,0,0
199,199,2624,9,"Later in 1961, Medicare was proposed to give our senior citizens a chance for some medical care when they reached the retirement age if they didn't have much money. My Republican opponent, Ronald Reagan, an employee of the anti-Medicare lobby, went around this nation making speeches, and he referred to Medicare as socialism--""""socialized medicine,"""" he said. Now he's against national health insurance.",dem,1980,FALSE,not populist,randomly,0,0,0,0,0,0,0
200,200,2004-09-27-education-springfield-ohio,24,"See, I believe that we're recognizing the world is changing, and make sure the systems of Government change with the world so people can realize their dreams. We've created—will help to create a hopeful society, but you can't be a hopeful society unless this economy grows. Now, listen, I want you to remind your friends and neighbors what we've been through when it comes to this economy. We went through a recession. As a matter of fact, the stock market started to go down months before Vice President Cheney and I showed up in Washington, and then we had a recession. We started to recover from the recession, and we found out some of the citizens of this country forgot what it meant to be a responsible person. In other words, they didn't tell the truth. And those corporate scandals shook our confidence, make no mistake about it. By working with Members of Congress and in the Senate, we passed tough laws, and we made it abundantly clear that we will not tolerate dishonesty in the boardrooms of America. And then the enemy hit us, and it cost us jobs.",rep,2004,TRUE,not populist,randomly,0,0,0,0,0,0,0
201,201,2004-10-25-remarks-greeley-colorado,14,"Now we are nearing the first Presidential election since September the 11th, 2001. The people of the United States will choose the leader of the free world in the middle of a global war. The choice is not only between two candidates; it is between two directions in the conduct of the war on terror. Will America return to the defensive, reactive mindset that sought to manage the dangers to our country?",rep,2004,FALSE,not populist,randomly,0,0,0,0,0,0,0
202,202,3090,2,[AUDIENCE MEMBERS: Four more years! Four more years! Four more years!],rep,1992,FALSE,not populist,randomly,0,0,0,0,0,0,0
203,203,1266,7,"But finally and more important than that, ladies and gentlemen, in the last few weeks I have gone up and down the length of this land.  I have promised farmers that when they have problems, bring those problems to Washington.  If the United States chooses to place on me and my associates in this crusade the responsibility for conducting the national governmental affairs during the next four years, each of these problems will be solved only after complete consultation with the people affected.  I have made that promise and that pledge to farmers.  I have pledged that to labor.  On Labor Day I said, """"The pledge that this crusade makes you is this:  We would be firm, we would be just, we would be fair, but we will be friendly.""""  Now, ladies and gentlemen, this is what I should say that a new administration could do instantly on this problem.  Not only could they bring in advice, general advisors and consultants on the whole problem of promotion of small industries throughout our country, but they could bring in specifically, from this area people of management and business and investment and labor, the men who are working and out of work, bring them in and say, """"Let us find out what we can do here, what can the federal government do legitimately without interfering with your lives, but in a friendly, helpful sort of way that will both to the benefit of the federal government and to this city.""""",rep,1952,FALSE,not populist,randomly,0,0,0,0,0,0,0
204,204,1805,6,"That strength we must maintain.  Why?  Not because we are for war, because we are not; because we are for peace, because we are the guardians of peace, and because it is essential that as guardians of peace, America must have strength that will discourage any of those who would threaten the peace of the world--and I can assure you that decisions which will be made if I have the opportunity to make them, will be ones that will always put the security of America first.  That must come before any other consideration, and there will never be a dollar sign on what Americans will be able to do in the field of protecting the defense of this country.",rep,1960,FALSE,not populist,randomly,0,0,0,0,0,0,0
205,205,3259,23,"This is very important. And that's why I have spent so much time on religious freedom; why I've spent so much time on this church burning; why after the Oklahoma City incident I tried--first of all, you remember, there were all these people who said, oh, this must be some terrorist attack from the Middle East. I said, don't jump on those people, there's no evidence of that yet. And it turned out to be a problem here at home.",dem,1996,FALSE,not populist,randomly,0,0,0,0,0,0,0
206,206,1285,32,"It is up to you, the voters of America, to see that their rule is broken. Like Belshazzar, they have had their feast.  And like Belshazzar, they have begun to see the handwriting on the wall.",rep,1952,TRUE,not populist,randomly,0,0,0,0,0,0,0
207,207,2634,13,"I'm proud that we've been able to extend peace not just for our own people but to others around the world. But my most important single commitment, the greatest commitment of this nation, is to prevent nuclear war. We must continue our progress in careful, balanced, verifiable control of nuclear arms. That's the great overriding issue of this campaign. The greatest legacy we can leave our children is a world at peace. Peace is my passion and with your support and for the next four years, peace is my pledge to you.",dem,1980,FALSE,not populist,randomly,0,0,0,0,0,0,0
208,208,2957,1,"I want to talk today about that economic growth. About the challenges we face in a fast-changing world as we near--not just a new decade, but a new century. About our economy and how to keep it strong.",rep,1988,FALSE,not populist,randomly,0,0,0,0,0,0,0
