,Unnamed: 0,Speech_id,par_id,text,party,term,comp,label,drawn,high_pride_yl,low_pride_yl,auth_yl,high_pride_bb,low_pride_bb,auth_bb,disagree
7,7,2157,12,"We find that unless there is a change, a real revolution in terms of institutions in Latin America, our friends and neighbors in the south by the end of this century will be destined to be a permanent depressed area of the world with their per capita income one-fifteenth--that is what it will be--of that of the people of the United States of America. So you see the seeds of revolution that are there potentially in the future, unless new policies are developed. We turn to the Mid-East. The Mid-East was a troubled place then. It is a troubled place now, but the difference is a new dimension that has been added to that struggle. Then the Soviet Union was not stirring up the trouble and today it is. But for what the Soviet Union did before the June war, there would not have been a June war. But for what the Soviet Union has done since the June war in rebuilding the forces of the U.A.R. and Syria, there would be no serious threat of another war in the next two or three years.",rep,1968,TRUE,not populist,randomly,0,0,0,0,0,0,0
8,8,1174,32,"The program I have outlined demands skilled and purposeful leadership. It demands harmony and understanding between the executive and legislative branches of our government. It will demand an end to what the Senate Preparedness Subcommittee has called """"abuse, misuse and disuse of power.""""",rep,1952,FALSE,not populist,randomly,0,0,0,0,0,0,0
9,9,2097,54,"Now, let's just talk together a little bit about this American family of ours. There are people in this country that are fearful, there are whites who fear blacks and there are blacks who fear whites, and there are those who spread this doubt, and they spread this suspicion, there are angry voices. We Americans have to understand that we have ways and means of working out our difficulties without anger, without hate, without doubt, without suspicion.",dem,1968,TRUE,not populist,randomly,0,0,0,0,0,0,0
10,10,2016-10-22-plane-pittsburgh-pennsylvania,16,"I am going to keep talking about what we want to do, what we think the country de-serves from the next president and vice president. And actually when it comes right down to it, that is what I think people end up voting on. Thank you all very much.",dem,2016,FALSE,not populist,randomly,0,0,0,0,0,0,0
12,12,3232,17,"Now, let me say one other thing. Mr. Lampson's opponent and a lot of other people made a lot of headway four years ago, going out to Texans and to people in my home state and around the country saying, well, that fool President's trying to take your gun away. That's what that Brady Bill's all about. That's what that assault weapons ban's all about. He wants to take your gun away. He's going to interfere with your Second Amendment rights. And you know, no one knew in 1994, and it was pretty scary.",dem,1996,FALSE,not populist,randomly,0,0,0,0,0,0,0
13,13,3365,23,"Let me say a word--I don't see any seniors here. But if one shows up, I want you to pass this on. He talks about Medi--well, Medi-scare, we call it--he talks about Medicare and what Bob Dole would do to Medicare and what I would do to student loans.",rep,1996,FALSE,not populist,randomly,0,0,0,0,0,0,0
14,14,1945,22,"Let's say to these men of little faith, the doubters and the critics, who sometimes become frustrated and other times become bitter--let's say, """"Let's turn the other cheek,"""" and say, """"God forgive them, for they really know not what they do."""" Here in New York, the leading state in the union, let all the people of all religions, of all ancestries, regardless of how they spell their name, of all colors, of all faiths--yes, of all parties--let us, as good Americans first, do not what is just good for the Democratic party, or the Republican Party. Let us on November 3rd go and do what each of us in our own conscience tells us is best for our beloved America.",dem,1964,TRUE,not populist,randomly,0,0,0,0,0,0,0
15,15,2012-10-11-rally-miami-florida,36,This is the choice that we now face. This is what the election comes down to. This is why I'm running for a second term as President.,dem,2012,FALSE,not populist,randomly,0,0,0,0,0,0,0
16,16,2004-09-22-remarks-latrobe-pennsylvania,32,"Audience members. Boo-o-o! The President. He wants the Government to decide. When it comes to health care, I want you to decide. More than half of the Americans who are currently uninsured are small-business employees and their families. We've got to change law to allow small firms to pool together so they can purchase insurance at the same discounts that big businesses get.",rep,2004,TRUE,not populist,randomly,0,0,0,0,0,0,0
17,17,2016-09-16-symposium-washington-dc,12,"We're going to fight for the parents struggling to balance family and work and push for affordable child care, paid family leave, and yes, finally, equal pay for women. We'll fight for the young girls who want a fair chance in life, which is why we'll make universal pre-k available so that every child -- no matter what they look like or where they live -- can rise up and be prepared to fulfill their academic destiny. We are also going to do a lot to emphasize STEM education, particularly for girls and women, and I thank the agenda for making that a priority!",dem,2016,TRUE,not populist,randomly,0,0,0,0,0,0,0
18,18,3090,11,"Now, I want you to listen closely to him this fall, but you're going to do that, because on issue after issue he takes one position and then another. He's been spotted in more places than Elvis Presley on these issues. Let me give you some specifics. Take the issue, the question of whether to stand up to Saddam Hussein, the defining test of American leadership in the post-Cold War world. Two days after Congress followed my lead--and I had to fight to get them to do that--he said, and I quote, """"I guess I would have voted with the majority if it was a close vote. But I agree with the arguments the minority made.""""",rep,1992,FALSE,not populist,randomly,0,0,0,0,0,0,0
19,19,2016-11-07-grand-rapids-michigan,21,"And now, now we've got to come together and we have to prove we can meet the chal-lenges of our time. We've got to get the economy working for everybody, not just those at the top. If you believe, as I do, that America thrives when the middle class thrives, then you have to vote tomorrow.",dem,2016,TRUE,not populist,randomly,0,0,0,0,0,0,0
20,20,2939,7,They want you to forget that when the South Dakota legislature flew to Washington they wouldn't talk to them.  Remember that? They want you to forget that the value of farm exports is down $15 billion over the course of the past eight years.,dem,1988,TRUE,not populist,randomly,0,0,0,0,0,0,0
21,21,2492,19,"We have our problems, but in the last two troubled years we've come a long, long way. Our long national nightmare is over; four million new jobs have been created in less than two years; inflation cut more than half; trust has been restored in the White House; America is at peace. At home as well as abroad; we are putting our old angers aside; we are putting our old problems behind us and healing our wounds.",rep,1976,FALSE,not populist,randomly,1,0,0,1,0,0,0
22,22,3116,18,"I need this change in Congress. The only defense I've had to help the taxpayer is vetoing thirty-three bills in the United States Congress, standing up for fiscal discipline. I'll tell you what, though: You give me that line-item veto; Congress can't do it. Then watch us get the job done. ",rep,1992,FALSE,not populist,randomly,0,0,0,0,0,0,0
23,23,2004-09-24-remarks-racine-wisconsin,8,"Listen, what I'm doing is I'm telling you thanks for the grassroots activists. All of the people who have put the signs and get on the telephones and encourage people to register and vote, thank you for what you're doing, and thank you for what you're going to do as you're coming down the stretch. We're going to carry the State of Wisconsin.",rep,2004,FALSE,not populist,randomly,0,0,0,0,0,0,0
24,24,907,4,"What ought to be done by government for the public welfare should be done. There should be no wistful dragging of the feet or turning backward to a dead, irrelevant past.  Government should be competent. Its personnel must not be under the heavy hand of purely political selection or influence. It must not be afraid of raising and spending money for worthy purposes, but it must detest and fear waste and dishonesty as ever present threats to the whole moral basis of government by the consent of the governed because people don't consent voluntarily to be cheated or abused. ",dem,1952,TRUE,not populist,randomly,0,0,0,0,0,0,0
25,25,2975,39,"As I mentioned earlier, a generation of wise men, bipartisan, of many different views, worked together forty years ago to lay the foundations of the post-war era. Now that we are facing a new world, a different era, it is time once more for Americans to come together. Because by working together, we can extend the horizons of a free and peaceful world.",rep,1988,FALSE,not populist,randomly,0,0,0,0,0,0,0
26,26,1903,45,"We're going to win because we have faith and because we have the support of the people and because we're builders and because we look forward to leaving this world a better place than we found it. Thank you for inviting us here. I wish I could stay all day, but I have two other engagements along the road down here in Arkansas and back in Texas tonight. But if you will invite me back sometime, I'll bring my boat and we'll have a good sail together.",dem,1964,TRUE,not populist,randomly,0,0,0,0,0,0,0
27,27,2075,46,"I want to tell you--I am not here to give speeches for mayors, but there isn't a mayor in America that has the resources that he needs for the jobs that need to be done.  And that is why we need federal aid to these cites.  And federal aid to the cities is helpful.  The property tax is breaking people in many of our cities.  And you know it.  The fairest tax is the progressive income tax.  That is the fairest one. ",dem,1968,FALSE,not populist,randomly,0,0,0,0,0,0,0
28,28,2063,19,"Three weeks from today, this nation will decide its future, not by force of arms, or by a coup d'etat, by the quiet, powerful force called the shuffle of ballots, entering the ballot box.  And I ask every person of voting age, and those who are not, to encourage all who are, to play your part in it. I entered politics some twenty years ago or more.  And the people who came into politics with me were called """"Humphrey's Diaper Brigade"""".  That's right.  We were a pretty young crowd.  And we are still around--a little the worse for wear, and maybe a little the better for some experience.",dem,1968,TRUE,not populist,randomly,0,0,0,0,0,0,0
29,29,1977,15,"It is not easy to keep the peace in the world, but for twenty years we have kept the peace.  We have turned back Communist aggression more than once.  We will continue to stand guard at freedom's gate.  This nation is respected because we use our strength with restraint, and we use our responsibility with judgment.",dem,1964,FALSE,not populist,randomly,1,0,0,1,0,0,0
32,32,2795,1,"I had an opportunity on the way here--on the plane--to talk to Ambassador Reg Bartholomew, who, although injured himself, expressed to me his pride on behalf of the dedicated Americans serving with him. And then, he was in the hospital and he said to me, """"We mustn't let things like this push us out of doing what we must do throughout the world."""" So, I know in this moment of anger and sorrow, our prayers are with those who are bereaved, and our commitment to peace remains firm. And I'm proud that our Americans in the Foreign Service, who are serving all over the world, are of the caliber and the quality that they are.",rep,1984,TRUE,not populist,randomly,0,0,0,0,0,0,0
33,33,2004-11-01-remarks-burgettstown-pennsylvania,10,The American President must lead with clarity and purpose. The role of the President is not to follow the path of the latest polls. The President must lead based on principle and conviction and conscience.,rep,2004,FALSE,not populist,randomly,0,0,0,0,0,0,0
34,34,1401,19,"This year, the soil bank is retiring over twelve million acres and earning a half million farmers more than $260 million dollars. When next year it retires forty to fifty million acres, overproduction will start coming under control. That means better times for every farmer.",rep,1956,FALSE,not populist,randomly,0,0,0,0,0,0,0
35,35,2000-10-30-remarks-muskegon-michigan,5,"Or we can just repeat the past like a broken record — letting the wealthiest Americans gorge themselves on tax cuts they don't need, and draining away the surplus you worked so hard to build. And I'm not going to let us be dragged back to sky-high deficits that would drive interest rates through the roof, and drive the economy back into a ditch. These are fundamental choices — not just about numbers and budgets, but about the character of our society.",dem,2000,TRUE,not populist,randomly,0,0,0,0,0,0,0
37,37,2012-10-05-rally-fairfax-virginia,25,"Now, my opponent has a different view. The other night, he said he'd repeal Obamacare as soon as he took office. Audience members. Boo!",dem,2012,TRUE,not populist,randomly,0,0,0,0,0,0,0
38,38,2070,14,"The crisis of our cities has come into full bloom.  There had been a festering crisis there for a long time, but now it is here and it cannot be ignored.  We are going to have to decide whether our cities are to be livable or whether we shall have to abandon them and we can't afford to abandon them because where shall we live?  We have to ask ourselves where are the next 100 million Americans going to live and how are they--how will they live?  There will be an additional 100 million Americans, you know, in the next twenty-five years.  Where are they going to live and under what conditions?",dem,1968,FALSE,not populist,randomly,0,1,0,0,1,0,0
39,39,2012-11-02-rally-lima-ohio,18,"Ruling out compromise, pledging to rubberstamp the Tea Party's agenda in Congress, not change. Trying to change the facts when they're inconvenient to your political campaign, that's definitely not change. That's what Governor Romney has been doing these last few weeks.",dem,2012,FALSE,populist,randomly,0,0,0,0,0,0,0
40,40,3293,21,"And more than anything else, you have to decide where we're going in the issues that will affect whether we can grow together. We did pass health care reform, but our balanced budget plan would give insurance to families who are between jobs for six months; would insure another million children; would give free mammograms to women on Medicare; would give respite care to the nearly two million American families caring courageously for a family member with Alzheimer's--all paid for. You get it in our balanced budget plan. They cannot do it. You have to decide.",dem,1996,TRUE,not populist,randomly,0,0,0,0,0,0,0
41,41,2743,6,This election is not about sending a teacher into space.  It's about educating our children right here on earth. This election is not about train rides and whistle stops.  It's about the ninety-thousand profitable corporations in America who don't pay a penny in taxes.,dem,1984,TRUE,not populist,randomly,0,0,0,0,0,0,0
43,43,2733,24,"Do you really believe there are winners in a nuclear war? Now, some people have declared this election over. They've announced a Republican landslide. In other words, they're telling you, your vote won't count. Your voice doesn't matter. This crowd doesn't want you to think about the stakes in this contest. They want to trivialize it.",dem,1984,TRUE,populist,randomly,0,0,0,0,0,0,0
44,44,2831,33,"Well, all right. I know you're all ready for this great new era of opportunity. And this may gall our opponents--the train's getting ready to whistle, and I have to move on to the next stop before darkness catches us...",rep,1984,FALSE,not populist,randomly,0,0,0,0,0,0,0
46,46,1412,1,"We are also deeply grateful that so many Americans have signed their names that they are determined to do their duty this fall in determining the course of America, and are going to get their friends to do the same. I cannot remember any birthday that has been quite so deeply meaningful to me as this one. I thank all of you--Mr. Percy and Miss Dunne particularly for being the chairmen of this great evening.",rep,1956,TRUE,not populist,randomly,0,0,0,0,0,0,0
47,47,3127,3,"Now, when we sit down to debate, and I hope the governor will take a stand to agree to them, we should discuss the most important question: What kind of America do we want for the young people here today? Because of your sacrifice, because of your commitment, we have helped reduce the fear of nuclear annihilation. Today, our kids can dream the sweet dreams of peace without fear of nuclear war. And I am proud that that happened when I have been president of the United States. You listen to Governor Clinton, you might think national security of this country and foreign affairs are not important. They are. We've changed the world. ",rep,1992,FALSE,not populist,randomly,1,0,0,1,0,0,0
48,48,3046,23,"You think about it. Look at what they're doing in their campaign. Every day Mr. Bush goes out and just creates another fairy tale. He pulls out his pocketbook, his wallet, and says, """"You'd better watch your pocketbook if you vote for Clinton."""" Now, remember, folks, remember, Bush increased spending by more than any president in over two decades. Bush asked Congress to spend more money than it did. He tried to outspend Congress. Can you believe that? Bush increased regulation by more than any president in two decades. My state has the second-lowest tax burden and the highest job-growth rate in America, and I'm the only person to ever balance a government budget. I'll tell you who's going to pick your pocket--George Bush. He did it once, and if you give him another chance, he'll do it again. But you know, we're not buying it this time. No more! No more! No more.",dem,1992,FALSE,not populist,randomly,0,0,0,0,0,0,0
50,50,2834,41,"REAGAN. Yes, helping students. Q. Okay.",rep,1984,TRUE,not populist,randomly,0,0,0,0,0,0,0
51,51,2976,4,"Mikhail Gorbachev has shown that he is a different Soviet leader, able to abandon aggressive policies when the price is too high. I've pointed out, however, that the price is determined by more than Moscow's economic dilemmas. The Red Army is leaving Afghanistan because the Mujahedeen, with our support, resisted aggression. The Soviets agreed to destroy their SS-20s menacing Europe when we and NATO defied their threats and deployed our Pershings and Cruises. And that led to the first treaty eliminating an entire class of nuclear missiles.",rep,1988,FALSE,not populist,randomly,0,0,0,0,0,0,0
52,52,2012-11-04-concord-new-hampshire,40,"And, New Hampshire, I'm here today because I'm not ready to give up on the fight. I know I look a little older, but I've got a lot of fight left in me. I am not ready to give up on the fight, and I hope you aren't either, New Hampshire. I hope you aren't, either.",dem,2012,FALSE,not populist,randomly,0,0,0,0,0,0,0
53,53,1270,17,"We must call upon the best minds of our nations to sit down with political and economic leaders of other nations to find solutions to the crucial problems of international economic policy.  I believe that the wrecking of the London Economic Conference of 1933 was one of the great, though little understood, tragedies of our modern world.  We must make a fresh start.",rep,1952,FALSE,not populist,randomly,0,0,0,0,0,0,0
55,55,2012-09-20-question-and-answer,79,"The President. Well, we've released almost all of them. The ones that we don't release typically relate to internal communications that were not related to the actual Fast and Furious operation.",dem,2012,FALSE,not populist,randomly,0,0,0,0,0,0,0
56,56,2004-11-01-dallas-texas-1,1,"Ten years ago when I first ran for Governor, I had my last campaign rally in Dallas, and we won. Tonight, after six other stops, I'm having my last campaign rally in Dallas, and we're going to win. I appreciate all your help and all your hard work. And I've got a pretty good feeling that Texas is going to be a red State tomorrow. You're going to start a trend.",rep,2004,TRUE,not populist,randomly,0,0,0,0,0,0,0
58,58,2004-09-04-remarks-erie-pennsylvania,21,"In changing times, we've got to make sure health care is available and affordable. Most of the uninsured in America—about 50 percent of the uninsured are small-business employees. These small businesses are having trouble affording health care. In the new term, we must allow small businesses to join together to purchase insurance at the discounts that big companies are able to get.",rep,2004,FALSE,not populist,randomly,0,0,0,0,0,0,0
59,59,2614,10,"This issue is the most important single issue in the campaign this year. Inflation is important. Unemployment is important. The progress of our nation economically is important. Education is important. But the most important single issue is the control of nuclear weapons. Every president since Harry Truman has worked under the most difficult circumstances to negotiate with the Soviet Union balanced, controlled, observable agreements to limit atomic weapons with the hope of reducing those weapons in the future.",dem,1980,FALSE,not populist,randomly,0,0,0,0,0,0,0
60,60,2505,19,"Q. This may seem like a broadcaster question, but it's really a public interest one in a way, and I know you're a sports fan. We've had a recent example here of where Home Box Office, a pay cable organization, was able to outbid local stations or an interested network in the NIT tournaments. And in a very short period of time it's estimated--perhaps in two or three years--pay cable is going to be able, due to its affluence and income, to outbid networks and local stations for much of the top and choice programming, including sports. And I'd like to ask you what your view is on the siphoning of free broadcast programming to pay cable?",rep,1976,FALSE,not populist,randomly,0,0,0,0,0,0,0
61,61,1870,1,"In fact, when I saw the tremendous crowd at the airport, I didn't believe there could be anybody down here at the rally, and, as I look around me and see all the Nixon girls on the right and the left, as I see this great throng here, as we saw the people as we came in waiting for us on the streets, it really moved us and touched our hearts, and we want you to know how much we appreciate what I understand is a good old-fashioned welcome.  I was delighted, too, prior to the time of coming on the stage, to hear you welcome enthusiastically my colleagues who are candidates on my party's ticket in this state. I particularly want to mention my friend, John Tower. You know, I have a pretty good deal of experience in seeing candidates, and I've seen a lot of candidates for the Senate around the country, Democrat and Republican. I will say that there is no candidate that I have seen who, from the standpoint of experience, background, and courage, is more qualified to be a U.S. senator from Texas than John Tower. And I use that word """"courage"""" advisedly. He's willing to run for one office alone. He doesn't ask for two. ",rep,1960,TRUE,not populist,randomly,0,0,0,0,0,0,0
62,62,2330,7,"Another reason this spending ceiling is needed is to enable us to fulfill our firm commitment to provide relief from property taxes.  When property tax relief comes, and it will come if the Congress cooperates with me now on harnessing runaway spending, the first to receive relief will be those who most need it. Today there are more than 1 million retired Americans over sixty-five.  They live in their own homes with an income of less than $2,000 a year.  They pay an average from $300 to $700 of that $2,000 in property taxes.  To allow that to happen to Americans who have worked all their lives to build this great country and to earn their retirement is a national disgrace.",rep,1972,TRUE,not populist,randomly,0,0,0,0,0,0,0
63,63,1039,6,"I am frank to say we have had very little cooperation from some of the veteran's posts. They are awful keen about this law enforcement, but they continue to use all these devices in their own posts. So it is a little incongruous. They say, """"By gosh, we are going to clean up crime in this community and get those slot machines out of that corner saloon. But of course, as far as our Legion Post, or VFW, or whatever it is, that belongs to us and it is certainly a different situation. And after all, the device is set to give the fellow at least a sixty to a hundred chance of winning as against one chance in a hundred in the commercial device; and, after all, we own the machine, and it is not owned by a syndicate of operators and placed on a rental basis."""" And so on and so on.",dem,1952,FALSE,not populist,randomly,0,0,0,0,0,0,0
64,64,2004-10-15-remarks-oshkosh-wisconsin,71,"Listen, I'll continue to build strong alliances during the next 4 years. Today, when I was flying in from out west, I had a good visit with Tony Blair, our strong ally. Alliances are important. Coalitions are important. But I will never turn over America's national security decisions to leaders of other countries.",rep,2004,FALSE,not populist,randomly,0,0,0,0,0,0,0
