,Unnamed: 0,Speech_id,par_id,text,party,term,comp,label,drawn,high_pride_yl,low_pride_yl,auth_yl,high_pride_bb,low_pride_bb,auth_bb,disagree
1,6,2396,10,"Another thing that we don't have in this country is plans for the future. President Ford and the Republican administration have no plans, no concepts in the field of energy. We're the only developed nation in the world that doesn't have a comprehensive energy program. We have no concept of what we hope to achieve in the field of transportation or agriculture or education or welfare or health or taxation. This is a devastating obstacle which prevents cooperation between the federal, state, and local levels of government and between government at all levels and the business and professional and labor and agricultural and educational and scientific communities. We've got to have clear plans to show us a goal so that we can reach them at the end of two years or four years or five years or ten years or even more. We did this in Georgia. It worked very well. It works in many other states, and it can and it will work in Washington.",dem,1976,FALSE,not populist,randomly,0,0,0,0,1,0,1
6,11,2012-09-25-york-city-12,35,"And it is because of the progress that I've witnessed in my own lifetime, the progress that I've witnessed after nearly 4 years as President, that I remain ever hopeful about the world that we live in. The war in Iraq is over; American troops have come home. We've begun a transition in Afghanistan, and America and our allies will end our war on schedule in 2014. Al Qaida has been weakened, and Usama bin Laden is no more. Nations have come together to lock down nuclear materials, and America and Russia are reducing our arsenals. We have seen hard choices made—from Nay Pyi Taw to Cairo to Abidjan—to put more power in the hands of citizens.",dem,2012,FALSE,not populist,randomly,0,0,0,1,0,0,1
11,42,2174,0,"These years of turmoil have shocked Americans into a recognition of how enormous are the social tasks ahead of us, and how urgent. Faced with an urban crisis, the first instinct of many has been to demand vast new government programs and vast new expenditures--whether a """"Marshall Plan for the Cities,"""" or a doubling of public housing funds or a government-guaranteed income for everyone. Yet even at best, these government programs would only scratch the surface of need. They would drain the federal treasury to soothe the public conscience, but they would fail--because they would leave untapped the greatest reservoir of neglected resources in America today: the energies and the spirit of the American people themselves.",rep,1968,TRUE,not populist,randomly,1,0,0,0,1,0,1
30,45,2160,12,"But if they don't end it by November 5th, then I say after four years of all that power and all that wealth and 200,000 American casualties, they've failed, then give us a chance and we will end the war on an honorable basis. That is what America wants. We will go beyond. Looking to the future we give you a new foreign policy. Not a continuation of the tired men of the past, but new men with fresh ideas. And one of those ideas is a very solid one. You know, this is a great country and a strong country. It's a rich country, and we have lots of people. But for the last twenty years, do you realize, and all of you who studied America know this, do you realize that we furnished most of the money, $150 billion, we furnished most of the arms and we furnished most of the lives in Korea and then in Vietnam to help other nations defend themselves against aggression.",rep,1968,TRUE,not populist,randomly,1,0,0,0,0,0,1
31,49,2016-10-12-pavilion-ocala-florida,108,"That's why I was so happy what we did to annihilate the enemy the other day. So happy. Because we're dealing against a very dishonest system. But Hillary, so important, wants to have a radical, and this is very radical, immigration. She wants to radicalize immigration where you have people pouring in. Remember this, the border patrol agents, 16,500 gave me their endorsement. Last week, ICE, ICE, these are great people, you don't hear great things because they're not allowed to do their job.",rep,2016,TRUE,populist,randomly,0,1,0,0,0,0,1
36,83,2282,13,I believe that America does care. I believe that we would rather build hospitals that can cure the sick than a plane that cannot fly. I believe that we would rather end poverty in America than continue the killing in Asia.,dem,1972,TRUE,not populist,randomly,1,0,0,0,0,0,1
42,118,2016-10-15-portsmouth-new-hampshire,5,"Instead of being held accountable, Hillary is running for President in what looks like a rigged election. The election is being rigged by corrupt media, pushing false allegations and outright lies, in an effort to elect her President. But we are going to stop it. We are not going to back down. We are not going to let it happen.",rep,2016,TRUE,populist,randomly,0,1,0,0,0,0,1
45,129,1032,10,"Well, the world passed them by. Since then, we have been through a Great Depression, a great recovery and a devastating war. And somewhere in this process America has fundamentally changed--a new view, a new compassion, a new faith has emerged. In a way it is a moral revival, and it has altered the tone and the meaning of our life. And how different a prospect faces a young man or a young woman of today from what faced the youth of my generation. The only or, most of all, the go-getter was the hero. Few cared about politics or public service -almost none who went through school or college with me took any positive interest in that, or have subsequently. Few had the sense of civil or social responsibility that we find today, when they were young.",dem,1952,FALSE,not populist,randomly,0,0,0,1,0,0,1
49,159,2116,13,Now we come to a new moment of crisis in that journey. We are called: to heal the hatreds and divisions among us; to reaffirm the basic decency of spirit which lies within us as people; to reassert this nation's moral leadership in a world that desperately seeks that leadership; to tell a new generation that what we have is good; that it is worth saving; that the dream of their parents is still a worthy dream.,dem,1968,TRUE,not populist,randomly,0,1,0,1,0,0,1
54,163,2004-10-24-alamogordo-new-mexico,17,I want to thank those who wear our Nation's uniform. I want to thank our great United States military. It's such an incredible honor to be the Commander in Chief of such a great military. And our military is great because of the character of the men and women who wear our uniform. I want to thank the veterans who are here today for having set such a great example. I want to thank the military families who are here for your sacrifice.,rep,2004,FALSE,not populist,randomly,0,0,0,1,0,0,1
57,195,2171,3,"That is why a searching look at the American spirit is needed today. The American spirit, as I envision it, is not the visitation of some ghost of the past; rather it is the affirmation of a deep national yearning that all of us feel today.Whenever America falls short, that spirit appears--not to comfort us, but to make demands on us. Not to salve our conscience, but to spur our conscience.Our history shows that as a people we have responded to these new demands each time they were made.",rep,1968,FALSE,not populist,randomly,1,0,0,0,1,0,1
67,221,1884,14,"I report tonight that we have spent $30 billion more on preparing this nation in the four years of the Kennedy administration than would have been spent if we had followed the appropriations of the last year of the previous administration. I report tonight as president of the United States and as Commander-in-Chief of the Armed Forces on the strength of your country, and I tell you that it is greater than any adversary. I assure you that it is greater than the combined might of all the nations, in all the wars, in all the history of this planet.  And I report our superiority is growing.",dem,1964,TRUE,not populist,randomly,0,0,0,1,0,0,1
83,233,2167,9,"And you want progress for all Americans. And the reason you are out, the reason you have taken to the streets in the right way, the peaceful way, and the reason you are going to have a peaceful revolution by your votes on November 5th is this: that you don't like what has happened to America over the past four years and you say we are going to have a change and you are going to give America a change. That's what's going to happen.",rep,1968,FALSE,not populist,randomly,0,0,0,0,1,0,1
95,241,2818,18,"So, good luck, and God bless you, and God bless this precious land of ours found by Christopher Columbus. Thank you all very much. Thank you.",rep,1984,FALSE,not populist,randomly,1,0,0,0,0,0,1
118,242,1786,14,"And so, how are we going to do it?  You must look at our record.  We have been a part of that record, and we're proud of it.  But again, we don't stand on it.  How do I say that we can do this job?  Well, first, when you look at my colleague and I, we know Mr. Khrushchev.  We have sat down across the conference table with him.  We know that he is a man who is ruthless and tough.  We know that you must never make him a concession unless you get a concession in return.  That's why President Eisenhower was right in not doing what Mr. Khrushchev asked him to do again in the paper this morning, in not apologizing and not expressing regrets to Mr. Khrushchev as Senator Kennedy suggested he might.  That is why the next president of the United States must recognize that Mr. Khrushchev does not react like Mr. Nehru, he isn't like Mr. Adenauer, or Mr. Macmillan.  He is a man determined to conquer the world and so, first, we will keep America strong--the strongest in the world.  Second, we will see that the economy of this country moves forward so that Mr. Khrushchev never will be able to get through on his boast that """"he is going to catch us.""""  Third, we will see that we are firm, but we will never be belligerent, because we realize that while we hold the line for principle, we must always negotiate for peace, but never, again, making concessions, as I say, which don't get concessions in return.",rep,1960,FALSE,not populist,randomly,1,0,0,0,0,0,1
122,243,2556,0,"I've got a question I want to ask you. Are we going to have a Democratic victory in South Carolina in November? I'm not going to speak but just a few minutes, because I want to spend as much time as I can shaking your hands and thanking you for your confidence in me and also, more importantly, for your confidence in the future of our nation. This is the greatest country on earth. We have never failed to meet any challenge or answer any question or solve any problem if the nation was united and if Democrats were in the White House and holding the major positions in this country. Right?",dem,1980,TRUE,not populist,randomly,0,0,0,1,0,0,1
129,245,2004-10-27-remarks-lititz-pennsylvania,24,"Our economy has been through a lot, and I want you to remind your friends and neighbors about these facts. First, 6 months prior to our arrival in Washington, the stock market was in serious decline, and then we had a recession. Then we had corporate scandals, and then the attacks of September the 11th cost us about a million jobs in the 3 months after that fateful day.",rep,2004,FALSE,not populist,randomly,0,1,0,0,0,0,1
137,1,2988,20,"Our people are pleading for change, but government is in the way. It has been hijacked by privileged, private interests. It has forgotten who really pays the bills around here--it's taking more of your money and giving you less in return.",dem,1992,FALSE,populist,randomly,0,0,0,0,0,0,0
142,30,1166,11,"In short the entire government will work for the good of 155 million people, not just for this group, for that group, but for all Americans.  Now, in this crowd, ladies and gentlemen, there are numbers of men who are my old comrades in arms.  Some of them may have fought in the Far Pacific; some may have had duties that kept them in the U.S.; many of them went abroad with me.  And I used to see those fellows along the roads, in the camps, sometimes at reviews, in their barracks, in their kitchen, wherever; and we used to talk about why we were fighting.  And we came to the agreement in simple terms that we were fighting to keep America the kind of land that we believe it to be--a land of freedom and opportunity, not a land dominated by a Hitler or by any group of bureaucrats.  The reason I am in this political campaign, my friends, is in a continuation of that promise.  I am trying to do my part to keep America the kind of country we have always known, which means first of all that you must have a government you can respect and other nations will likewise respect it because you do.  ",rep,1952,FALSE,not populist,randomly,0,0,0,0,0,0,0
152,31,1998,11,"Shall we let hope become frustration, impatience become violence?  Shall we turn things over to those--shall we turn things over to those who say they are going to burn this country down and then build things up their own way?  I think not.  There aren't many extremists in America, not many at all.  They are loud but they are few.  And those who listen to them are a minority, and if we let the extremists and the haters have their way in America, they will drag us all down.  But we don't intend to let them have their way.",dem,1968,FALSE,not populist,randomly,0,0,0,0,0,0,0
155,36,1193,16,"At a critical moment in World War II, we induced the Nazis to hold an entire army in reserve in the Calais area to meet an attack that they thought was coming but which we never intended to launch.  Measures to deceive them worked so effectively that they estimated our original strength in Europe at seventy-five divisions instead of the actual thirty-six. In the entire American record in Europe there is no single instance where the enemy gained essential information of our plans through the medium of spies or subversive agents.",rep,1952,TRUE,not populist,randomly,0,0,0,0,0,0,0
159,54,3300,3,"Today I went down to the train station to vote in the last election in which I will appear on the ballot. And as I have done in every year since she was born, I took Chelsea to the ballot with me. And as we looked at the ballot together and discussed the issues there, I thanked God that I was born an American.",dem,1996,FALSE,not populist,randomly,1,0,0,1,0,0,0
163,57,2016-11-03-winterville-north-carolina,37,"We are not going to accept the status quo. What happened to that church in Mississippi yesterday should not be normal. People painted """"vote Trump"""" on the side. And then they set it on fire. Who would do that to a house of worship? In America, that can never be acceptable. What happened in Flint, Michigan should not be normal or acceptable -- little babies, toddlers, children drinking water that was poisoning them. And there are too many young African Americans who are dying either in police incidents or from random gun violence. You know their names: Trayvon Martin, Eric Garner, Sander Bland, Key Scott. So many. We can't accept that as normal either.",dem,2016,FALSE,not populist,randomly,0,1,0,0,1,0,0
175,67,2648,5,"If the United States is to return to world leadership in its economic strength, the rebuilding program must be built on a strong industrial base--and steel is part of the foundation of that base. The steel industry of the United States has been forced into second-class status because shortsighted government policies have prevented it from investing enough money in new production equipment. The steel industry must be revitalized, must be made more competitive with foreign steel, must serve the interests of the American people better with lower-cost, more energy-efficient production. This is a major first step in the industrial revitalization of our country.",rep,1980,TRUE,not populist,randomly,0,0,0,0,0,0,0
195,95,2385,28,"""""The Magna Carta of Catholic charity was written on Mount Olivet, when Jesus Christ said to his disciples: 'For I was hungry, and you gave me to eat; I was thirsty, and you gave me to drink; I was a stranger and you took me in; I was in prison and you came to me... I say to you, as long as you did it to one of these my least brethren, you did it to me.'"""" That is the spirit that has made the Catholic Charities movement great. It is the spirit that can restore our national greatness. It is the spirit in which I come before you today.",dem,1976,TRUE,not populist,randomly,0,1,0,0,1,0,0
197,122,2418,19,"Two years ago America was mired in withdrawal from Southeast Asia. A decade of Congresses had shortchanged our global defenses and threatened our strategic posture. Mounting tension between Israel and the Arab nations made another war seem inevitable. The whole world watched and wondered where America was going. Did we in our domestic turmoil have the will, the stamina, and the unity to stand up for freedom?",rep,1976,FALSE,not populist,randomly,0,0,0,0,0,0,0
216,137,1318,14,"Don't misunderstand me. I, for one, am ready to acknowledge the sincerity of the Republican President's desire for peace and happiness for all. But good intentions are not good enough and the country is stalled on dead center--stalled in the middle of the road--while the world goes whirling by. America, which has lifted man to his highest economic state, which has saved freedom in war and peace, which saved collective security, no longer sparks and flames and gives off new ideas and initiatives. Our lights are dimmed. We chat complacently of this and that while, in Carlyle's phrase, """"Death and eternity sit glaring."""" And I could add that opportunity, neglected opportunity, sits glaring too!",dem,1956,FALSE,not populist,randomly,0,1,0,0,1,0,0
221,142,1038,9,"First, we must recognize that not alone for Americans, but for men everywhere, body and spirit are co-principals of the same being. Each needs a special sort of ministry. Let us remember that, while Christ preached the doctrine of eternal salvation, he also did the work that needed to be done in the kingdom of man. He healed the sick, fed the poor, sustained the weak, and sheltered all those who were in want. So must we, I think, as Americans continue prudently to extend to the needy of this earth that material help which we almost alone can give. And we ought to do this not grudgingly, but with a clear recognition that it is far better to give than to receive. In a word, the first answer to Communism is not a lesser, but a fuller application of Judaic- Christian ethics to the neighborhood of nations around us.",dem,1952,FALSE,not populist,randomly,0,0,0,0,0,0,0
233,152,2975,27,"I will state my convictions simply. The survival of both peace and freedom will continue to depend on the Atlantic Alliance for the foreseeable future. There can be no substitute for the greatest coalition of free nations in history. And within that coalition, America's leadership is essential to its success.",rep,1988,FALSE,not populist,randomly,1,0,0,1,0,0,0
241,155,2391,3,"Over the years, our greatest source of strength has come from our basic priceless values which are embodied in our Declaration of Independence, the Constitution of the United States, our Bill of Rights, involving our belief in freedom of religion, freedom of speech, freedom of expression, movement, and an unchanging commitment to basic human dignity. Although we've recently not lived up to ideals, I know of no great nation in history that has more often conducted itself in a moral, unselfish, generous manner abroad, and provided more freedom and opportunity to its own citizens at home. Still, in recent years, we've had reason to be troubled. We've stumbled into the quagmires of Vietnam, and Cambodia, and Chile, and Cyprus, and we've responded inadequately to human suffering that we've recognized in places like Bangladesh, Burundi, and the Sahel area of northern Africa. In other undeveloped and struggling and sometimes starving nations we've allowed virtually unlimited sales of American weapons overseas. As I said in the debate the other night, we've become the arms merchant of the world. This is a policy that's both cynical and dangerous. That we've in effect condoned the efforts of some Arab countries to circumvent the commitment of our Bill of Rights and boycott American businesses who trade with Israel or who have Jewish owners or managers within the businesses themselves. This is an unprecedented thing that we've accepted. We've failed to oppose the denial of human freedom in Eastern Europe and in the Soviet Union.",dem,1976,FALSE,not populist,randomly,0,1,0,0,1,0,0
242,175,1801,8,"Now I know that there are those here who approve that record.  I know there are those who criticize as does my opponent.  Let's get one thing clear.  All the criticism in the world of the Eisenhower record in the field of foreign policy isn't going to fool the American people because they know what it is and they like it.  They know that in 1953, when Eisenhower became president, we were in a war.  They know that in these last seven and a half years we got this nation out of one war, we've kept her out of others, and we do have peace without surrender today and they want to continue that kind of leadership.",rep,1960,FALSE,not populist,randomly,1,0,0,1,0,0,0
243,197,2396,23,"The last thing I want to say to you is this: did any of you watch the debate last night? Our polls that I have heard from today showed that Senator Mondale was an overwhelming winner. He makes me jealous. He did so well it makes me jealous, and I'd like to point out to you that he epitomizes to me a concept of the Democratic party. The first responsibility I had was to choose a vice presidential running mate. The first responsibility Mr. Ford had after the nomination was to choose a vice presidential running mate, and I believe that any American watching the debate last night could assess the difference in the quality of those two men. I would trust Walter Mondale to be president in a minute, and I'm very, very proud of him, and I told him last night I was. This is a country that cries out for competence; it cries out for compassion; it cries out for restoration of our principles and our beliefs and our commitments to a standard of excellence and greatness that will make us all proud again.",dem,1976,FALSE,not populist,randomly,0,1,0,0,1,0,0
245,216,3222,2,"I want to thank Tipper Gore and the First Lady, too, for some things they've already talked about. You know, we've worked very hard to improve the health care of the American people. That's a big part of moving into the twenty-first century, to immunize more children, to increase medical research, to speed the movement of drugs to market. In only four years, we've more than doubled the life expectancy of people with HIV--in only four years we've more than doubled the life expectancy of people with HIV and AIDS in just four years, as an example.",dem,1996,FALSE,not populist,randomly,1,0,0,1,0,0,0
0,0,3050,25,"We need to do something for first-time non-violent offenders, put them in community-based boot camps where they can work for the community, get drug treatment and education. We need new ideas. We do not need more government; we need government that works, that is effective, that invests and holds people accountable.",dem,1992,FALSE,not populist,randomly,0,0,0,0,0,0,0
2,2,2942,4,He's reading the polls.  We're taking our case directly to the American people all over this country.  He thinks he can inherit the White House.  I think you've got to earn the right to be the next president of the United States.,dem,1988,FALSE,not populist,randomly,0,0,0,0,0,0,0
3,3,2418,34,"As I try in my imagination to look into the homes where families are watching the end of this great convention, I can't tell which faces are Republicans, which are Democrats, and which are Independents. I cannot see their color or their creed. I see only Americans.",rep,1976,FALSE,not populist,randomly,0,0,0,0,0,0,0
4,4,897,6,"The constructive spirit of the great Democratic decades must not die here on its twentieth anniversary in destructive indignity and disorder. And I hope and pray, as you all do, that we can conduct our deliberations with a businesslike precision and a dignity befitting our responsibility, and the solemnity of the hour of history in which we meet. For it is a very solemn hour indeed, freighted with the hopes and fears of millions of mankind who see in us, the Democratic Party, sober understanding of the breadth and depth of the revolutionary currents in the world. Here and abroad they see in us awareness that there is no turning back, that, as Justice Holmes said, """"We must sail sometimes with the wind, sometimes against it; but we must sail and not drift or lie at anchor."""" They see in us, the Democratic Party that has steered this country through a storm of spears for twenty years, an understanding of a world in the torment of transition from an age that has died to an age struggling to be born. They see in us relentless determination to stand fast against the barbarian at the gate, to cultivate allies with a decent respect for the opinion of others, to patiently explore every misty path to peace and security, which is the only certainty of lower taxes and a better life.",dem,1952,TRUE,not populist,randomly,0,0,0,0,0,0,0
5,5,3031,25,"The Congress passed a bill twice that would have provided basic family leave with an exemption for small business, for people when they've got a baby born, or a sick child or a sick parent. You know, seventy--two nations--seventy-two nations--will give a working person a little time off to go home and take care of their parents or their kids without pay, without losing their jobs. And this president vetoed that bill twice. He said we can't do something that seventy-two countries can do.",dem,1992,FALSE,not populist,randomly,0,0,0,0,0,0,0
