,uniq_id,text,label,annotated_at
0,3050_25,"We need to do something for first-time non-violent offenders, put them in community-based boot camps where they can work for the community, get drug treatment and education. We need new ideas. We do not need more government; we need government that works, that is effective, that invests and holds people accountable.",neither,2021-01-14 15:32:27
1,2988_20,"Our people are pleading for change, but government is in the way. It has been hijacked by privileged, private interests. It has forgotten who really pays the bills around here--it's taking more of your money and giving you less in return.",neither,2021-01-14 15:32:39
2,2942_4,He's reading the polls.  We're taking our case directly to the American people all over this country.  He thinks he can inherit the White House.  I think you've got to earn the right to be the next president of the United States.,neither,2021-01-14 15:33:46
3,2418_34,"As I try in my imagination to look into the homes where families are watching the end of this great convention, I can't tell which faces are Republicans, which are Democrats, and which are Independents. I cannot see their color or their creed. I see only Americans.",inclusive,2021-01-14 15:34:49
4,897_6,"The constructive spirit of the great Democratic decades must not die here on its twentieth anniversary in destructive indignity and disorder. And I hope and pray, as you all do, that we can conduct our deliberations with a businesslike precision and a dignity befitting our responsibility, and the solemnity of the hour of history in which we meet. For it is a very solemn hour indeed, freighted with the hopes and fears of millions of mankind who see in us, the Democratic Party, sober understanding of the breadth and depth of the revolutionary currents in the world. Here and abroad they see in us awareness that there is no turning back, that, as Justice Holmes said, """"We must sail sometimes with the wind, sometimes against it; but we must sail and not drift or lie at anchor."""" They see in us, the Democratic Party that has steered this country through a storm of spears for twenty years, an understanding of a world in the torment of transition from an age that has died to an age struggling to be born. They see in us relentless determination to stand fast against the barbarian at the gate, to cultivate allies with a decent respect for the opinion of others, to patiently explore every misty path to peace and security, which is the only certainty of lower taxes and a better life.",neither,2021-01-14 16:15:10
5,3031_25,"The Congress passed a bill twice that would have provided basic family leave with an exemption for small business, for people when they've got a baby born, or a sick child or a sick parent. You know, seventy--two nations--seventy-two nations--will give a working person a little time off to go home and take care of their parents or their kids without pay, without losing their jobs. And this president vetoed that bill twice. He said we can't do something that seventy-two countries can do.",neither,2021-01-14 16:19:12
6,2396_10,"Another thing that we don't have in this country is plans for the future. President Ford and the Republican administration have no plans, no concepts in the field of energy. We're the only developed nation in the world that doesn't have a comprehensive energy program. We have no concept of what we hope to achieve in the field of transportation or agriculture or education or welfare or health or taxation. This is a devastating obstacle which prevents cooperation between the federal, state, and local levels of government and between government at all levels and the business and professional and labor and agricultural and educational and scientific communities. We've got to have clear plans to show us a goal so that we can reach them at the end of two years or four years or five years or ten years or even more. We did this in Georgia. It worked very well. It works in many other states, and it can and it will work in Washington.",neither,2021-01-14 16:35:59
7,2157_12,"We find that unless there is a change, a real revolution in terms of institutions in Latin America, our friends and neighbors in the south by the end of this century will be destined to be a permanent depressed area of the world with their per capita income one-fifteenth--that is what it will be--of that of the people of the United States of America. So you see the seeds of revolution that are there potentially in the future, unless new policies are developed. We turn to the Mid-East. The Mid-East was a troubled place then. It is a troubled place now, but the difference is a new dimension that has been added to that struggle. Then the Soviet Union was not stirring up the trouble and today it is. But for what the Soviet Union did before the June war, there would not have been a June war. But for what the Soviet Union has done since the June war in rebuilding the forces of the U.A.R. and Syria, there would be no serious threat of another war in the next two or three years.",neither,2021-01-14 16:53:47
8,1174_32,"The program I have outlined demands skilled and purposeful leadership. It demands harmony and understanding between the executive and legislative branches of our government. It will demand an end to what the Senate Preparedness Subcommittee has called """"abuse, misuse and disuse of power.""""",neither,2021-01-14 16:56:33
9,2097_54,"Now, let's just talk together a little bit about this American family of ours. There are people in this country that are fearful, there are whites who fear blacks and there are blacks who fear whites, and there are those who spread this doubt, and they spread this suspicion, there are angry voices. We Americans have to understand that we have ways and means of working out our difficulties without anger, without hate, without doubt, without suspicion.",inclusive,2021-01-14 16:57:00
10,2016-10-22-plane-pittsburgh-pennsylvania_16,"I am going to keep talking about what we want to do, what we think the country de-serves from the next president and vice president. And actually when it comes right down to it, that is what I think people end up voting on. Thank you all very much.",neither,2021-01-14 16:57:13
11,2012-09-25-york-city-12_35,"And it is because of the progress that I've witnessed in my own lifetime, the progress that I've witnessed after nearly 4 years as President, that I remain ever hopeful about the world that we live in. The war in Iraq is over; American troops have come home. We've begun a transition in Afghanistan, and America and our allies will end our war on schedule in 2014. Al Qaida has been weakened, and Usama bin Laden is no more. Nations have come together to lock down nuclear materials, and America and Russia are reducing our arsenals. We have seen hard choices made—from Nay Pyi Taw to Cairo to Abidjan—to put more power in the hands of citizens.",neither,2021-01-14 16:57:29
12,3232_17,"Now, let me say one other thing. Mr. Lampson's opponent and a lot of other people made a lot of headway four years ago, going out to Texans and to people in my home state and around the country saying, well, that fool President's trying to take your gun away. That's what that Brady Bill's all about. That's what that assault weapons ban's all about. He wants to take your gun away. He's going to interfere with your Second Amendment rights. And you know, no one knew in 1994, and it was pretty scary.",neither,2021-01-14 17:00:06
13,3365_23,"Let me say a word--I don't see any seniors here. But if one shows up, I want you to pass this on. He talks about Medi--well, Medi-scare, we call it--he talks about Medicare and what Bob Dole would do to Medicare and what I would do to student loans.",neither,2021-01-14 17:00:34
14,1945_22,"Let's say to these men of little faith, the doubters and the critics, who sometimes become frustrated and other times become bitter--let's say, """"Let's turn the other cheek,"""" and say, """"God forgive them, for they really know not what they do."""" Here in New York, the leading state in the union, let all the people of all religions, of all ancestries, regardless of how they spell their name, of all colors, of all faiths--yes, of all parties--let us, as good Americans first, do not what is just good for the Democratic party, or the Republican Party. Let us on November 3rd go and do what each of us in our own conscience tells us is best for our beloved America.",neither,2021-01-14 17:01:26
15,2012-10-11-rally-miami-florida_36,This is the choice that we now face. This is what the election comes down to. This is why I'm running for a second term as President.,neither,2021-01-14 17:01:32
16,2004-09-22-remarks-latrobe-pennsylvania_32,"Audience members. Boo-o-o! The President. He wants the Government to decide. When it comes to health care, I want you to decide. More than half of the Americans who are currently uninsured are small-business employees and their families. We've got to change law to allow small firms to pool together so they can purchase insurance at the same discounts that big businesses get.",neither,2021-01-14 17:03:02
17,2016-09-16-symposium-washington-dc_12,"We're going to fight for the parents struggling to balance family and work and push for affordable child care, paid family leave, and yes, finally, equal pay for women. We'll fight for the young girls who want a fair chance in life, which is why we'll make universal pre-k available so that every child -- no matter what they look like or where they live -- can rise up and be prepared to fulfill their academic destiny. We are also going to do a lot to emphasize STEM education, particularly for girls and women, and I thank the agenda for making that a priority!",inclusive,2021-01-14 17:05:15
18,3090_11,"Now, I want you to listen closely to him this fall, but you're going to do that, because on issue after issue he takes one position and then another. He's been spotted in more places than Elvis Presley on these issues. Let me give you some specifics. Take the issue, the question of whether to stand up to Saddam Hussein, the defining test of American leadership in the post-Cold War world. Two days after Congress followed my lead--and I had to fight to get them to do that--he said, and I quote, """"I guess I would have voted with the majority if it was a close vote. But I agree with the arguments the minority made.""""",neither,2021-01-14 17:05:25
19,2016-11-07-grand-rapids-michigan_21,"And now, now we've got to come together and we have to prove we can meet the chal-lenges of our time. We've got to get the economy working for everybody, not just those at the top. If you believe, as I do, that America thrives when the middle class thrives, then you have to vote tomorrow.",neither,2021-01-14 17:07:27
20,2939_7,They want you to forget that when the South Dakota legislature flew to Washington they wouldn't talk to them.  Remember that? They want you to forget that the value of farm exports is down $15 billion over the course of the past eight years.,neither,2021-01-14 17:07:53
21,2492_19,"We have our problems, but in the last two troubled years we've come a long, long way. Our long national nightmare is over; four million new jobs have been created in less than two years; inflation cut more than half; trust has been restored in the White House; America is at peace. At home as well as abroad; we are putting our old angers aside; we are putting our old problems behind us and healing our wounds.",neither,2021-01-14 17:08:39
22,3116_18,"I need this change in Congress. The only defense I've had to help the taxpayer is vetoing thirty-three bills in the United States Congress, standing up for fiscal discipline. I'll tell you what, though: You give me that line-item veto; Congress can't do it. Then watch us get the job done. ",neither,2021-01-14 17:08:44
23,2004-09-24-remarks-racine-wisconsin_8,"Listen, what I'm doing is I'm telling you thanks for the grassroots activists. All of the people who have put the signs and get on the telephones and encourage people to register and vote, thank you for what you're doing, and thank you for what you're going to do as you're coming down the stretch. We're going to carry the State of Wisconsin.",neither,2021-01-14 17:09:06
24,907_4,"What ought to be done by government for the public welfare should be done. There should be no wistful dragging of the feet or turning backward to a dead, irrelevant past.  Government should be competent. Its personnel must not be under the heavy hand of purely political selection or influence. It must not be afraid of raising and spending money for worthy purposes, but it must detest and fear waste and dishonesty as ever present threats to the whole moral basis of government by the consent of the governed because people don't consent voluntarily to be cheated or abused. ",neither,2021-01-14 17:09:50
25,2975_39,"As I mentioned earlier, a generation of wise men, bipartisan, of many different views, worked together forty years ago to lay the foundations of the post-war era. Now that we are facing a new world, a different era, it is time once more for Americans to come together. Because by working together, we can extend the horizons of a free and peaceful world.",neither,2021-01-14 17:10:03
26,1903_45,"We're going to win because we have faith and because we have the support of the people and because we're builders and because we look forward to leaving this world a better place than we found it. Thank you for inviting us here. I wish I could stay all day, but I have two other engagements along the road down here in Arkansas and back in Texas tonight. But if you will invite me back sometime, I'll bring my boat and we'll have a good sail together.",neither,2021-01-14 17:10:15
27,2075_46,"I want to tell you--I am not here to give speeches for mayors, but there isn't a mayor in America that has the resources that he needs for the jobs that need to be done.  And that is why we need federal aid to these cites.  And federal aid to the cities is helpful.  The property tax is breaking people in many of our cities.  And you know it.  The fairest tax is the progressive income tax.  That is the fairest one. ",neither,2021-01-14 17:10:21
28,2063_19,"Three weeks from today, this nation will decide its future, not by force of arms, or by a coup d'etat, by the quiet, powerful force called the shuffle of ballots, entering the ballot box.  And I ask every person of voting age, and those who are not, to encourage all who are, to play your part in it. I entered politics some twenty years ago or more.  And the people who came into politics with me were called """"Humphrey's Diaper Brigade"""".  That's right.  We were a pretty young crowd.  And we are still around--a little the worse for wear, and maybe a little the better for some experience.",neither,2021-01-14 17:11:08
29,1977_15,"It is not easy to keep the peace in the world, but for twenty years we have kept the peace.  We have turned back Communist aggression more than once.  We will continue to stand guard at freedom's gate.  This nation is respected because we use our strength with restraint, and we use our responsibility with judgment.",neither,2021-01-14 17:11:56
30,1166_11,"In short the entire government will work for the good of 155 million people, not just for this group, for that group, but for all Americans.  Now, in this crowd, ladies and gentlemen, there are numbers of men who are my old comrades in arms.  Some of them may have fought in the Far Pacific; some may have had duties that kept them in the U.S.; many of them went abroad with me.  And I used to see those fellows along the roads, in the camps, sometimes at reviews, in their barracks, in their kitchen, wherever; and we used to talk about why we were fighting.  And we came to the agreement in simple terms that we were fighting to keep America the kind of land that we believe it to be--a land of freedom and opportunity, not a land dominated by a Hitler or by any group of bureaucrats.  The reason I am in this political campaign, my friends, is in a continuation of that promise.  I am trying to do my part to keep America the kind of country we have always known, which means first of all that you must have a government you can respect and other nations will likewise respect it because you do.  ",neither,2021-01-14 17:12:39
31,1998_11,"Shall we let hope become frustration, impatience become violence?  Shall we turn things over to those--shall we turn things over to those who say they are going to burn this country down and then build things up their own way?  I think not.  There aren't many extremists in America, not many at all.  They are loud but they are few.  And those who listen to them are a minority, and if we let the extremists and the haters have their way in America, they will drag us all down.  But we don't intend to let them have their way.",exclusionary,2021-01-14 17:14:17
32,2795_1,"I had an opportunity on the way here--on the plane--to talk to Ambassador Reg Bartholomew, who, although injured himself, expressed to me his pride on behalf of the dedicated Americans serving with him. And then, he was in the hospital and he said to me, """"We mustn't let things like this push us out of doing what we must do throughout the world."""" So, I know in this moment of anger and sorrow, our prayers are with those who are bereaved, and our commitment to peace remains firm. And I'm proud that our Americans in the Foreign Service, who are serving all over the world, are of the caliber and the quality that they are.",neither,2021-01-14 17:15:21
33,2004-11-01-remarks-burgettstown-pennsylvania_10,The American President must lead with clarity and purpose. The role of the President is not to follow the path of the latest polls. The President must lead based on principle and conviction and conscience.,neither,2021-01-14 17:16:56
34,1401_19,"This year, the soil bank is retiring over twelve million acres and earning a half million farmers more than $260 million dollars. When next year it retires forty to fifty million acres, overproduction will start coming under control. That means better times for every farmer.",neither,2021-01-14 17:17:04
35,2000-10-30-remarks-muskegon-michigan_5,"Or we can just repeat the past like a broken record — letting the wealthiest Americans gorge themselves on tax cuts they don't need, and draining away the surplus you worked so hard to build. And I'm not going to let us be dragged back to sky-high deficits that would drive interest rates through the roof, and drive the economy back into a ditch. These are fundamental choices — not just about numbers and budgets, but about the character of our society.",neither,2021-01-14 17:17:24
36,1193_16,"At a critical moment in World War II, we induced the Nazis to hold an entire army in reserve in the Calais area to meet an attack that they thought was coming but which we never intended to launch.  Measures to deceive them worked so effectively that they estimated our original strength in Europe at seventy-five divisions instead of the actual thirty-six. In the entire American record in Europe there is no single instance where the enemy gained essential information of our plans through the medium of spies or subversive agents.",neither,2021-01-14 17:17:44
37,2012-10-05-rally-fairfax-virginia_25,"Now, my opponent has a different view. The other night, he said he'd repeal Obamacare as soon as he took office. Audience members. Boo!",neither,2021-01-14 17:17:51
38,2070_14,"The crisis of our cities has come into full bloom.  There had been a festering crisis there for a long time, but now it is here and it cannot be ignored.  We are going to have to decide whether our cities are to be livable or whether we shall have to abandon them and we can't afford to abandon them because where shall we live?  We have to ask ourselves where are the next 100 million Americans going to live and how are they--how will they live?  There will be an additional 100 million Americans, you know, in the next twenty-five years.  Where are they going to live and under what conditions?",neither,2021-01-14 17:19:11
39,2012-11-02-rally-lima-ohio_18,"Ruling out compromise, pledging to rubberstamp the Tea Party's agenda in Congress, not change. Trying to change the facts when they're inconvenient to your political campaign, that's definitely not change. That's what Governor Romney has been doing these last few weeks.",neither,2021-01-14 17:19:17
40,3293_21,"And more than anything else, you have to decide where we're going in the issues that will affect whether we can grow together. We did pass health care reform, but our balanced budget plan would give insurance to families who are between jobs for six months; would insure another million children; would give free mammograms to women on Medicare; would give respite care to the nearly two million American families caring courageously for a family member with Alzheimer's--all paid for. You get it in our balanced budget plan. They cannot do it. You have to decide.",neither,2021-01-14 17:19:25
41,2743_6,This election is not about sending a teacher into space.  It's about educating our children right here on earth. This election is not about train rides and whistle stops.  It's about the ninety-thousand profitable corporations in America who don't pay a penny in taxes.,neither,2021-01-14 17:19:35
42,2174_0,"These years of turmoil have shocked Americans into a recognition of how enormous are the social tasks ahead of us, and how urgent. Faced with an urban crisis, the first instinct of many has been to demand vast new government programs and vast new expenditures--whether a """"Marshall Plan for the Cities,"""" or a doubling of public housing funds or a government-guaranteed income for everyone. Yet even at best, these government programs would only scratch the surface of need. They would drain the federal treasury to soothe the public conscience, but they would fail--because they would leave untapped the greatest reservoir of neglected resources in America today: the energies and the spirit of the American people themselves.",neither,2021-01-14 17:21:49
43,2733_24,"Do you really believe there are winners in a nuclear war? Now, some people have declared this election over. They've announced a Republican landslide. In other words, they're telling you, your vote won't count. Your voice doesn't matter. This crowd doesn't want you to think about the stakes in this contest. They want to trivialize it.",neither,2021-01-14 17:21:55
44,2831_33,"Well, all right. I know you're all ready for this great new era of opportunity. And this may gall our opponents--the train's getting ready to whistle, and I have to move on to the next stop before darkness catches us...",neither,2021-01-14 17:21:59
45,2160_12,"But if they don't end it by November 5th, then I say after four years of all that power and all that wealth and 200,000 American casualties, they've failed, then give us a chance and we will end the war on an honorable basis. That is what America wants. We will go beyond. Looking to the future we give you a new foreign policy. Not a continuation of the tired men of the past, but new men with fresh ideas. And one of those ideas is a very solid one. You know, this is a great country and a strong country. It's a rich country, and we have lots of people. But for the last twenty years, do you realize, and all of you who studied America know this, do you realize that we furnished most of the money, $150 billion, we furnished most of the arms and we furnished most of the lives in Korea and then in Vietnam to help other nations defend themselves against aggression.",neither,2021-01-14 17:23:28
46,1412_1,"We are also deeply grateful that so many Americans have signed their names that they are determined to do their duty this fall in determining the course of America, and are going to get their friends to do the same. I cannot remember any birthday that has been quite so deeply meaningful to me as this one. I thank all of you--Mr. Percy and Miss Dunne particularly for being the chairmen of this great evening.",neither,2021-01-14 17:23:36
47,3127_3,"Now, when we sit down to debate, and I hope the governor will take a stand to agree to them, we should discuss the most important question: What kind of America do we want for the young people here today? Because of your sacrifice, because of your commitment, we have helped reduce the fear of nuclear annihilation. Today, our kids can dream the sweet dreams of peace without fear of nuclear war. And I am proud that that happened when I have been president of the United States. You listen to Governor Clinton, you might think national security of this country and foreign affairs are not important. They are. We've changed the world. ",neither,2021-01-14 17:25:37
48,3046_23,"You think about it. Look at what they're doing in their campaign. Every day Mr. Bush goes out and just creates another fairy tale. He pulls out his pocketbook, his wallet, and says, """"You'd better watch your pocketbook if you vote for Clinton."""" Now, remember, folks, remember, Bush increased spending by more than any president in over two decades. Bush asked Congress to spend more money than it did. He tried to outspend Congress. Can you believe that? Bush increased regulation by more than any president in two decades. My state has the second-lowest tax burden and the highest job-growth rate in America, and I'm the only person to ever balance a government budget. I'll tell you who's going to pick your pocket--George Bush. He did it once, and if you give him another chance, he'll do it again. But you know, we're not buying it this time. No more! No more! No more.",neither,2021-01-14 17:25:55
