,Unnamed: 0,speech_par_id,text,label,annotated_at,high_pride_yl,low_pride_yl,auth_yl
46,46,2012-09-27-event-springfield-virginia_5,"And so — — we were able to take care of all those things and make sure that it was legitimate. But what a — what a privilege to be able to be there and to send off men and women who love their country. I am — I'm privileged today in the presence of those who have served their nation, who, in the words of that wonderful hymn, """"O beautiful for heroes proved in liberating strife, who more than self their country loved and mercy more than life.""""",none,2021-01-19 11:20:15,0,0,0
47,47,2012-09-23-event-denver-colorado_38,"Now, I knew it was coming because as the guy in charge of the Olympics, I chose the version of the national anthem they sang. And I chose a version from the 1930s by Robert Shaw. And in this version, you repeat the last line as a reprise and the sopranos go up an octave and the orchestration is much greater — o say does that Star-Spangled Banner yet wave, o'er the land of the free and the home of the brave.",none,2021-01-19 11:20:50,1,0,0
48,48,1357_16,"The most obvious weakness, of course, is the ease with which our national forests, our wildlife refuges, our parks and streams, and public lands have been invaded and turned to selfish private purpose. But more important even than that, perhaps, is the shunting aside of men who are experienced and trained in a lifetime of conservation work, in favor of politician appointees. The agency that looked at tomorrow's needs for minerals has been disbanded--and nothing put in its place. The Soil Conservation Service has been weakened--and must be revived. We need the leadership that will look at the nation's needs for water, for areas of recreation in the great open country, for land, and forest, and streams. We need, in other words really to look together at the needs and resources of our common future.",none,2021-01-19 11:21:31,0,0,0
49,49,1775_16,"We say the way to progress is not to rely on an all-powerful federal government, to weaken the individual, to weaken the state, but to tap all the resources of America, to get the most out of l80 million free Americans, the most out of our strong state and local governments, and the most out of the federal government, but with the federal government doing only those things that cannot be done and will not be done by the states and the local government and by the people themselves. This, I say, is not Republican doctrine alone.  It represents the thinking of millions of Democrats in this country because it has made America great and it will make her greater in the years ahead.",none,2021-01-19 11:21:54,1,0,0
50,50,2787_2,"Americans of Hispanic descent are moving into the business and professional community as never before. They--and that includes some of you with us today--are playing a major role throughout this administration. This generation of young Americans of Hispanic descent, due to an expanding economy and increasing opportunity, will have it within its grasp to achieve more and advance further than any generation of Hispanics at any time, in any country of the world.",inclusion,2021-01-19 11:22:50,0,0,0
51,51,3083_8,"So I simply came out to congratulate you on this; to tell you of this determination, this decision I have made, which I am certain is in the interest of world peace, salute you for your work; and thank you for this worm welcome. May God bless each and every one of you.  Thank you very, very much.",none,2021-01-19 11:23:29,0,0,0
52,52,3064_17,"Let me make an aside. This is a political year, but there's a lot of danger in the world. You can be sure, I will never let politics interfere with a foreign policy decision. Forget the election: I will do what's right for our national security. And that is a pledge from my heart.",none,2021-01-19 11:23:40,0,0,0
53,53,1937_8,"We have a Bill of Rights. We are also developing a Bill of Responsibilities, and that will be the guidepost of my administration. Article I of the Bill of Responsibilities is that government must be prudent. I am in favor of government that doesn't take in a cent it doesn't need and doesn't spend a cent it doesn't have to. Instead of increasing government expenditures, my first budget, the first Johnson budget to the Congress, calls for lower expenditures--$1 billion lower--and it is only the second budget in ten years to be lower. Instead of increasing the number of Government employees, the Johnson budget calls for a reduction, and it is the first budget to reduce Government employees in eight years.",none,2021-01-19 11:24:42,0,0,0
54,54,1860_15,"All these things sound so far away sometimes, here in Syracuse or in Erie or in Lancaster, but, my friends, we can have the best Social Security and the best housing and the best jobs and it will make no difference if statesmanship fails to avoid the next war. It must not happen. It will not happen, and Cabot Lodge and I believe we have the kind of leadership that will avoid it happening, as President Eisenhower has avoided it happening. ",none,2021-01-19 11:24:47,0,0,0
55,55,3302_38,"So I would just say, before I conclude, I'm honored to be here today, as I was in Boston a couple of years ago. I want to say to all those in the audience--the men and the women, the young, the middle-aged, and maybe a few seniors here--this is a great organization. You've been at the forefront, you understand the problems. You understand freedom. You understand liberty. You understand we're the greatest nation on the face of the earth--make no mistake about it, we are the greatest nation on the face of the earth, and I think we even have better years ahead.",none,2021-01-19 11:24:56,1,0,0
56,56,2845_9,"If it were up to my opponent, I'm afraid Rockwell might still be building the B-25--that is, if you were building anything at all. The truth is, if all his votes had prevailed, America would barely have any defense, any real means to protect the peace, any chance to preserve freedom. And we can't afford that kind of protection.",none,2021-01-19 11:25:12,0,0,0
57,57,908_12,"And, most of all I feel what could happen to all of the 20th century progress, the social revolution at home and our firm directions in the great world revolution of this age, under Republican leadership. You remember how the two Republican parties pulled out their six-guns and went after each other in Chicago. Well, there is still today the same divided, confused, quarreling bunch we all saw on the TV screen when they had their scrimmage out there in the stockyards at Chicago.",none,2021-01-19 11:25:27,0,0,0
58,58,2423_2,"But the most important consideration on this issue or any other issue in a government like ours is, what is the will of the people involved? It should not matter whether the people involved are rich or poor, famous or anonymous, powerful or not. And it is clear that in this key case, the people wanted the New River like it is.",none,2021-01-19 11:26:24,0,0,0
59,59,2692_52,"Our failed energy policies have caused many of our allies to blame the United States for the world's energy problem as much as OPEC. Neglect of energy realities diminishes our diplomatic strength. But worse, our dependence on imported oil also weakens our strategic position.",none,2021-01-19 11:26:58,0,0,0
60,60,2988_46,"An America where we end welfare as we know it. We will say to those on welfare: you will have and you deserve the opportunity through training and education, through childcare and medical coverage, to liberate yourself. But then, when you can, you must work, because welfare should be a second chance, not a way of life. That's what the New Covenant is all about.",none,2021-01-19 11:27:05,0,0,0
61,61,2016-10-27-salem-north-carolina_11,"And don't just take it from me because I think you've heard some really compelling voices say the same thing, and one of them is here with us today, right? There are so many things I admire about our First Lady. Michelle reminds us to work hard, stay true to our values, be good to one another and never, ever stop fighting for what we believe in.",none,2021-01-19 11:27:56,0,0,0
62,62,2771_22,"Today our troops have newer and better equipment; their morale is higher. The better armed they are, the less likely it is they will have to use that equipment. But if--heaven forbid--they're ever called upon to defend this nation, nothing would be more immoral than asking them to do so with weapons inferior to those of any possible opponent.",none,2021-01-19 11:28:01,0,0,0
63,63,3097_16,"You know, Bill Clinton talks a very good game. He's got more statistics than there are problems out there, but his actions betray his words. In Arkansas, individual income has slipped; crime is up relative to the nation; children's test scores get weaker; while streams of air get more polluted. If you go swimming in that Arkansas River, keep your mouth closed and hold your nose. They are doing a terrible job on pollution. ",none,2021-01-19 11:28:12,0,0,0
64,64,2812_20,"Winston Churchill once said--when he changed parties in his country, he said--""""Some men change principle for party, and some men change party for principle."""" Phil has proven himself a courageous representative of--in all of this, as I say, in what we fervently believe. Well, those values are attracting millions to our cause. We're reaching out to rank-and-file Democrats and Independents, asking them to come with us and walk down this new path of hope and opportunity. I know there are many here tonight. I'm very proud to know that you would come here. There was a certain sacrifice at the box office for you to do so. But to have you here--and I just want to say to all of you, having been a Democrat most of my life myself and found that there came a day when I could no longer follow the policies of the leadership of that party, I know that throughout this country there are millions of rank-and-file, patriotic Democrats who love this country, who want the same things that we want for the country, and yet who find themselves unable to bless the decisions of the policy-makers at the head of their own party today. Come with us on this particular march, and we'll truly have a bipartisan victory that will set this country to going forward again, with your help.",none,2021-01-19 11:28:56,0,0,0
65,65,2004-10-26-dubuque-iowa-0_38,"I remember coming to eastern Iowa during the congressional campaigns in 2002. I said that I understand Iowa's hospitals are not being treated fairly under Medicare. Nussle, you might remember—I stood and looked right in the camera. I said, """"I'm going to work with Congressman Nussle and Senator Grassley to make sure Iowa's rural hospitals, in particular, are treated fairly."""" The bill I signed not only helps our seniors but it helps Iowa hospitals. I kept my word.",none,2021-01-19 11:29:06,0,0,0
66,66,2004-10-28-dayton-ohio-1_7,"But most of all, I want to thank you all. I want to thank the grassroots activists, the people putting up the signs, the people making the phone calls, the people doing all the hard work. I want to thank you for what you have done, and I want to thank you for what you're going to do. With your help, with your hard work in turning out that vote, there is no doubt in my mind we'll carry Ohio again and win a great victory on November the 2d.",none,2021-01-19 11:29:42,0,0,0
67,67,2081_44,"You know, it is very easy sometimes to talk about the things you plan on doing today--to talk about the great, great programs of tomorrow--but I find it very easy to support Hubert Humphrey, not only because he is the man he is today, not only because he promises great promises for tomorrow, but even greater than that, and I think that what he has done in the past makes the individual much more predictable in terms of what he will do tomorrow, and his record as a mayor, as a senator, as vice president, makes it even more important that we cast our vote for him, because he is a man that will lead America in the right direction, will make America what it should be for all Americans, whether they are black or white, rich or poor, from the North or South. I thank you for this support and I hope you continue to do so.  Thank you very much.",inclusion,2021-01-19 11:31:20,0,0,0
68,68,1313_9,"Every single member in this crusade is pledged to this idea: That at the first sign of any approaching depression, the full power of private industry, of local and state government, and all resources of federal government will be mobilized to see that never again will we have mass unemployment.  We are committed to the expansion and improvement of social security programs, particularly to saving what is left of our dollars so that your insurance policies, your old age insurance, your unemployment insurance and the rest of itdon't run out of your pocket through that big hole they call inflation.  Unless we stop that, there is no hope.",none,2021-01-19 11:31:49,0,0,0
69,69,2385_8,"Is he proud of the 6 percent annual inflation rate that he and his advisers are trying to convince us is normal? The fact is that during the eight Kennedy-Johnson years the inflation rate averaged 2 percent, a third of the 6 percent rate that Mr. Ford now runs on so proudly.  Have you ever listened to Mr. Ford and his advisers try to explain away their economic mismanagement? Whenever they think they can get away with it, they tell us, """"You've never had it so good!"""" And when that won't wash, they fall back on, """"Trust us--prosperity is just around the corner."""" ",none,2021-01-19 11:32:00,0,0,0
70,70,2004-10-26-richland-center-wisconsin_51,"The President. That sounded like a big one to me. You see, good tax policy says to businessowners, """"Invest,"""" because you know what investment means? Investment means jobs. And so in our tax policy we said to small-business owners that you're able to deduct up to $100,000 for equipment expensing in the year in which you buy it, as opposed to $25,000. And why did we do that? Because we want to encourage Eric to invest. And so he says he buys a 400-ton——",none,2021-01-19 11:32:05,0,0,0
71,71,1033_23,"Of course they don't mean to aid and abet our enemies; but the results are the same. Are these the men we want to lead our nation in the struggle against Communism today? All the while they proclaim ferocious anti-Communism. Indeed, the best way they can apparently find to obscure their retreat from the fight against Communism abroad, the fight to keep it distant from our shores, is by shouting and screaming every hour on the hour about how much they hate Communism at home.",none,2021-01-19 11:34:03,0,0,0
72,72,2012-10-23-delray-beach-florida_37,"By the way, I just want to point out, in the same way that Governor Romney didn't mention the Afghan war or our troops in his convention speech, Governor Romney didn't even mention our veterans last night. Audience members. Boo!",none,2021-01-19 11:34:26,0,0,0
73,73,2033_29,"The protections and the legal procedures of the National Labor Relations Act should be available to farm workers like every other worker.  Now, we're not talking about the family farm.  We're talking about the kind of agriculture that's corporate agriculture, big agriculture, where there are many workers.  And I want to go on record here once again, as I have a hundred times, the National Labor Relations Act is in the best interests of order, of an orderly economy.  The National Labor Relations Act should apply to every kind of worker that wants to organize, and they should have those protections.",none,2021-01-19 11:35:07,0,0,0
74,74,1872_1,"The same thing happened when we got to the Alamo in San Antonio a little later in the day. The same thing happened in Houston last night--not only the biggest crowd ever in Houston, but it was probably the greatest night rally of this campaign which has been held by either candidate, from the reports I have received. Then we came in at the airport at 11 o'clock last night. I know, because I didn't get much sleep last night. Neither did you if you were at the airport. There was a massive crowd with flashlights welcoming us. It was a sight we will never forget.",none,2021-01-19 11:35:46,0,0,0
75,75,916_31,"The same is true of many other countries. It is help of this kind that we can provide by sending agricultural experts, engineers and other trained people to these countries, and through programs of assistance for economic development. By working with each country to expand the production of goods which are needed by other countries in the region, a self-generating and self-financing cycle of trade and development can be initiated, which will reduce and can eventually eliminate the need for American aid. At the same time, we can enlarge or export markets and develop new sources of the products we need to import.",none,2021-01-19 11:36:25,0,0,0
76,76,2004-10-22-wilkes-barre-pennsylvania_42,"We will continue to improve life for our families by making health care more affordable and more accessible. We'll expand health savings accounts and create association health plans so small businesses can cover their workers, so more families are able to get health insurance plans they manage and they call their own. We'll help families in need by expanding community health centers. We'll make sure every eligible child is enrolled in our Government's low-income health insurance program.",none,2021-01-19 11:37:03,0,0,0
77,77,3182_2,"May I start by saluting our great congressional delegation, the members of Congress, Chris Shays, Gary Franks, and Nancy Johnson. We've got a great delegation. And now help them clean House by electing more to the United States Congress. We need Brook Johnson, we need Tom Scott, we need Phil Steele, we need Edward Munster all to go to Washington.",none,2021-01-19 11:37:24,0,0,0
78,78,3161_19,"And three, protection for the elderly. It's absurd that the folks who have contributed to society all their lives have to live in terror just because some young punks see them as an easy target. I want to beef up the laws, so instead of stalking the streets and mugging grandmothers, they're down at the precinct, mugging for the police camera.",none,2021-01-19 11:38:10,0,0,1
79,79,2004-10-12-colorado-springs-colorado_14,"You know, after listening to the litany of complaints and the dour pessimism, it took all I could do not to make a face. See, I have a different philosophy. I'm a compassionate conservative. I think Government ought to help people realize their dreams, not tell them how to live their lives. I've led this country with principle and resolve, and that's how I'm going to lead it, with your help, for 4 more years.",none,2021-01-19 11:38:29,0,0,0
80,80,934_3,"In Illinois, we cleaned up, we disinfected, we fumigated a state government that had been the victim of eight years of magnificent rascality--and I mean Republican rascality. Now, actually it doesn't make any difference whether it is Republican or Democratic rascality; a bad public servant is a bad apple and you throw out a bad apple whatever its variety. That is what I believe and I think that is what we are going to do at every level of our government, if the people are conscious enough of what their responsibility is. But rascals in government are only the uglier practices of wasters in government. Economy is just as important as honesty--for a taxpayer's dollar that is wasted is just as bad as a taxpayer's dollar that is stolen. And here again I lay what I hope is not an immodest claim to some hard and educational experience in making both ends of a government budget meet, in keeping a government lean and trimmed down to an efficient size. I have some idea about that; as the product of practical experience in Illinois, I have learned that economy in government isn't just something that you say you are going to have. You have to grind at it all of the time. You have to grind--everybody--up and down the ladder; the purchasing officers who spend millions of the taxpayers' money, the fellows who deal around in government orders, even the girls who want to use a fresh carbon every time they want to write a letter. It is the same old business day and night. You've got to live it yourself twenty-four hours a day.",none,2021-01-19 11:38:41,0,0,0
81,81,2006_26,"Now, there is one candidate this year who based his very campaign on the idea of appealing to the yesterdays, who bases his campaign on separatism, as it was, not like it is or as it ought to be but as it was, and there is another candidate, a respected man, who does not do this but he is openly competing for the same votes as George Wallace and for the votes of people who want at best, to sort of slow things down, to kind of ease it off when it comes to the programs and the policies that offer come hopeful way out of the tension and trouble that besets us.  So, on the one hand we are faced with third party extremism and on the other, we are faced in the Republican candidate as I see it, with an old coalition and I have seen it work in Congress for years, a coalition as we used to call it, of the Dixiecrats and the conservative Republicans, which prefers to remain silent and if not silent, to bob and duck and evade when it comes to the central issue of this century, the issue that is being fought over in Czechoslovakia just as well as in America, human rights and human opportunity. I submit that this election year must bring a national referendum on this issue of human rights and we must turn away from the old era that all of you know too well, of segregation and discrimination which never gave us much except trouble, and we must choose the new day of community, of integration, and of opportunity, and we must turn away from the old era when an American soldier who fought in an integrated Army would come home into a neighborhood of segregation and slumism.  And we must choose a new day when that man, when he gets home, can have a job that is a meaningful job, worthy of his talents, worthy of his service to his country, and he must have training for that job and he must have equality before the law and in his neighborhood and amongst his associates.",inclusion,2021-01-19 11:39:45,0,0,0
82,82,2012-10-05-st-petersburg-florida_11,"But you can't really blame him because he pointed out the other day that you can't fix Washington from the inside. He said he's got to do it from the outside. Well, we're going to give him that chance.",none,2021-01-19 11:39:57,0,0,0
83,83,2016-11-07-raleigh-north-carolina_69,We're living through the greatest jobs theft in the history of our world. There's never been anything happened to a country like has been happening to the United States. Our jobs are fleeing. Our companies are being taken. And leaving. And leaving.,none,2021-01-19 11:40:01,0,1,0
84,84,2760_16,To breach the wall between the church and the state is to corrupt our faith and divide our people and distort our politics.  Justice in America is ultimately in the hands of the Supreme Court.  The next president could well appoint the Supreme Court majority for the rest of this century.,none,2021-01-19 11:40:29,0,0,0
85,85,2004-09-08-cincinnati-ohio-5_10,"Because of this President's wrong choices, we're spending $200 billion in Iraq while the costs of health care have gone through the roof and we're told we don't have the resources to make health care affordable and available for all Americans. Today, 45 million Americans have no health insurance at all – 5 million more than the day George W. Bush took office. And after four years of no action, no concern, and hardly a mention of those struggling to afford health care, the President finally told us last week that he actually had a plan. Well, we only had to wait twenty-four hours to find out what that was. Because the very next day he raised Medicare premiums 17 percent – the biggest increase in Medicare premiums in the history of that program. And here's the kicker – a lot of that money is nothing more than a windfall to the insurance companies and HMOs. They're charging 17% more for Medicare while making America pay $200 billion for a go-it-alone policy in Iraq. That's the wrong choice; that's the wrong direction; and that's the wrong leadership for America.",none,2021-01-19 11:41:09,0,0,0
86,86,1293_2,"I am exceedingly proud, my friends, to address you in a hall that is a war memorial, dedicated to our veterans. I hear that more than twenty-thousand people contributed their funds to make this hall possible.  Whenever anything comes to my attention that involves veterans, I, like most other old soldiers, want to reminisce a bit.  Never do I get tired of reminiscing about the heroism, the sacrifices, the devotion to our country of the millions of men and women who made up our fighting forces in World War II.  I am really proud that the city of Johnstown has chosen to take a building such as this that will be used by your citizenry through the years to make it a lasting useful memorial to their services.",none,2021-01-19 11:42:43,0,0,0
87,87,2041_4,"This week his running mate said there is not now and never has been a Nixon-Agnew plan for peace in Vietnam.  It was all a ploy """"to maintain suspense.""""  And then he said:  """"Isn't that the way campaigns are run?""""  Perhaps--for Nixon-Agnew Republicans.",none,2021-01-19 11:42:48,0,0,0
