,Unnamed: 0,speech_par_id,text,label,annotated_at,high_pride_yl,low_pride_yl,auth_yl
0,0,2162_3,"But don't worry about that. You know who is in the cellar? Washington. We can't do anything about the Washington baseball team, but we can do something about the Washington political team, and we are going to get Washington out of the cellar and on top.",none,2021-01-18 21:50:32,0,0,0
1,1,2016-10-28-manchester-new-hampshire_21,"And these people are seriously corrupt. Terribly conflict. Hillary's pay for play included defense contracts. Take Raytheon, when the contractor wanted big foreign arms deals, they hired three lobbyists that raised hundreds of thousands of dollars for Hillary's last campaign, and are raising money for her current campaign.",none,2021-01-19 10:46:30,0,0,0
2,2,2397_30,"Q. Do you think that Gerald Ford had anything to do with the Sonnenfeldt Doctrine...? CARTER. I can't answer that question. As you know, Mr. Sonnenfeldt has been a top adviser for Mr. Kissinger. And the Sonnenfeldt Doctrine was never repudiated, as far as I know, by Mr. Kissinger. I don't know what Mr. Ford's position is on the Sonnenfeldt Doctrine.",none,2021-01-19 10:47:23,0,0,0
3,3,2012-10-05-rally-fairfax-virginia_9,"One of the main reasons record surpluses under Bill Clinton were turned into record deficits under George Bush is because we put two wars and two tax cuts on a credit card, and now Governor Romney wants another $5 trillion in tax cuts that he can't pay for? Not if I have anything to say about it. That's not going to happen. We are not going to let this country fall backward, not now, not with so much at stake. We've got to move forward.",none,2021-01-19 10:47:33,0,0,0
4,4,2079_14,"Here is Mr. Wallace--just a minute--here is Mr. Wallace, the man that says he is the workers' friend.  There won't be--let me tell you my friends--the workers' friend for Connecticut--a man that comes up here and tries to take your factories, a man that is a union buster, a man, if you please, that has the lowest, second lowest wages in any state in the union.  Is that the friend of the workingman?  ",none,2021-01-19 10:47:42,0,0,0
5,5,2868_15,You said it all. But this year he's outdone himself. All right. Okay. All right. All right. I can take it if you can.,none,2021-01-19 10:52:34,0,0,0
6,6,2016-08-12-arena-erie-pennsylvania_97,"Get ready folks, get ready. We're led by stupid people. We're led by leaders and you know honestly, I didn't need this. This I didn't need. I had a nice life, built a great company—a great company, some of the great real estate assets of the world. I may never see them. You know if I win, I may never see them again, and I love them—all over the world.",none,2021-01-19 10:52:37,0,0,0
7,7,2508_7,"In every field America is on the move. We are on the march. We made an incredible comeback in the past two years and we are not through yet. You can believe me when I say this nation is sound, this nation is secure. This nation is on the way to a better quality of life for all Americans, and this administration has earned the trust of the American people for the next four years.",none,2021-01-19 10:53:19,1,0,0
8,8,2528_2,"I was going to tell Ody and Warren later today and ask them to express it to you, but I see so many nice people here I'm going to do it myself--I'm going to invite every one of you to come down January 20th and be there for the inauguration of Jerry Ford. I do want to express my deep appreciation and gratitude to Bob Kasten and Bill Steiger, who have just been extremely helpful. I need them down there. You need them down there. We just need to add a few more to the Wisconsin delegation.",none,2021-01-19 10:53:30,0,0,0
9,9,1314_11,"Tied to that problem is this one of Civil Service.  """"You put Ike and his friends in the administration and they will fire civil servants by the scores.""""  That is just bunk.  I have lived with those people a whole lot longer than some of the people who are now criticizing me and I like and admire them.",none,2021-01-19 10:53:42,0,0,0
10,10,2507_8,"One of the most significant achievements of this administration is that we have now reversed that slide. And as long as I am president we are going to have an Army, a Navy, an Air Force, and a Marine Corps that are unsurpassed in military capability. I know it is very costly. As President Eisenhower once said, and I quote, """"A good defense is never a cheap defense,"""" end quote. But for the sake of peace and freedom we must be willing to make the sacrifices that maintain America's military might.",none,2021-01-19 10:53:52,1,0,0
11,11,2636_39,"The administration which has brought us to this state is seeking your endorsement for four more years of weakness, indecision, mediocrity and incompetence. No American should vote until he or she has asked, is the United States stronger and more respected now than it was three and a half years ago? Is the world today a safer place in which to live?",none,2021-01-19 10:54:44,0,1,0
12,12,2016-11-07-grand-rapids-michigan_31,"And one of the things I've heard all over America, especially from young families, really from all families but particularly young families, is how hard it is to do so many of the things that are expected - like where do you find affordable quality childcare? In lots of states, it's more expensive than college tuition. We're gonna get the cost of childcare down. We're going to have a paid family leave program so that when you have a sick relative or you're sick you won't lose your job.",none,2021-01-19 10:54:50,0,0,0
13,13,3012_4,"I want to thank Barbara Holt and Joe Carr and my good friend Tom Allen, and there are lots of other people who are here, but I especially want to recognize the group of people who are Veterans for Clinton/Gore over here--Mayor Charlie Harlow, Senate President Charles Pray, my good friends Jim and Libbie Mitchell are here, and all of you who have come today. Let me say, I have had a wonderful day. I was in Boston yesterday. We had 45,000 people according to the morning paper there.",none,2021-01-19 10:55:13,0,0,0
14,14,2004-10-20-waterloo-iowa-0_5,"But now that we're fighting two wars, we must... and we will... prevail in both. In Iraq, because the President's miscalculations have created a terrorist haven that wasn't there before. And in the worldwide struggle against the terrorists, because they attacked us ... and because they represent the greatest threat to security in our time.",none,2021-01-19 10:55:19,0,0,0
15,15,3077_20,"I cannot do much about Harrisburg, but this week Congress will consider my legislation to give teachers more flexibility in using federal funds, as long as they achieve results. Congress wants to give flexibility to just 300 schools. I want to give it to all 110,000 schools. We've got to relieve these teachers of federally mandated paperwork requirements. I trust the teachers, not the government, to do what's right for our students.",none,2021-01-19 10:55:26,0,0,0
16,16,2012-09-27-event-springfield-virginia_22,"And there's a long-term threat to our military capability and to our national security, and it relates to something that fuels and builds our military, and that's our economy. You have to have a strong economy in order to build a strong military. Russia tried for a while — the old Soviet Union tried for a while to maintain a grade A, if you will, military, but they had a grade B economy, and they couldn't keep up. They finally had to — well, they collapsed. We have to have a strong economy.",none,2021-01-19 10:55:55,0,0,0
17,17,2012-10-13-remarks-portsmouth-ohio_13,"AUDIENCE MEMBER: Love you! MR. ROMNEY: There are five things — there are five things I know we can do to get this economy going. Some will have an immediate impact. Number one, we're going to take full advantage of our oil, our coal, our natural gas —",none,2021-01-19 10:56:03,0,0,0
18,18,2873_35,"And I believe that, well, my generation--and there were a few other generations between mine and yours--our sacred trust is and what we must do for you. We grew up in an America where you could dream, you could make your dreams come true, you could fly as high and as far as your own ability and strength and talent would take you. And we--myself and those generations I mentioned--our sacred trust is, and we pledge to you--when it comes your turn, we're going to turn over the reins of an America that is free in a world that is at peace. And it will be an America in which you can dream and make your dreams come true and fly as high and far as your own strength can take you.",none,2021-01-19 10:56:06,0,0,0
19,19,2012-09-17-columbus-ohio-0_41,"So, Ohio, what I'm offering, and I need your help. I need you to help me recruit 100,000 new math and science teachers and improve early childhood education and give 2 million workers the chance to learn the skills they need at community colleges and help us work with colleges and universities to keep tuition down so that our young people have a chance at a future without taking on tens of thousands of dollars' worth of debt. We can meet that goal, but I need your help.",none,2021-01-19 10:56:34,0,0,0
20,20,2944_25,"The stakes in this election are very, very high.  The next president will probably appoint two, three, or maybe four new members to the Supreme Court of the United States. Mr. Bush the other day said he thought the nomination of Robert Bork was an outstanding appointment.  We don't need a Supreme Court full of Borks.",none,2021-01-19 10:56:55,0,0,0
21,21,2004-10-21-hershey-pennsylvania-0_32,"But we need to worry about our children and our grandchildren. See, we need to worry about whether or not the Social Security trust will be solvent when they need help in retirement. I think younger workers ought to be allowed to take some of their payroll taxes and set up a personal savings account that earns a better rate of return, an account they call their own, an account the Government cannot take away.",none,2021-01-19 10:56:57,0,0,0
22,22,1928_21,"If you want to, do away with these gains that you have made, this progress that we have made, over thirty years. In this country I believe in full employment. I think that every man and woman who wants to work and is willing to work ought to have a chance to work. I believe in full education.",none,2021-01-19 10:57:05,0,0,0
23,23,2004-10-17-conference-washington-dc_29,"And that is why John and I both applaud the work of the National Women's Philanthropy and United Jewish Communities. In you, we see more than a great organization. We see hope-hope for our country, for the promised land of Israel, for the worldwide Jewish community, for women, and indeed for people all around this troubled globe of ours. You illustrate what can happen when strong women embrace their power and their wisdom, and come together to make their voices heard.",inclusion,2021-01-19 10:58:10,0,0,0
24,24,2651_14,"Now I am one who believes that states should handle most of their problems, but not if those problems are caused by the policies of an irresponsible and indifferent federal government. That is the case with the new Cuban refugees. The federal government must share the financial burden they have brought to America in their flight to freedom.",none,2021-01-19 10:58:25,0,0,0
25,25,2703_26,"Any nation that sees softness in our prosperity or disunity in our sometimes noisy arguments with each other; let such nations not make the mistakes others have made--let them understand that we will put aside in a moment the fruits of our prosperity and the luxury of our disagreements if the cause is a safe and peaceful future for our children. Let it always be clear that we have no dreams of empire, that we seek no manifest destiny, that we understand the limitations of any one nation's power. But let it also be clear that we do not shirk history's call; that America is not turned inward but outward--toward others. Let it be clear that we have not lessened our commitment to peace or to the hope that someday all of the people of the world will enjoy lives of decency, lives with a degree of freedom, with a measure of dignity.",none,2021-01-19 11:01:34,0,0,0
26,26,2640_16," With your help, with your vote--and I need and want both, and do not hesitate to ask for them--we will start that task in January 1981. Every generation is critical of the generation that went before. In recent years our generation has been blamed for much of what seems to be wrong in the world today. Well I will not apologize for our generation. We have known four wars in our lifetime and a Great Depression that changed the face of the world.",none,2021-01-19 11:02:08,0,0,0
27,27,2800_37,Our approach in all these areas will be designed to take into account concerns the Soviet Union has voiced. It will attempt to provide a basis for an historic breakthrough in arms control. I'm disappointed that we were not able to open our meeting in Vienna earlier this month on the date originally proposed by the Soviet Union. I hope we can begin these talks by the end of the year or shortly thereafter.,none,2021-01-19 11:04:15,0,0,0
28,28,3025_32,"My fellow Americans, this is a debate about whether we can do better and whether we are better. This is a great country. But we are going in the wrong direction and our people, who have worked hard and played by the rules, have been punished long enough.",none,2021-01-19 11:06:17,0,1,0
29,29,2004-09-23-the-american-indian_9,"The National Museum of the American Indian shows how your ancestors once lived, and it does much more than that. It affirms that you and your tribal governments are strong and vital today and provides a place to celebrate your present achievements and your deepest hopes for the future. It allows all Americans to experience the rich culture of the American Indian.",inclusion,2021-01-19 11:11:00,0,0,0
30,30,1714_7,"The Soviet Union is working night and day.  They are bent on our destruction.  Can we possibly afford to divide our influence, our responsibility?  Do you think the Democratic party which will control the House and Senate is going to be able to work with a president who goes around the country today saying, """"All is well, we have never had such great prosperity""""?  I believe the United States is going to have to move in the 1960s, and I believe a responsible, forward-looking president and vice president, working with Democratic majorities in the House and Senate, can move this country forward, can provide prosperity for our people, education for our children, security for our older citizens, a better deal for our farmers, the development of our natural resources.  These are the issues of this campaign.  These are the only issues.  ",none,2021-01-19 11:12:02,0,0,0
31,31,2003_9,"What has made this country what it is, is a great depth of consciousness about people, consciousness that motivates men and women throughout the many generations of our history to do something just a little bit better than was done before, and this nation is characterized by leaders who came from the ranks of people, not an elite born to ride herd on others, but, rather, the people who raise up out of their own ranks their own leaders, so that we have government by the consent of the governed, so that we have government of law, not government of edict, so that we have government that is compassionate, on the one hand and firm in its justice on the other. I think that is what we exemplify by this meeting tonight.  I think that is what you come to pay your respects to, and am I ever glad to be there.  I always like to be where there are good people. I go away feeling just a little better.",none,2021-01-19 11:12:59,1,0,0
32,32,1588_5,"Exploiting the twin themes of human misery and Yankee hatred, Castro's campaign has met with success in almost every country - in Brazil, where both presidential candidates found it politically expedient to appeal to pro-Castro and anti-American elements in the electorate - in Mexico, where anti-American riots followed pressure on a pro-Castro spokesman - in Guatemala, where Castro-equipped revolutionaries are a real menace - in Uruguay, where a general strike was threatened if Castro was not supported at the San Jose Conference.  And--at the same foreign ministers' conference--the United States suffered one of its few diplomatic defeats in the history of inter-American relations, when it was forced to withdraw its protest over Communist efforts in this hemisphere. This is a critical situation--to find so dangerous an enemy on our very doorstep.  The American people want to know how this was permitted to happen--how the Iron Curtain could have advanced almost to our front yard.  They want to know the truth--and I believe that they are entitled to the truth.  It is not enough to blame it on unknown state department personnel.  Major policy on issues such as Cuban security is made at the highest levels--in the national Security Council and elsewhere--and it is the party in power which must accept full responsibility for this disaster.",none,2021-01-19 11:13:56,0,0,0
33,33,2008-10-01-remarks-independence-missouri_6,"Crises often have a way of revealing our better selves - of showing what we are made of, and how much we can achieve when we are put to the test. This is true as well of the grave challenges we face in Washington. Yet it should not require extreme emergencies - when the future of our entire economy is on the line - to bring out the best in us, or to bring us together in service to the common good. We are supposed to do that even in the calmest of times. And if we worked together more often in that spirit, perhaps there would be fewer crises, close-calls, and near-disasters confronting our nation.",none,2021-01-19 11:15:00,0,0,0
34,34,2082_60,"My friends, I am asking you tonight--I am asking tonight--I am asking the young people of America a special plea to them and I am asking you, my friends, out here with the honor roll, I am asking the working people of America tonight to help me--to help me and help yourself and help your families. I am asking you to help me raise a little of the money to match Mr. Nixon's TV time and I am asking you to go door to door and house to house and fight for yourself and for your family and your country. I am asking you to get out to work, to roll up your sleeves like you have done when you built this union and to make the decision on November 5th, a decision for your family, for your union, for your country and for your world.",none,2021-01-19 11:16:10,0,0,0
35,35,2008-10-28-remarks-chester-pennsylvania_22,"When it comes to jobs, the choice in this election is not between putting up a wall around America or allowing every job to disappear overseas. The truth is, we won't be able to bring back every job that we've lost, but that doesn't mean we should follow John McCain's plan to keep giving tax breaks to corporations that send American jobs overseas. I will end those breaks as President, and I will give American businesses a $3,000 tax credit for every job they create right here in the United States of America. We'll create two million new jobs by rebuilding our crumbling roads, and bridges, and schools, and by laying broadband lines to reach every corner of the country. And I will invest $15 billion a year in renewable sources of energy to create five million new energy jobs over the next decade - jobs that pay well and can't be outsourced; jobs building solar panels and wind turbines and a new electricity grid; jobs building the fuel-efficient cars of tomorrow, not in Japan or South Korea but here in the United States of America; jobs that will help us eliminate the oil we import from the Middle East in ten years and help save the planet in the bargain. That's how America can lead again.",none,2021-01-19 11:16:43,0,0,0
36,36,3241_8,"And I was determined to see this country continue to lead the world for peace and freedom. But four years ago you took me on faith. You don't have to do that anymore. Now, there's a record: 10.5 million jobs, record numbers of new businesses, record exports of American products, 4.5 million new homeowners, ten million homeowners who refinanced their homes at lower interest rates, four years of declining crime rates, child support up 50 percent, welfare rolls down two million, out-of-wedlock births dropping for the first time in twenty years. This country is on the right track to the twenty-first century.",none,2021-01-19 11:17:00,1,0,0
37,37,1875_14,"I ask you, those of you who shop in this shopping center: do you want to have your prices increased? Can you take it? What about your budget? Let me ask you, particularly those of you who are older here, living on Social Security, living on pensions or planning to: Do you want the value of your dollars cut in half? That happened once. It happened in the Truman years.",none,2021-01-19 11:17:08,0,0,0
38,38,2016-10-13-palm-beach-florida_13,"What's happening to me is no different than what happened to other innocent people, like the story written in Rolling Stone Magazine – and that magazine should be put out of business. Six months ago, the New York Times wrote a massive story attacking me, and the central witness they used said the story was false, that she was quoted inaccurately. She said I was a great guy, and never made those remarks.",none,2021-01-19 11:17:30,0,0,0
39,39,2004-10-09-st-louis-missouri_18,"Much as he tried to obscure it, on issue after issue, my opponent showed why he's earned the ranking, the most liberal Member of the United States Senate. And several of the statements just don't pass the credibility test. With a straight face, he said, """"I've only had one position on Iraq."""" He must think we've been on another planet. In the spring of 2003, as I ordered the invasion of Iraq, Senator Kerry said, """"It was the right decision."""" Now he says, """"It's the wrong war."""" And he tries to tell us he's had only one position. Who is he trying to kid? He can run, but he cannot hide.",none,2021-01-19 11:17:37,0,0,0
40,40,2492_7,"My idea of tax reform is tax reduction. I'm sure you recall that I submitted to the Congress a proposal to increase the personal exemption from $750 to $1,000. That is meaningful tax reduction to the long shortchanged middle-income taxpayers. Congress didn't pass it, but I make a pledge to you: I'm going to keep the pressure on the next Congress until they do, and if they don't, they'll hear about it in the next election.",none,2021-01-19 11:18:34,0,0,0
41,41,3180_13,"In education, Governor Clinton wants to think the same old way, same old bureaucratic way. We've got a good program, America 2000. It literally revolutionizes American education. It puts the power not in the head of the teachers' union but in the head of the teachers and the families and the parents, and that's where it belongs. One thing we're going to do is provide--like it's working in Milwaukee--provide school choice so the parent can decide private, public, or religious schools. We've done well. One out of every two college students has financial aid; Pell grants are up. And we are going to keep fighting until every student has a share of the American dream by a good education.",none,2021-01-19 11:18:53,0,0,0
42,42,3231_33,"I want to ask you to help me to continue this work to build that bridge to tomorrow. The future of this country represents our best days if we do the right things. The kids in this audience, they'll be doing jobs that haven't been invented yet. A lot of the children in this audience will be doing jobs that have not been imagined yet--if we do the right things.",none,2021-01-19 11:19:23,0,0,0
43,43,2008-10-23-indianapolis-indiana-3_6,"Just yesterday, Senator McCain strongly defended the Bush policy of lavishing tax cuts on corporations that ship American jobs overseas. He made the peculiar argument that the best way to stop companies from shipping jobs overseas is to give more tax cuts to companies that ship jobs overseas. More tax cuts for job outsourcers. That's what Senator McCain proposed as his answer to outsourcing.",none,2021-01-19 11:19:27,0,0,0
44,44,2190_7,"One of the great issues of the 1970s will be to determine the distinctive role of each level of government in the enterprise of education. I believe that our philosophy of encouraging the maximum local control and local participation will provide the answers the times demand. I consider education a federal concern, a state responsibility and a local function. The federal government, with its ability to raise funds on a national basis, should aim at reducing the discrepancies among the various states in their resources for the support of education. State government must bear the legal responsibility of setting standards for attendance, teacher certification, per-pupil expenditure and the development of long range plans. Local school systems should be responsible for developing specific projects and programs, and they should be permitted maximum flexibility, subject only to the broadest of policy definitions.",none,2021-01-19 11:19:41,0,0,0
45,45,2804_2,"It's great to be back in your proud city of Milwaukee and great to be with all of you here at Old Heidelberg Park. You know, Old Heidelberg Park--I can remember when they called it just plain Heidelberg Park. Of course, that was back when if somebody said, """"Hey, kid,"""" I answered.",none,2021-01-19 11:19:54,0,0,0
