,Unnamed: 0,speech_par_id,text,label,annotated_at,high_pride_yl,low_pride_yl,auth_yl
184,184,2004-10-28-remarks-westlake-ohio_11,"Our economy is in the midst of change and challenge. It can be a time of great opportunity if we have the right policies to strengthen, rather than stall, the economic recovery. We have more to do to make sure people can find work in places like Ohio, more to do to improve our children's education, more to do to make sure health care is available and affordable, more to do to strengthen Social Security for a generation to come, and I am ready for the job.",none,2021-01-19 14:21:51,0,0,0
185,185,3230_12,"And yesterday, in the annual report of the United States Census Bureau on how we're doing as a country in terms of our income, we got the following information. Last year, median--that's the people in the middle, direct middle, not the average, the people in the middle--median household income last year increased by almost $900 after inflation, the biggest increase in family income in ten years. Family income since that economic plan passed has gone up over $1,600.",none,2021-01-19 14:22:35,0,0,0
186,186,2439_0,"Thank you very, very much, Congressman Trent Lott, Congressman Thad Cochran, Mayor Lang, Mayor Maxwell, Mayor Saucier--that's not bad is it?  It is wonderful to be here in the great state of Mississippi. It is just so encouraging and wonderful to be here in the city of Gulfport. But I want to remind you of one thing: At the convention in Kansas City, I said we would not concede a single state; I said we would not concede a single vote; I said we would campaign from the snowy banks of Minnesota to the sunny plains of Georgia.",none,2021-01-19 14:22:42,0,0,0
187,187,2004-10-16-beach-florida-2_12,"See, when I came into office, the stock market had been in serious decline for 6 months. The American economy was sliding into a recession. To help families and to get this economy growing again, I pledged to reduce your taxes. I kept my word. The results are clear. The recession was one of the shallowest in American history.",none,2021-01-19 14:22:54,1,0,0
188,188,2004-09-16-rochester-minnesota-1_0,The President. Thank you all. Audience members. Four more years! Four more years! Four more years!,none,2021-01-19 14:22:58,0,0,0
189,189,2012-09-18-york-city-10_12,"Now, that's a very different agenda than a $5 trillion tax cut that's paid for by gutting education, gutting Medicaid, and turning Medicare into a voucher system. It's a different philosophy about how we grow our economy. And I believe that we grow our economy from the middle out and by providing ladders of opportunity for everybody. And when we do, everybody does better.",none,2021-01-19 14:23:05,0,0,0
190,190,3184_10,"Here's a man, Governor Clinton, whose own hometown newspaper says he's a politician utterly without principle, a guy whose supporters gave him that name """"Slick."""" We didn't invent that. It came out of the Democratic primary, out of Arkansas. I say """"slippery when wet,"""" a little different but the same thing.",none,2021-01-19 14:23:13,0,0,0
191,191,1150_1,"I had a wonderful story told me about your town, that only last August in the midst of carrying on your fair you had a great storm that destroyed the buildings and tents and it looked like it was going to be disaster and no fair.  You people pitched in on your own.  You didn't even wait for a Washington bureaucrat to come down and do it.  You did it yourselves.  Moreover, I am told what you could expect in that little incident, that the elephant stayed on the job working until the last and the donkey played out--just too old, too tired.",none,2021-01-19 14:23:36,0,0,0
192,192,2004-09-07-discussion-sedalia-missouri_62,"The President. Steve's with us because he's working here for Wayne. And it's an interesting story. He had a job, and then you decided to——",none,2021-01-19 14:23:45,0,0,0
193,193,1388_7,"We badly need to get down to fundamentals. The first is that whatever the provocation, aggression can no longer be tolerated in the atomic age. This has been our position always. We welcome the U.N. resolution as expressing the sense of the world community on this point, and we all hope that a cease-fire can be promptly arranged.",none,2021-01-19 14:23:50,0,0,0
194,194,3072_1,"Let me also say, one of the things we've got to do, and I'm glad to see these Inglis signs are, we have got to clean House. We have got to get rid of the gridlocked Congress. So elect this good man standing here to the United States House of Representatives. It is time to clean House and change in Washington. Good idea. ",none,2021-01-19 14:24:01,0,0,0
195,195,2834_50,"Now, let me add just one thing. If, however, any level of government--I don't anticipate trouble of this kind--but suppose at any level of government someone really violates the trust and starts pulling back and not doing what they're supposed to do with those block grants. If this is a violation of the constitutional rights of any citizen, then I contend that the federal government has a responsibility to go anywhere where even one citizen's constitutional rights are being violated, and to see that those rights are restored.",none,2021-01-19 14:24:12,0,0,0
196,196,1300_38,"A: You know, fortunately, Mr. Nagel, this morning there was a very significant item in the paper. It was this: There was quoted a top-secret document of the American Defense Department. How it got there, we will never know probably. But that top-secret document brought out one fact that really answers your question. It was this. There was a military estimate made in September 1947 by military men, and it had this conclusion: The military occupation of South Korea is not essential to the military security of the United States of America.",none,2021-01-19 14:27:23,0,0,0
197,197,1270_2,"In American single-talk, the threat amounts to this: First, the Russian Communist empire has recovered from the industrial and human destruction of the last war. Second, by skillful, aggressive, and ruthless prosecution of the Cold War, the Soviet Empire has added to its already great resources the important industrial complex of Central and Eastern Europe, and has added to its own large population six-hundred million human beings for use either as slave labor, or as expendable military masses.",none,2021-01-19 14:27:45,0,0,0
198,198,3345_11,"And while here he made another of his big spending promises. He promised to spend $2 billion cleaning up toxic waste sites and redeveloping abandoned factories and new businesses. The problem with that promise is, that Michigan was already way ahead of him, way ahead of him, creating jobs and promoting economic growth with tax cuts and less regulation and cutting back on frivolous lawsuits. Don't forget that one, either. So--",none,2021-01-19 14:28:46,0,0,0
199,199,2995_18,"And our plan will begin on the first day of our inauguration, not the last two months before our effort to secure reelection. But you and I know this election is about more than the state of our economy and the government's responsibility to provide every American a decent chance at a decent way of life. It is also about the American spirit.",none,2021-01-19 14:29:30,0,0,0
200,200,2156_17,"We need to restore the strength of the United States, restore it so that the next president of the United States when he negotiates, as he must, and as he will, with the Soviet Union or any others who might be potential enemies of the United States in any conflict, will always negotiate from strength and never from weakness. I pledge that that strength will be restored, and, my friends, we need one other thing. We need to restore respect for this great country around the world.",none,2021-01-19 14:29:38,0,1,0
201,201,1106_4,"There is no other way to account for the reception given to a Republican nominee--and remember this, accompanied as his chief advisor by a Yankee Governor from almost as Yankee a state as you can find, New Hampshire--a reception in Atlanta, followed by Jacksonville, Miami, Tampa, Birmingham and Little Rock. It was always the same and usually, ladies and gentlemen, with the shout along the roadsides and in the crowds, """"Throw 'em out, Ike; give 'em Hell."""" That is a battle cry that has now been repeated vociferously, in Philadelphia, even more loudly in Minnesota, yesterday in Cleveland, and I assure you I heard it many times coming in from the airport only a couple of hours ago.",none,2021-01-19 14:30:24,0,0,0
202,202,2004-10-30-orlando-florida-0_38,"The President. That's five times for every year he's been in the Senate. I would call that a predictable pattern, a leading indicator. During the campaign, he's made some big promises too. He's promised $2.2 trillion of new spending. That is trillion with a """"T."""" That's a lot. That's a lot even for a Senator from Massachusetts.",none,2021-01-19 14:30:28,0,0,0
203,203,1856_1,"In speaking of this decision, it is one that is not just a decision to be made between two men who want to be president or between two political parties. It is a decision involving every home and every person in America as well as people throughout the world. It is decision in which you, the people, will, in effect, be voting the prices you will pay in the grocery store, the prices you will pay in the clothing store. You will be voting the taxes you will pay. You will also be voting for the policies which may or may not keep the peace and keep it without surrender in the years ahead.",none,2021-01-19 14:31:18,0,0,0
204,204,2090_39,"Now, there is another kind of candidate--that first one was George Wallace, in case you missed who I was talking about. There is another kind of candidate who takes a look at the weather chart and he says, """"I think we have gone too far already, and I don't think we ought to take off, or if we do, let's circle the airport"""", or maybe he isn't quite that daring:  He says, """"Let's get out to the end of the runway and buzz the motors and make sounds like we are going to take off--that will fool some people.  And the journey that needed to be made and the mission that needed to be accomplished ended up on the end of the runway, with props whirling or jet engines blasting, but the brakes were on because the pilot and, God forbid, the co-pilot in this instance--at least the pilot looked around and he said """"They can't see us from here; let's just pretend that we are taking off.""""",none,2021-01-19 14:31:54,0,0,0
205,205,2004-10-27-pontiac-michigan-0_18,"Audience members. Boo-o-o! The President. Now, the Senator is making wild charges about missing explosives, when his top foreign policy adviser admits he does not know the facts. He said, quote, """"I don't know the truth,"""" end quote. But think about that. The Senator is denigrating the actions of our troops and commanders in the field without knowing the facts.",none,2021-01-19 14:31:58,0,0,0
206,206,3049_24,"I believe we ought to make welfare a second chance, not a way of life. I believe we ought to invest in people, really invest in them if they're trapped on welfare. Give them some money for education and training that means something. Support their children with medical care and child care, and then require people to work after you've taken care of their kids.",none,2021-01-19 14:32:16,0,0,0
207,207,2012-09-10-event-mansfield-ohio_28,He wants to raise taxes on small business. That's the path he's put us on. He's increased regulation massively on small business. That's the path he's put us on.,none,2021-01-19 14:32:46,0,0,0
208,208,2012-10-07-st-lucie-florida_33,AUDIENCE MEMBERS: Mitt! Mitt! Mitt! Mitt! Mitt! Mitt! Mitt! Mitt! Mitt! Mitt! Mitt!,none,2021-01-19 14:32:51,0,0,0
209,209,2710_7,"Secondly, to try to help provide the pay that teachers need that makes it possible to be a teacher without deep sacrifice to yourself and your family.  The average teacher in America today starts at about $14,000 or $13,000 a year.  In some states it's far less.  I was in Florida a year ago, and I saw a teacher's schedule that showed a teacher who had twenty years of teaching with a doctorate degree made $17,000 a year.  I may be off a couple thousand, but I remember being shocked by the figure.  I have talked to any number of young people who went into teaching full of hope and found out they just couldn't stick with it, couldn't afford it.  I talked to a young man in New Hampshire.  I don't think he voted for me based on the returns, but we had a nice conversation.  He told me that, more than anything, he wanted to be a science teacher.  But he had a family of two kids, he was now thirty-six years of age.  He said, """"I couldn't do it.  I had to get out.  And I made double or triple whatever it was in the private sector.""""  What is happening today is that a lot of young, skilled people are not going into education.  The tests show that a disproportionate number are testing at the lowest levels of skills and aptitudes.  That doesn't mean a lot of them won't become good teachers.  We ought to have a society in which both in terms of the environment of teaching being honored as a profession and the pay, is such that the very best, the top of each class, goes into education.  I think last year--as I recall, in Los Angeles--I believe I was told that a beginning teacher there made $13,000 and a beginning policeman $28,000.  I don't begrudge the policeman's salary at all.  But we're saying something about teaching when we give it this low status, and, of course, our kids will pay and our nation will pay.  By now we should know that it is the product of the trained mind that is the greatest source of wealth in America.  It's more important than all of our national resources, everything.  That's from an economic standpoint.  But education, of course--that's why I use the word learning--goes to the basis of our democracy, to our personal enrichment and fulfillment, of our understanding of this ever more dangerous world in which we live.  Education does everything that we need.  And it all begins with what goes on in that classroom.  If it's not effective, if we don't have the best teaching, it's not going to work.  As president, I intend to put a tremendous amount of attention on this.  I've spent a lot of my life in it.  And I don't think there's any other way of getting it done except with presidential leadership.",none,2021-01-19 14:33:21,0,0,0
210,210,2016-08-12-arena-erie-pennsylvania_79,"You know, she said fairly recently, I don't like Donald Trump's tone. His tone isn't nice. And I said, here we have a country that's being taken advantage of by every country in the world. Our businesses are being taken. Our jobs being taken. Everything's being taken.",none,2021-01-19 14:33:26,0,1,0
211,211,2012-10-11-rally-miami-florida_0,"The President. Hello, Miami! How's it going, Hurricanes? Can everybody please give Lizzie a big round of applause for that great introduction.",none,2021-01-19 14:33:46,0,0,0
212,212,2400_18,"We should maintain the personal interrelationships between patients and their physicians, and we should give freedom of choice in the selection of physicians and the treatment centers to the patient to be cared for. Along with catastrophic insurance coverage, we must make the provision of prenatal and infant care benefits one of our highest priorities. We must phase in the program as rapidly as revenues permit, helping first, those who most need help, and achieving a comprehensive program well defined in the end. Now many questions remain to be answered on national health insurance, as any member of the Congress knows, and as professional health care specialists, like yourselves, know. And I ask for your advice and your help in obtaining the best possible program as quickly and as early as possible.",none,2021-01-19 14:34:04,0,0,0
213,213,2012-09-25-new-york-city_61,"MODERATOR: All right. Governor, thank you. We're going to go to questions with the explanation that this audience is diverse. There are teachers, there are students, there are policymakers. There are even people who, God forbid, might be pushing a certain agenda. So we'll see what we get.",none,2021-01-19 14:34:51,0,0,0
214,214,2012-11-05-des-moines-iowa_36,"But I'm running for President, so I do what I'm supposed to do, and I'm shaking hands; I say: """"How do you do? Nice to meet you."""" And I'm making my way around the room, and suddenly, I hear this voice cry out behind me: """"Fired up!""""",none,2021-01-19 14:34:55,0,0,0
215,215,3278_8,"Four years ago I ran for president with a simple vision, and I ask you to think about it tonight. When you go home just take a little time and ask yourself, what do I want America to look like four years from now when we start that new century. What do I want America to look like when my children are my age? My answer is simple: I want an America where the American Dream is alive and well for everybody who is responsible enough to work for it. I want an America still the world's strongest force for peace and freedom and prosperity. And I want an America relishing, respecting its diversity and coming together across its differences in shared values, not being driven apart as so many places in the world are today.",inclusion,2021-01-19 14:35:56,0,0,0
216,216,2016-09-27-raleigh-north-carolina_26,"So I'm excited about what we can do. I really am. And I'm going to leave it to the fact-checkers to go through all of – all of Donald Trump's claims. There were – there was a lot of work for fact-checkers last night. But here's a couple of things that caught my attention. He actually bragged about gaming the system to get out of paying his fair share of taxes. In fact, I think there's a strong probability he hasn't paid federal taxes a lot of years. And this is a man who goes around calling our military a disaster; who goes around criticizing every institution, from health care to education, our vets. But he probably hasn't paid a penny to support our troops or our vets or our schools or our health care systems.",none,2021-01-19 14:36:18,0,0,0
217,217,1367_28,"What the Old Guard Republican leaders did to get their man in was to decide, coldly and with due calculation, that the personal popularity of one man was great enough that the general distrust of another wouldn't matter. They concluded, or rather they hoped, that enough voters would cast a ballot for one man's popularity without regard to the possible consequences if another became President. I think they were wrong. I think the people of this country do not view the vice presidency-- at least in these times-- as a casual incident. They know what the vice presidency is this nation's life insurance policy. They are going to read the fine print. And I don't think they are going to go for four years uninsured.",none,2021-01-19 14:36:56,0,0,0
218,218,1772_19,"First, we have a record, a record of which we are proud.  There are many things that I think the people of America will be grateful to Dwight Eisenhower for.  They will be grateful to him because he brought such tremendous dignity and stature to the highest office of this land, the presidency of the United states.",none,2021-01-19 14:36:59,1,0,0
219,219,2004-08-12-remarks-carson-california_3,"The road to this America takes us in a new and better direction. It's based on telling the American people the truth – not selling them shop-worn slogans. But, in the last week, we've been told over and over again that America has turned the corner.",none,2021-01-19 14:37:06,0,0,0
220,0,1045_13,"We can make our society ever more productive and more abundant and our people ever more free, but only if we have the purpose, the vision and the determination to do so. We can win peace in the world without a third world war, but only by dedicating our minds and our hearts, our sweat and our blood to that great task for as long as may be necessary. I tell you that the way to our goal is not easy, but the goal is worth the price, for the goal is nothing less than a nation fair and productive beyond our dreams and a world of law and order where men of good will can live together in equal dignity and under God. This is the future that we seek and this is the future for which I know we are willing to work and to sacrifice and to labor with all of our minds and with all of our hearts, and this is the cause to which we call you. We don't call it a crusade--we just call it, """"Forward with America.""""",exclusion,2021-01-19 15:20:54,0,0,0
221,1,2005_14,"I believe that there are those who would bury their head in the sand and I have confidence in the goodwill of the American people, in their good judgment, in their common sense, and like Adlai Stevenson before me, I intend to talk sense to the American people. I have great confidence in the uncommon decency that characterizes his nation.  In short, as I have said, I trust the people and it is because I trust the great, unfrightened, and sometimes silent majority of Americans, that I choose to speak, not to their fears, but to their hopes.",none,2021-01-19 15:25:01,1,0,0
222,2,3312_54,"And there are other steps we can take. Teenagers who rape and rob and murder should not be automatically released when they turn eighteen or twenty. This happens in some places today. And the records of those violent juvenile offenders should be made available to the courts, law enforcement, and for employment in sensitive jobs, especially those involving work with children. Sometimes you never know. You never know. And they ought to be made public. They ought to be released.",none,2021-01-19 15:25:26,0,0,1
223,3,3358_46,"And I believe you can learn as many languages as you want but it ought to be English first. We ought to learn English. If you don't learn English in America, you're going to be left behind. It's not fair to some one not to learn English. And I will continue to support bilingual education if the purpose is to learn English. Otherwise you're going to be lost in America.",exclusion,2021-01-19 15:27:10,0,0,0
224,4,2570_18,"And we have set a standard now in this administration that subsequent presidents will have to meet. And I ask you as a special favor to me to make darned sure that in the future that presidents do at least as well as I do on these appointments, and I hope even better if it's possible. Immigration, naturalization--a burning issue with you and with me and with our nation, and I asked to serve as commissioner of that entire major department Leonel Castillo. He did a superb job. And I've now nominated, as you know, Matt Garcia from Texas to take that position, and I hope he'll be confirmed very shortly.",inclusion,2021-01-19 15:28:00,0,0,0
225,5,3277_23,"Are we going to build a bridge to the future, or a bridge to the past? Is that bridge going to be big enough for all of us to walk across together. Are we going to tell some people, you're on your own, have a good time, or are we going to say, it does take a village?",none,2021-01-19 15:28:22,0,0,0
226,6,3276_8,"Now, the leaders of the other party, they fought us. The toughest crime bill in history with all the law enforcement organizations in the country behind it, and they wouldn't help. They fought us. They said we were going to take people's guns away, and they walked away from an historic opportunity to make our children, our streets, our neighborhoods, our schools, our homes safer.",none,2021-01-19 15:28:49,0,0,0
227,7,1290_14,"Now, ladies and gentlemen, in concluding this short statement, I want to say this:  I do not come before you to engage in any competition of political promises.  This party in power in the last seven years has used up every possible political promise there is, and some of them have gotten pretty shopworn.  For example, there is no easier way to duck an issue than to say this, """"I will promise you a law,"""" well knowing they cannot deliver it.  There is no easier way to get out of a situation.  What I promise you is work, never ending work, to make certain that justice is done.  So I cannot come before you with the competition of promises, but I do come before you with a pledge, and this is the pledge.  If you want to put this crusade at the helm of your government; if you want to substitute for these 22 caliber men who are trying to hold 45 caliber jobs the finest men and women that we can draw from all sections of this country, from every walk of life--and let me say plainly, based upon merit and without respect to color or creed; if you want to have a government of that kind, then you belong in this crusade.",inclusion,2021-01-19 15:29:43,0,0,0
228,8,2016-09-21-center-orlando-florida_34,"I've always believed that the ultimate test of our society is more than the size of our economy or the strength of our military. It's how we treat our fellow human beings, especially the most vulnerable among us. And on this front especially, I intend for my presidency to move our country forward. Together, we will make our economy and our country more welcoming to people with disabilities because we all win when everyone gets to share in the American dream.",inclusion,2021-01-19 15:30:52,0,0,0
229,9,2000_38,"I do not think that you can make social progress in lawlessness and violence.  I do not believe so.  I think in this country of ours you can make general social progress in order, that is, if there is reasonable order and that means, of course, civil order and civil justice.  They are one and inseparable.",none,2021-01-19 15:31:35,0,0,0
