Speech_id,text,length,par_id
1124,Thank you very much indeed.,27,999
3055,Together we can make this victory not a victory of party or for a person but a victory for you and the American people. Let's go out and do it on Tuesday. Thank you very much.,175,998
3041,Thank you and God bless you all.,32,998
1656,"Now, 100 years later, we know there is a God, and we know He hates injustice, and we see the storm coming.  We see his hand in it.  But if He has a place and a part for us, I believe we are ready.  ",198,998
1656,Thank you.,10,999
1130,A profound responsibility rests upon American leadership once more to cast our fear and inspire once again a feeling of courage and confidence and faith.  To that end I pledge myself and the Republican Party.  Let us turn our eyes again to the light.,250,998
2439,"Thank you, and we won't let you down. It's wonderful to be here. Thank you very much.",85,998
1865,"My friends, we stand together, standing together on issues greater than a party, as great as America itself, and we stand together today in gratitude, in gratitude to a man who has served this nation fifty years, a man who has never let his country down, a man who got us out of a war and has kept us out of other wars by the greatest wisdom I can testify a man can have, a man who is the symbol of peace, of hope, and liberty for all the world.",445,998
1865,"I am proud and Cabot is proud and Nelson is proud that we have been serving with him and have been trained by him, and I only hope that we can be worthy of him and of the great American people. I present now the President of the United States to you.",250,999
1871,"This is not a question of whose party label I wear or you wear or my opponent wears. It's a question of what leadership America needs, and I say that if you believe that the leadership that Cabot Lodge and I can provide is the leadership that America needs, then and only then do I ask for your support. If you do believe that, then I ask you: go out and work for us, work for us recognizing that you will be working not just for a man and not just for a party, but for what is best for America--and that is best for you.",521,998
1871,Thank you and good night.,25,999
3096,"My agenda contains thirteen specific actions that I'm going to fight to accomplish in the first year of my second term, with all those new congressmen that are coming in as a result of the confusion and disarray in the House. And I'm going to get them done. I'm going to get these things done with your help, because America has what it takes to win the economic competition, to win the peace. So let's get on with the job. ",424,998
3096,"And thank you for this exceptionally warm welcome, this Missouri welcome. And may God bless the greatest country on the face of the Earth, the United States of America. Thank you all.",183,999
2388,So thank you for letting me come. Maybe we can do it together!,62,998
1681,Thank you.,10,998
1859,"We're a great people, and I only hope that we, Cabot Lodge and I, can be worthy of the great American people in these years ahead.",130,998
1859,Thank you.,10,999
3082,"Matthew, chapter 6, verse 21, reminds us, ""Where your treasure is, there your heart will be also."" And our treasure is with America. With our renewal agenda and your efforts out there in those grass roots, we are joined in a crusade to create an American future that is worthy of its proud past.",295,998
3082,"Thank you for this exceptionally warm welcome. May God bless this great nation, the United States of America. Thank you all very, very much. Thank you.",151,999
2175,"And across this world I can say to you that at the present time, my friends, whether it's in the Soviet Union or whether it's in Poland or whether it's in Hungary or Rumania or Czechoslovakia or in Latin America, the hopes of the world for peace and freedom, they are with us and so it is up to us. And I say to you we cannot fail this challenge--we will not fail it--and with your help we will win a great victory for America and a great victory for peace.",457,998
2613,"If American workers have the tools and the training, they can out-produce any workers on earth. And we're going to give them the tools and training. With a new energy policy as a foundation, we're ready to move into the future and rebuild opportunities for jobs and a brighter and more prosperous life for Americans. At the end of the Second World War, America rebuilt the industry of Germany; America rebuilt the industrial complex of Japan. And now it's time for us to rebuild the industrial complex of the United States of America, and that's what we're going to do. You help me, I'll help you; we'll have a better future in the years ahead if Democrats are in office.",671,998
2613,Thank you very much. I'm counting on you. Work this last week. ,63,999
2607,Thank you very much.,20,998
2161,"As I indicated to you the directions and the problems, I would not want to leave this great audience without indicating to you the promise and the hope of America, and particularly with all of this great throng of young people here.",232,998
2161,"You are going to hear a lot in this campaign from the candidates about this is wrong and that is wrong, and sometimes you may go home and wonder, well, what a poor time to be alive in this country. Don't ever believe it. Look, I have traveled to most of the countries of the world, and I have seen many great countries and many great people.",341,999
1468,May I say that it seems to me that the great struggle today is between those who believe in no God and those who believe in God. I really don't see why we should engage in close debate over what you may believe and what I may believe. That is my privilege and your privilege.,275,998
3257,"So I ask you, if you want to help us build that bridge to the twenty-first century, build it every day between now and election day by finding somebody else who will be there and be there for people who care about them and their future.",236,998
3257,Thank you and God bless you.,28,999
2149,"It is that kind of a challenge that I give to you. It is that kind of a challenge that I ask you to join, and, as I ask you to join it, I say to you, in the darkness of this night, that the long dark night for America is about to end. A new day is about to dawn. Let us join in hastening that dawn--a new dawn and a new day for America.",336,998
2149,"I just received from Larry Fargher, our candidate for Congress, a bottle of California champagne which he says he hopes I will open election night. I just want you to know that I am not boycotting California grapes.",215,999
1440,Thank you. ,11,998
983,"I think I know what your choice will be and I look forward to the job with no sense of elation, but confident that I will have your patient understanding, your help and your prayers.",182,998
1326,Must leave--long journey--wherever it leads--always be Springfield--central Illinois--and you to look forward to.,113,998
1332,"It is our task to provide the leadership worthy of this great nation at its zenith. In humility, and in gratitude to the One who has granted us the privilege to live in this land of limitless opportunity, let us apply ourselves to the work that America was meant to do.",269,998
997,"Before you leave--or, before I leave--may I introduce to you my sister, Mrs. Ives, and my aunt, Letitia Stevenson, who is over seventy, and who is the best campaigner of us all.  What is more, they make speeches everywhere they go.  I think if they made all the speeches and I make none of them, it would be all over.",317,998
3243,"So today let us resolve to keep faith with our future by passing on to our children an Information Superhighway that will help them to live out their dreams. But let us also resolve to make sure that their dreams are the right dreams so that when we get to this great, brand-new century and this remarkable age of possibility, the vision we all share for our future can become real.",382,998
3243,"Thank you, and God bless you all.",33,999
2808,"All right, thank you all very much. God bless you all. They tell me I have to get in the car and go.",100,998
968,"Let us now with good heart and high hope and steadfastness of will go forward with our great purpose--to build a strong America, a peaceful world, and a shining future for ourselves and our children.",199,998
3294,"Will you help us on Tuesday to elect Joe Brennan? Will you help us on Tuesday to build a bridge to the twenty-first century? Will Maine lead the way into a bright, new era, America's best days? I need you. I can't hear you! Say it!",231,998
3294,Thank you. God bless you. Thank you.,36,999
2834,"Listen, thank you all, and God bless you.",41,998
3280,Thank you. God bless you. We can do it. Thank you.,50,998
954,"You have been very kind to me and I am very much touched by your reception here this morning.  I don't think I need to tell you what I am doing these days, nor need I ask you to do anything more than use your heads, and if you do, I have little doubt of what will happen come next November.",290,998
954,Thank you all and God bless you.,32,999
1497,"I do not accept the view that our high noon is in the past, and that we are moving into the late afternoon. I think our brightest days can be ahead. I think it is up to us to build the kind of country here, the kind of economic society, the kind of equality for all our citizens, regardless of their race or their religion, so that people around the world wish to move with us and not with our adversaries.",406,998
1497,"I ask your help in this campaign, I ask your assistance. We cannot possibly win without you, but I think if we can move, we can start this great boiler which is the United States, fired up again, and we can make this country move. Thank you.",241,999
1396,"I want to say one more word about leadership.  I told you I was going to wander all over the countryside.  The tactical schools used to tell us that a commander visited his troops in order to inspire them; they fight better.  From the beginning of my soldier experience, I learned this: I loved those visits, but it was I that gained the inspiration.  There is no American that can't take inspiration from young twenty-year-olds, if he will watch them in action.  They bring to a cause in which they believe an energy, a zeal, a belief, a conviction that is inspiring to watch, and it sends each of us back doing our work better.",629,998
1396,"Now, in conclusion, you know the problems.  You must receive constant information from your headquarters.  That information is rather like the ammunition which you use in a campaign.  Use it usefully.  It's to prove that the Republican party is dedicated to the welfare of all the people of America, and to an honorable and just peace abroad.  And remember, let us make sure that everybody has a right to exercise the ballot, because I would say that a voter without a ballot is like a soldier without a bullet.  Let's make sure that every man on Election Day is armed and ready to do his part with his own ballot.",614,999
2847,"Thank you. Thank you all very much. Thank you for your wonderful hospitality and the warmth of your greeting. Thank you for your support. And God bless, God bless you. Thank you very much.",188,998
933,"I appreciate your giving me this reception, Mr. Mayor, and making it possible for me to have the opportunity to become acquainted with Seymour. I was educated in this state and every time I come back I get a little more education.",230,998
927,"We Democrats like this century, belong to it and propose to realize its responsibilities to the full. To assure the continuation of progress in the United States, to move toward greater freedom and greater opportunity for our citizens, to fight for peace in the world, there is a broad and proven path, but, of course, as the Democratic candidate, modesty forbids me to tell you which path to follow on November 4th.",416,998
2853,"The other day I said something to a group of students in the White House that I will repeat to you: We are free. We are the land of the free, because we are the home of the brave.",179,998
2853,"Thank you, and God bless you all, and lechayim.",47,999
1369,"Let's open our eyes, let's face the facts, let's work for all the people, not just for some of them; let's get up and get doing and build a better and a peaceful America.",170,998
2660,Let's make America great again--and where better to begin than on the American farm. ,85,998
2106,All right--let's go to work now and win. ,41,998
3218,"Now, I want to ask you again--I want you to take the next six weeks and five days, go out to your friends and neighbors, without regard to their party, and say, let's have a talk about what we want America to look like in the twenty-first century. Let's have a talk about what we want America to look like when our children are our age. Let's have a talk about this election because we're electing the last president of the twentieth century and the first president of the twenty-first century. And let's have a talk about how we can build that bridge big enough, wide enough, and strong enough so we can all go marching across it together to the best days America has ever had.",678,998
3218,Thank you and God bless you all. Thank you.,43,999
2112,Thank you very much.  ,22,998
2674,"Today Mr. Carter may be interested in Steubenville. But on November 5th, after the election, he may not be. So I hope the workers of Steubenville will join with the rest of Americans to make sure that it doesn't matter what Mr. Carter is interested in after the election. ",272,998
2884,"And we are confident, as we turn to face the future, that the best America is not behind us, the best America is yet to come.",125,998
1355,"I see this task--this crucial challenge in terms of restoring America's economic, military, yes, and most of all, its moral leadership in the world.",148,998
3224,"The children in this audience today, many of them will do jobs that have not been invented yet. Some of them will do work that has not been imagined yet. All we have to do is to build the right kind of bridge that's broad enough, big enough and strong enough for all of us to walk across. I hope you will help me build it.",322,998
3224,Thank you and God bless you all.,32,999
3230,"If what we do is to create opportunity for everybody who is willing to work for it, if we prove that unlike all these other countries that are torn apart by their differences, we can be a country of different races, different religions, different points of view, bound together by our fidelity to the American system and American values, that we can lead the world--that's what I want the story to be. If those are the questions people ask before the election in November, thirty-nine days from now, I believe I know what the answers will be. You go out and reach out to other citizens so that we can go forward and build that bridge to the 21st Century.",654,998
3230,Thank you and God bless you all.,32,999
1427,"Thus will our spirit rule and direct our might, and thus may we go on building this America of justice and strength, in a world of peace and of law.",148,998
1427,"Thank you, my friends, very much indeed.",40,999
1341,"But to do this we must have a united America, a dedicated America, an America which renews its strength from its service in the cause of the people. That is the America which the Democratic party has always sought, for our purpose has always been to enlarge the rights and the opportunities for everyone. We will remain ever loyal to that faith.",345,998
1341,"In that faith we will win in November, and then we can move on together to achieve the New America which lies ahead.",116,999
2890,"When we prepare, as we must every day and every week, to build a future where America is free, where America is strong, where America is leading the way, where America is number one.",182,998
2648,"The steel industry must be allowed to earn a reasonable profit on investment and on sales, in order to generate the funds for investment in plant modernization and expansion. Government loans or subsidies are no substitute for honest profits earned through aggressive cost-saving and competitive selling in a free and open marketplace.",335,998
2648,"America needs a modern, world-class steel industry. My administration will support government policies which enable us to achieve it. ",134,999
1816,"So if you believe this decision is important--and, believe me, it is--then I say, don't just vote, but go out and work between now and election day as you never have before.  Work for the victory, not just of a party and not just of a man, but work for the victory of the ideals in which you believe, and that will be right.",324,998
1816,Thank you very much.,20,999
1194,"Ladies and gentlemen, as I have gone around this country I have found out one thing.  No true American objects to taxes as long as he knows those taxes are necessary and are used for that necessary purpose.  And of course it is true today in this day when the Soviets hang like a thunder cloud on the horizon as a threat to our safety and with all of the rest of the problems we have in the world, including rearming, that taxes are necessary.  That very fact makes it doubly essential that we watch every single cent we spend so that you get 100 cents' worth of value for every dollar you pay out.  That is the purpose of this crusade.  That is the purpose of the crusade that we ask you to join; your governor, your senator, your congressman, and right down the line, to get in with us and we will do a job of cleaning out.",825,998
1194,"And now, ladies and gentlemen, you have paid me a very great honor in coming out to give me a chance to express these few thoughts.  May I give you a little bit better part of the program than just my words.  I should like to bring out the better half of the Eisenhower family for a second. ",291,999
1180,"Arthur Vandenburg assured that isolationism was dead forever.  He pointed out very clearly that there are two kinds of isolationism, one kind where we ourselves would refuse to see our relationships with the world, and the other the kind that might be forced upon us by gradual encirclement and economic strangulation.  He was against both.  This new kind is an insidious one which the Republicans and their friends--everybody who thinks like Vandenburg--have been able to see and are fighting against in the present contest.  ",527,998
1180,"Ladies and gentlemen, to come to this city of yours and on this day when you have opened the duck hunting season and to see a crowd like this, it is a great honor to be on this platform with all of your candidates for Congress, for the Senate, and I must say I am exceedingly proud to be here with all of them, but I want to make special mention of your next Senator Potter because he was with me a veteran of the ",414,999
2489,THE ,4,998
2304,"Let us think of Tanya and of the other Tanyas and their brothers and sisters everywhere in Russia, in China, in America, as we proudly meet our responsibilities for leadership in the world in a way worthy of a great people.",223,998
2304,"I ask you, my fellow Americans, to join our new majority not just in the cause of winning an election, but in achieving a hope that mankind has had since the beginning of civilization.  Let us build a peace that our children and all the children of the world can enjoy for generations to come.",293,999
2476,"Thank you very, very much.",26,998
2310,Grazie a tutti. ,16,998
3026,Thank you very much.,20,998
2338,"You are the ones who are going to make the difference.  You are the ones who are going to steam up the workers.  You are the ones who are going to get out the vote.  On election eve, when the vote comes in, if we do have this enormous turnaround which we can have in this great eastern seaboard--understand, it can be the biggest turnaround of any section of the country--if we do have it, while I will not be able to call each of you individually, I am just telling you right now, I know who did it.  You did it, and thank you very much.",538,998
1631,Thank you.  ,12,998
1157,Thank you very much.,20,998
1143,"Now, ladies and gentlemen, that is the gist of my message.  I bring only one pledge.  If the people of the United States decide to entrust me with the responsibility of occupying the highest office in the land and of surrounding myself there with the finest brains that the country can produce from agriculture, from business, from the professions, from any place we can get them --if they want to entrust me with that responsibility and my associates with equal responsibilities, they have this pledge:  Those men and women and I will work for one thing and be guided by one principle--what is good for the United States of America.  Nothing more and nothing less.  We will try to inform ourselves of the special problems, of the special needs of every nook and cranny of this country, but in the long run the decisions reached and the policies adopted must be; does it serve the best interests of 155 million Americans.",921,998
1143,"Ladies and gentlemen, before you meet the distinguished Nebraskans who have been traveling on this train with me and to whom I am so deeply indebted for that advice and help, I hope you will allow me to bring out the better half of the Eisenhower family, my Mamie.     ",269,999
1625,"They have not noted a sense of urgency, they have run on the slogan of peace and prosperity, they have run on the slogan of ""You never had it so good.""  If Mr. Nixon honestly believes that, then in my judgment he has completely misread the trend of the times.  If he does not believe it and runs on those slogans merely as a device for winning this election, then he makes the same mistake that Stanley Baldwin made in 1935 in England, which cost the British so heavily and almost resulted in the enslavement of Europe.  I believe that on this occasion this year, in this election the Democratic party is on the side of right, because our basic feeling is that unless this country is prepared to move again in the 1960s, we will not lose only our position as the leaders of the free world, but we will also endanger our security.  Therefore, being on the right side, win or lose, I believe we contribute to the well-being of this nation and my judgment is we will win.  ",970,998
1625,Thank you. ,11,999
3032,"Thank you, and God bless you!",29,998
1962,"But remember, whether it is the man that picks up the telephone on the end of the ""hot line"" that is calling from Moscow, or whether it is the man that sits there with the responsibility of his thumb close to that button--who must act on a moment's notice--that no man's judgment on any given question is any better than the information he has on that question. And he can't get all the information he needs in this space age hunting and fishing. He can't get all that he needs on the football field or the baseball diamond. He has to get it in grade school, high school, in college, in graduate work--because Americans must never be second to anyone.",651,998
1976,"But what is more important, 300 million people live today that would not have lived had we not had the cool, calm, wise leadership of that man who watches over us in heaven this afternoon, John Fitzgerald Kennedy.  He gave his life for his country, and there is not a man out there that wouldn't give his if he thought he could save his country by doing so.",357,998
1976,"But you are not called on to do that today.  You are called on next Tuesday to go down as a free American, without restraint, without influence, without pressure, and act upon the basis of your judgment on what is best for your country.  I came to California to ask you to do that.",281,999
1786,"If you believe that what I stand for, what my colleague, Cabot Lodge stands for, that our experience in dealing with these problems is what America needs, then I say, we ask for your support and remember that as you work for us, you're working not just for a party, but what is best for America, and that is best for you, too.",326,998
1786,Thank you very much.,20,999
3191,"I have no right to ask you for anything for me, you have already given me more than I can ever repay. But for the sake of our children, our state, and our beloved country, one more time will you help me build that bridge to the twenty-first century?",249,998
3191,"Thank you, God bless you, let's go get it.",42,999
3185,"Don't listen to these guys that say we're in decline. We are the United States. God bless you all. Thank you very much. Great rally. Now go to the polls, Ohio. ",160,998
1792,"This is our case.  We present to you our background.  We present to you our faith in this country.  We present to you the determination to lead America into a great new future in which men can live at peace with each other, in which nations can be independent--which all people can be free.  To this, we dedicate ourselves, and we thank you, again, for the opportunity of meeting with you. ",390,998
1779,Thank you very much.,20,998
