Speech_id,text,length,par_id
1849,"That is what we ask to do.  We say: if you elect us, we will keep America strong at home; we will not break faith with the older people of America; we will see to it that our country progresses so that our young people will have better opportunities for education, housing, and health and all these other fields, and we will also see that America in this critical moment of history realizes her destiny by leading the peoples of the world to peace without surrender, to freedom without war.",490,998
1849,Thank you very much.,20,999
1691,"Finally, in the final analysis, if we can maintain our strength, if we can last this long race of nerve and will, this test of our national determination, the final blow which will be struck to the Communist empire will be based on this desire of people to govern their own destiny.  If there is any fact that has emerged from the stream of history, whether it is East Germany, Hungary, or Poland against the Communists, or the experience of Africa against Western colonialism, it is the desire of people to be independent.  We know it from our history.  Therefore, what we have to do is maintain our strength, to spread the umbrella of freedom around the globe.  As Thomas Jefferson once said, ""The disease of liberty is catching,"" and ultimately it will catch around the globe.  What we have to make sure is that during these years, when this disease is spreading, that we maintain our strength, that we offer it shelter, that we offer it encouragement, that we move this country and in moving our country, move the globe.  ",1026,998
1691,Thank you.,10,999
1685,Thank you.,10,998
3092,Thank you so much for listening. And may God bless the United States of America. Thank you. Thank you very much.,112,998
1108,"Good-bye, good luck and thanks!",31,998
2401,I ask your help.,16,998
2401,Thank you.,10,999
2367,"If I am elected president, I intend to provide it.",50,998
2367,Thank you.,10,999
2415,MR. ,4,998
1134,"Now, I have made my 24th talk, ladies and gentlemen.  Now I am going to ask Mamie to come out, because you know she is an Iowan and she wants to wave at you before we get out of here.",183,998
1652,Thank you.  ,12,998
3045,"Think about what you'll feel like on November 4th if you have helped to create a new America, to bring back the American dream and bring the American people together. Stay with me. Fight on, and together we can do what we ought to do for our country. Thank you, and God bless you all. Thank you.",295,998
3051,"You've got a week. I ask you to talk to your friends and neighbors, to tell them there's a tired old Republican party that many Republicans have abandoned. It's run out of ideas and energy and direction and passion. It spends more time looking into its opponents than it does looking toward the future. They've run out of everything good and we ought to run them out of town. You can do it if you'll help me. But most important of all, I ask you to remember this: I did not get into this race to run them down. I entered this race in the hope that together we could build you up. Let's make America what it ought to be beginning on November 3rd. I need your help, Louisiana. Be there for me and we can take our country back. Thank you, and God bless you all.",758,998
1646,Thank you.,10,998
1901,Thank you.,10,998
1915,We are so happy to welcome you here today. We hope this has been an eventful experience for you. We look forward to having you back sometime.,141,998
1915,Thank you.,10,999
1083,"Come what may on next Tuesday the bonds of friendship forged in this campaign will remain with me forever.  And one of my happiest recollections will be this lovely autumn evening here in Gary, so close to home.",211,998
1083,"And, before I go could I introduce to you my youngest son, John Fell Stevenson.  He needs a haircut.  And I also have my sister aboard, Mrs. Ernest Ives.  And, I have my Aunt, Miss Letitia Stevenson.  She is the best campaigner of us all. ",239,999
1929,"We are proud of this state.  Fred Vinson and Alben Barkley and Henry Clay, and all these great men here on the platform--they have all done what they thought was best for America all the time. And I don't have the slightest doubt but that Louisville and Kentucky are going to do what is best for their country on November 3rd.",326,998
1929,Thank you.,10,999
2575,And now I would like to shake the hands of everyone here and thank you personally for your commitment and your support and our confidence in our country.,153,998
2575,Thank you very much.,20,999
2213,"     And if we dedicate ourselves to that, it will not matter whether we win or lose an election, because ultimately, we will save our own souls and the souls of others.",169,998
2213,"     Good night, and God bless you.",35,999
3119,"Thank you for this wonderful, warm welcome of east Dallas. It's a privilege to spend this time in your community. May God bless the United States of America. Thank you very much.",178,998
2561,"I'm determined, with your help, in energy and other elements of American life, to make sure that in future years the greatest nation on earth will be even greater.",163,998
2561,Thank you very much.,20,999
1068,"And finally I should like to introduce to you, if I could, a distinguished and beloved woman of Pennsylvania, Mrs. Emma Guffey Miller.",134,998
1068,I am so grateful for this sun--they gave me snow all day yesterday.,67,999
2549,"Let me conclude by noting that this is our first Labor Day in many years without the presence of President George Meany. We all owe him a great debt, and we miss him greatly. He symbolized the heart and spirit of American labor. At my request, in tribute to his memory and to the achievements of American labor, the United States Postal Service is issuing today a special commemorative stamp.",392,998
2549,I want to introduce Postmaster General Bill Bolger and Lane Kirkland to make a few remarks at this time about this stamp.,121,999
1040,"Well, those are really beauties, Mayor; they are superb shoes. I am so grateful to you.",87,998
1726,"Last night we had a parade in Chicago of one million people.  I said to Mayor Daley, ""They are all going to be so tired from being in the parade that they won't be able to get up on Tuesday.""  He said, ""No, they will get up.""  I thought so, too.  I think they will here in the Bronx.  This election is important.  The presidency is a great office.  It has unparalleled influence over the lives of all of us.  Every decision the president makes affects the security and well-being of every person in the United States as it never has before, as it never has before.  Its possibilities, its opportunities for service are unlimited in 1960, and I think we don't want the Republicans and Mr. Nixon to assume that responsibility.  We want progress.  We want a Democratic president.  We want a president that will move this country forward.  ",836,998
1726,Thank you.,10,999
3131,"Thank you, and God bless you all. Thank you. ",45,998
3125,"So this is the message we'll be taking to the American people, and I believe we're going to get this job done. It has not been a very pleasant political year for Barbara Bush and me; I'll have to confess that. Indeed, I've been around the political track for a long time, and I've never seen quite the anger and the ugliness in the political process, the willingness to twist and distort and make things ugly. But it's worth it; you know it. It is worth it because we have accomplished a lot for this country. We've accomplished a lot on the world scene as well. Now I want to finish the job, finish the job by bringing opportunity and hope to all Americans, and I am very grateful to each and every one of you. ",712,998
3125,"Thank you, and now off to the political wars. May God bless the United States of America. Thank you.",100,999
2788,"Till next week, thanks for listening, and God bless you.",56,998
1295,"Four years from now, I want America to say:",43,998
1295,"We have gone forward along the broad middle way--toward prosperity without war, toward peace with security--for ourselves and our children.",139,999
2944,"Thank you all very, very much.",30,998
1518,"If you feel that what we are doing now is right, that we can do no better, I suggest you vote for an administration whose motto has been ""No New Starts."" But if you feel we can do better, if you feel that this is a great country, which deserves the united effort of all of us, if you feel that we can move in the sixties, that we can bring a better life for our people, that we can provide security for the farmers of Tennessee and Arkansas, that we can develop our resources, that we can use our steel capacity instead of 50 percent of it, that we can provide for a more secure life for our older citizens, that we can provide the best educational system in the world, that we can move, I want you to join with us. I want you to help us.",738,998
1518,"I want to see an America which is free for everyone, which develops the constitutional rights of all Americans, which will serve as our own symbol, our own identification, with the cause of freedom. The hard, tough question for the next decade, for this or any other group of Americans, is whether a free society with its freedom of choice, its breadth of opportunity, its range of alternatives, can meet the single-minded advance of the Communists. Can a nation organized and governed such as ours endure? Can we carry through at an age where never before we will witness not only new development of weapons not only of destruction, but also a race for mastery of the sky and the rain, the ocean and the tides, the far side of space, and the inside of men's minds? We and the Russians now have the power to destroy, at one blow, one-quarter of the earth's population, a feat not accomplished since Cain slew Abel. We need leadership better equipped than any we have had in 100 years, if the United States is not only going to survive but prevail. It is to that great cause that I ask your help. It is to the future that I ask you to give yourselves. It is to this campaign that I ask your assistance. Thank you.",1212,999
2011,Thank you.,10,998
2777,Thank you. God bless you all.,29,998
2763,I want an America where the president understands that it's time for new leadership; it's time for America to move on.,118,998
3333,Thank you very much and God bless America.,42,998
1524,"I ask your help. I don't say that life is going to be easy in the 1960s, but I think we can do better. I do think we can do more. I don't underrate this country. It is a great country. And I have served it for eighteen years. But I think it can be a greater country. I think it is a powerful country, but I think it can be a more powerful country. I am not satisfied as a citizen, let alone as leader of my party. I am not satisfied as a citizen to have any question of whether the United States is first. I want Mr. Khrushchev and Mr. Castro, and those who wish to follow on your road, to know that the United States is the leader, not that the United States stands still but that we move ahead.",696,998
1524,I want you to join with us. I don't preach the doctrine of ease. I preach the doctrine of vigor and vitality and energy and force. This is a great country and we are going to make it greater. I ask your help in this effort. Thank you.,234,999
1242,"We must now work--all of us--to regain our lost peace.  As a start, we must establish a leadership of our ablest men and women in Washington that we can trust--we must have an administration which inspires the confidence of our allies and the respect of the world.  We must build a strong, secure, solvent United States that can and will cooperate intelligently, consistently, and effectively with other friendly nations in the cause of peace.",443,998
1242,"And we must approach this all-important task with faith in Almighty God, the faith that is rooted deep in both our religious convictions and our concepts of freedom.  It must be the same intense faith which gave vision and strength to our founding fathers.  That is the faith which, throughout our history, has made the United States the symbol of freedom for the world.  With the renewal of our faith, we will not falter in the task.   ",437,999
2993,I am determined to see that we do. Thank you very much.,55,998
1256,"That is the problem of today and that is what this crusade is dedicated to, to help every man, every woman, young and old to realize the very best standard that this country can afford.",185,998
1256,"Now if you will allow me to bring out my Mamie, she would like to wave at you. ",79,999
1530,"I am going on to Utah to speak there tonight. But I do say you have been very generous to us. I hope we can do well in Colorado. Candidates move in and out like ships in the night, and you stay on. So for the next six weeks the campaign of the presidency and the Senate and the House of Representatives here in Colorado is in your capable hands. I would appreciate it if you would take care of the matter. Thank you.",416,998
1530,"I would like to say before we leave that my obligation to Colorado is great for the support we had at the convention and also for the fact that the chairman of our National Citizens Committee is a distinguished citizen of this state who has taken on the responsibilities in fifty states. I must say that I hold him in the same high regard as the people of this state do, your distinguished citizen, Byron White. Thank you.",422,999
3327,"Just don't do it. Just don't do it. And we're going to ask all Americans, all Americans to help us cut teenage drug use in America by half in our first term. With drug use skyrocketing, this administration's record is so bad, all they can do is suppress the whole story, including invoking executive privilege on a memo from the ",329,998
2039,"We have got a job to do at home, my friends, and the only way we are going to get it done is if all of us in this room, if you and I, if we, the people, work through this instrument called the Democratic party, that has given you a Roosevelt, that has given you a Truman, that has given you an Adlai Stevenson, that has given you a John Kennedy, that has given you a Lyndon Johnson, and now has given you a Hubert Humphrey.",423,998
2039,I thank you. ,13,999
1257,"Now, we get these lies that we want to lead them into a truculent attitude abroad so there will be no peace; that we will be responsible for a depression; that we will take social security away from our people; that we will wreck the farm program.  How many of these things can they think of?  I get to the point where I get too angry to speak and I am just going to say this:  You speak for me on November 4.",409,998
1257,Thank you very much. ,21,999
2986,"You know, I started my active politics right here in Houston, Texas many years ago and I began this campaign over a year ago in this city. And at that time, I asked for your help and along the way, in these many months, I've spelled out some very specific plans for how I would accomplish the mission I now seek--to build a better America. And now I've come back to Texas, among friends, to ask once more for your help.",419,998
2986,"And tomorrow, when you walk into that booth, you will hold the future of this nation in your hands. And our very future is at stake and I ask you to cast a vote for opportunity. I ask you to cast a vote for the values, our mainstream values, that have made America the greatest, freest nation in the world, the last best hope of man on earth. And so tonight, from my home base of Houston, Texas, I ask the people all across the United States of America for their help--all Americans, because you see, I am confident that together we can build a better America and so it's a great pleasure to be home. Thank you. God bless you and God bless this great country.",659,999
2038,Thank you.,10,998
3326,"I hope you'll watch tomorrow night. If you watch, I know you'll see that my vision for America and the plan to get there is the right way for our country.",154,998
1531,"My optimism for the future for the country and for the United States and the cause of freedom really goes to our experiences of the last few years in Eastern Europe, in Asia, and Africa. If there is any lesson which the last ten years has shown to me, and it is a lesson that I have been particularly interested in in Algeria and Indochina, it is that the strongest force in the world today is the desire to be independent. This is going to cause us all kinds of trouble in the next ten years. People who used to support us will be neutral. But in the final analysis it is our greatest source of strength. We desire to be independent; so do they. They desire to be independent of us. They desire to be independent of Western Europe, but they also desire to be independent of the Soviet Union and the Chinese Communists. We do not desire to dominate them. They do.",863,998
1531,"Therefore, if we can associate ourselves with this great tide, and it has been a source of regret to me since the end of World War II that we have not associated ourselves with it, then I think we can move with history and we can help form it and help shape it, and by the year 2000 the tide will have turned against the Communists and in the direction of freedom. We, in other words, fit in with the basic movement of our time. The Communists do not. Therefore, while there are a great many clouds on the horizon, and there are a great many uncertainties about Africa, Latin America, and Asia, and Eastern Europe, I think that we represent the way to the future. If we associate with it, if we become part of it, then our security is assured and our leadership is assured. And I think that is a contribution which the Democratic party can make in the field of foreign policy and the security of the United States. Thank you.",925,999
1525,"During the American Constitutional Convention, there was a painting of a sun low on the horizon behind the desk of General Washington and many of the delegates wondered whether it was a rising or a setting sun. At the conclusion, Benjamin Franklin stood up and he said, ""We now know. We have now decided because of what we have done that it is a rising sun and the beginning of a great new day.""",395,998
1525,"I think it can be for the United States because of what we do in the coming months and years, it can be a rising sun and the beginning of a great new day. Thank you.",165,999
3332,This is the greatest country on the face of the Earth and we need to keep it that way. We need strong leadership you can trust in the White House. ,147,998
3332,Thank you very much. And God bless America.,43,999
1243,Good night and good luck. ,26,998
1519,"A strong America is our objective, a strong country, which can live in peace, and set an example to men all over the world. We wish to show men and women all over the world that we are able to harness the resources of our society, that what we have done they can do, and be strong in the meantime to protect ourselves against any action so that we can keep the peace. Beneath that great shield and beneath that umbrella, beneath that wall, build the kind of society which can serve as an inspiration to people around the world--to cause people to think that the people of this country are on the move, that they are solving their problems, that they are feeding their people, that they are building better cities, that they are using their natural resources, that they are cleansing their water, that they are developing their power, that they are on the move, that they are a vital society which represents the future, not the past.",933,998
1519,"We are not finished. We are on the way in this country. We have more to offer than any society ever developed. The Communist society is hostile to the basic aspirations of the people of Latin America, Africa and Asia, and Eastern Europe, and it is hostile to the aspirations of the Russians. If we can maintain our strength, if we can maintain those qualities of character and restraint and self-discipline and will, if we bring imagination and energy to the solution of the problems that we face, if we mobilize ourselves for the public interest I believe this country will not only endure, but prevail. I think the future can be bright. I ask your support in this campaign because I think we have a chance to serve our country in a difficult and dangerous period. It requires the best from all of us. It requires your best in this district and in this state and in this country. But the country is worth it. We have our chance in our generation to contribute to the welfare of our country. I think it is a chance that all of us welcome. We want to lead, and we want this country to move again. Thank you.",1106,999
2776,"So, thank you all. This has been a great pleasure.",50,998
1294,"Next, they will come in with government when asked by a locality to help in a problem beyond the capabilities of that locality to solve.  But they will always come again as a friend and not as a boss.  Finally, they promise this:  To be honest--just to bring you common woodshed honesty, the kind you should not have to ask from prospective public servants because you can demand it.  They will just try to bring you that kind of honesty, and at the end of four years, their hope would be that you people will say, ""Well, they were a pretty good bunch; they were just like the rest of us.""",589,998
1294,"That, ladies and gentlemen, is what this crusade proposes to do.  I assure you the people belonging to it--Republicans, Independents, enlightened Democrats, all the rest of them--are determined to go through with this thing.  It is on the march everywhere.  We find the enthusiasm swelling, confidence growing; and there is going to be the biggest clean-out on January 20, 1953 that Washington has yet had the good fortune to witness.  All of you are invited to join.",467,999
1280,"And now, you have a few people whom I particularly hope you will send to help:  Senator Ives, your Congressman Williams, and in your state government, keep these people so that there can be a team dedicated to this task.",220,998
1280,"Now, just before this train pulls out, may I please bring out my wife because she has a greater claim to Oneida than I. ",120,999
2789,"Dr. Joseph Giordano is the surgeon. The hero of this story is Joseph Giordano, Sr.--retired milkman and inheritor of the Italian-American tradition.",148,998
2789,"I have thanked the Giordanos, but I've not had a chance to personally thank a group like this for all that you've done to keep the tradition alive. And so, grazie. Thank you all very much. God bless you.",203,999
2979,"I am proud to have worked with our great president and had the experience of helping to create six years of record setting economic growth, technological innovation, and record setting employment. I have an optimistic faith in America and the limitless capabilities of its people who will carry those policies on to the future.",327,998
2979,Thank you all very much and God bless you. ,43,999
1733,Thank you. ,11,998
3124,Now I'm going to ask the American people: Let us finish this job. Let us have this economy recover. Let's offer hope and opportunity to all Americans. Give me four more years to finish the job. ,194,998
3124,"Thank you, and may God bless our great country. I can't do it as well as Lee Greenwood, but God bless the United States. God bless the U.S.A. Thank you very much.",162,999
1055,Good-bye and God bless you all.,31,998
1041,"The Democratic party has, I hope, a presidential candidate and not a man on a flying trapeze. We have not changed our ideas to suit our itinerary, and we would rather lose the election than mislead the people. But we are not going to lose the election and for that very reason.",277,998
1041,"I have just one further word for you before the conductor pulls my coattails. It is a clipping from a Boston paper this morning that somebody showed me. It reads this way: ""An elderly woman who had been following Governor Stevenson and saw him for the first time observed, ""I just don't think I will vote for him. He is far too nice a man to give that nasty job to.""",366,999
2548,"In the year 1980, America still beckons us toward that hope and that dream, but it will not be easy. We have never had nor expected anything of value to be easy. We must fight for it, and as we choose the path this year to America's future, I ask for your help and support. If we fight our future side by side, then together we will be victorious, our nation will be strong, united, and free, and we will have a better life for all Americans.",442,998
2548,"God bless you. Stick with me, and we'll win.",44,999
3130,"If you're looking for a leader of experience and ideas, a leader who shares your values, a leader who knows that America's heartbeat can be found not in Washington but in places like Clearwater and Largo and St. Pete and Tampa, then I hope I can count on your support on November 3rd. rdThank you all very, very much. And may God bless the United States of America. Thank you all. Thank you. ",392,998
1727,Thank you. ,11,998
2206,Good night. And God speed to you all.,37,998
1069,"I am so grateful to you; I shall remember it always and when I go through Altoona, Pennsylvania in future years, this day will linger with me always. Thank you. ",161,998
2560,Thank you very much.,20,998
