Speech_id,text,length,par_id
2682,"But we can turn those policies around, reinvigorating economic growth and putting America back to work.",103,998
2682,And we should start by repealing the social security earnings limitation.,73,999
2696,I would like to have your support. ,35,998
906,"A democracy is a live society--and growth is the essence of life. We are by no means satisfied--nor will we ever be. There is tomorrow to conquer--and to improve. That you, the citizens of Genessee County, are aware of these issues is reflected in the fact that 79 percent of you who are eligible voters are already registered. I hope all the rest of the eligibles register too, and that in November you do your duty as citizens of this great Republic which carries the hopes and fears of all the world.",503,998
906,"You will hear a lot about the need for a change. You will hear the Republicans say that the Democrats have been in too long. Remember what my friend Congressman Bill Dawson says: ""How long is too long, if it's good?""",216,999
2872,Thank you all very much.,24,998
2899,Thank you very much.,20,998
2641,Thank you very much.,20,998
1348,"Thank you, Mrs. Roosevelt. And thank you all. Goodbye.",54,998
2127,We can do it.  But I need your help.  Not just to win this election but to create a new world for the 1970s.,108,998
2127,"America needs your ideas, your experience, and your talents.  America needs you, every one of you, and now.",107,999
3239,"When the teen birth rate drops for four years in a row and out-of-wedlock births decline for the first time in a generation, that is news we can all be proud of. Americans are standing up for our values. The American family is getting stronger and we are making responsibility a way of life. Our economy and our society are on the right track. If we continue to pull together, to meet our challenges and protect our values, our best days are still ahead.",454,998
3239,Thanks for listening.,21,999
2133,"He must enforce the laws but he must also work to see that the laws are just.  He must insure order, but he must also see that every injustice an every inequity and wrong is righted.  These are the things that I want for America.  These are the reasons that I come to you to ask for your help, not your help only for me, because I am involved as a candidate, and you are involved as the popular sovereigns of this country, and on election day you will be heard.  On that day the power of the ballot becomes the most powerful instrument in the hands of the people.",563,998
2133,"These are the things that I have outlined tonight that I think that we can do, and these are the things that we will have if you will give me your help.  And I ask you to go out now and work these last days as you have never worked before.  I ask you to see that every voter votes.  I hope he will be able to vote for our ticket.  But, above all, I want him to perform the duty and the privilege of American citizenship, and I call upon the young in this audience below voting age to make themselves committees of one in their own homes to make sure that every person of twenty-one years of age and over is at the ballot box early to cast a vote for this last best hope of Earth which is your country and mine--let's take care of it--so help me God. ",750,999
2655,A Reagan administration will be committed to producing as much energy as we can here at home. And that requires one essential step--the prompt phase-out of all price controls on natural gas. ,191,998
1374,It is the Democratic purpose to use our individual and social intelligence to keep opportunity alive for every American. Because we believe this--because our record for a century and a half has shown our devotion to this ideal--is I believe the reason why you American businessmen are here today--why you think the Democratic party is entitled to your support in this fateful election.,385,998
3205,Thank you. God bless you. Let's go get it.,42,998
1412,Thank you very much.,20,998
3211,"And so when you see--that's the last thing I want to leave you with. I don't want to build a bridge that you only get to walk across because you're better than somebody else because of an accident of birth. I want to build a bridge that anybody can walk across if they say I believe in the Constitution, the Declaration of Independence, the Bill of Rights; I believe in the fundamental dignity of all people; and if you're willing to show up for work tomorrow, play by the rules, and love this country the way I do, I'll hold your hand and we'll build a bridge we can walk across together.",589,998
3211,"And if you'll do that, we'll have a great victory in November. Thank you and God bless you.",91,999
2669,"With your help and prayers, and with God's blessing, we will build peace, we will make peace grow.",98,998
2669,"In all we do we must truly be peacemakers, for ourselves and for our children, for our nation and for the world.",112,999
1360,"Now the United States has been in a number of wars, and I have always thought most of the credit for ending them belongs to the soldiers who gave their lives to stop the enemy. If, however, the Republicans think this honor should go to political leaders, then I might point out that the two greatest wars of all time were stopped by Woodrow Wilson, Franklin D. Roosevelt and Harry Truman.",388,998
1837,"So, this is my message to you today.  If, clearly apart from the parties of which we are members, clearly apart from any labels we may wear, you in your hearts believe that Cabot Lodge and I are the men America needs in this critical period, then I say: here's your chance to strike a blow for freedom, to strike a blow for peace by working between now and election day in this great crusade or peace and freedom for all mankind.",429,998
1837,Thank you very much.,20,999
2480,"Let me say, before I have an opportunity to come down and shake hands with all you wonderful folks from Illinois, that your Senator, Chuck Percy, is going to introduce some outstanding citizens from all over the country who have come and joined us at Joliet, who are traveling with us on this trip from Joliet down south. So, while some of us start over here, Chuck is going to introduce them. And I thank them for joining Betty and me, indicating their support for what we've done and what we will do to make a better America. We will be down there.",550,998
1189,Thank you a lot for listening.,30,998
2494,"But as I close, let me reemphasize, we have a chance to go forward together. And I promise you once more, as I promised you before, to uphold the Constitution, to do what is right as God gives me the right--or to see the right--and to do the very best that I can for America. God helping me, I won't let you down.",313,998
2494,Thank you very kindly.,22,999
2325,"But the most important thing that I want to tell you is this: I have spoken of the world.  Along with Mrs. Nixon, we have visited most of the countries of the world, in fact, over eighty.  And every time you come back to the United States you know that the people fortunate enough to live here are the most fortunate people in the world.  This is a great country.  Let's never forget that.",389,998
2443,"Thank you very, very much.",26,998
2457,AIR ,4,998
1638,"Well, we can do better and we are going to have to do better if we are going to survive.  Africa today has one-fourth of all the votes in the General Assembly.  Do you know there are four countries in Africa without a single American diplomat representing us?  Do you know that we brought more students from all over the world to study here than we did ten years ago?  We offered at the time of the Congo in June 300 scholarships.  Do you know that was more scholarships to Africa and the Congo than we had offered to all of Africa the year before?  I believe we can do better.",577,998
1638,"I think it is time we stopped standing still.  I think it is time we started ahead as Americans and as believers in freedom.  I want to make it very clear that we stand on this issue.  We stand for moving ahead in the 1960s.  We stand for full employment, and better housing.  I stand where Franklin Roosevelt stood, and I come to Brooklyn, which supported him, and ask your help. ",381,999
3007,Thank you very much.,20,998
2319,"Just let me say, when anybody asks you what it is all about, when they ask you what politics is about, whether you are in it as a vocation or whether you are in it as an avocation, working for the candidate of your choice, here it is: It is their future, let's make it the best.",278,998
1176,"Such an administration will hope at the end of four years that every one of you people could meet here again and say honestly, ""We believe they were fair; we believe they were honest.  We believe they were friends of ours, not people trying to dominate us.  They were one of us.""  That, my friends, we hold is a worthy ambition and that is the only ambition we have.  Thank you very much for listening to me.",408,998
1162,"No Republican comes before you to out-promise Democrats.  In fact, they have made all the promises possible in the last 20 years anyway.  We do come before you with this pledge:  if you want to send this great group of Republicans in the Senate, in the Congress and in the executive department, to Washington, they pledge that every policy that they consider, everything they take up, will be decided on one yardstick and that yardstick will be what is good for the United States as a whole.  They are not going to talk in terms of sectionalism or of class or of group.  What is good for 155 million Americans--that will be the criterion by which they will measure every one of their actions.  If you want that you have got the answer in your hands, but don't forget to register tomorrow if you have so far been too busy to do it.",830,998
1162,"Now, ladies and gentlemen, before your own native Ohioans come before you, with your permission I should like to bring out my Mamie.  She would like to wave at you this morning.",177,999
3013,Thank you very much and God bless you all.,42,998
1604,"Today, Africa and America, black men and white men, new nations and old, are bound together.  Our challenges rush to meet us.  If we are to achieve our goals--if we are to fulfill man's eternal quest for peace and freedom--we must do it together.  And together we can and will succeed.",285,998
1943,We have saved on the things that we did not need to have so we would have the things that we needed to buy. We have a good poverty program. We have a good health program. We have a good education program. We have a good highway program.,236,998
1943,We are moving America forward. We need Pennsylvania's help. We need Genevieve Blatt. We need Jim Haggerty. We need Dan Flood. And Hubert Humphrey and I need you November 3rd.,174,999
2292,"I won't pretend that we have all the answers to the puzzles of our modern economy. We will make mistakes. But I can promise that we will put people first. And that is the soundest economics, the soundest public policy ever devised.",231,998
2292,"Franklin Roosevelt put it this way: ""Better the occasional faults of a government living in the spirit of charity than the consistent omissions of a government frozen in the ice of its own indifference.""",203,999
3198,Will you help me build that bridge?,35,998
3198,Thank you and God bless you. Thank you.,39,999
2286,"Let us win this year--and we will earn as peacemakers a longer life for our children and, in prosperity, a secure life for all of our people.",141,998
1957,"I know they are going to do their duty, and I know when they do their duty on November the 3rd that I am going to get a telephone call down at my little ranch on the banks of the Pedernales saying, ""Everything went all right in St. Louis and Missouri today.""",258,998
2251,"So I am back here in Columbus tonight because I believe very deeply in what we are attempting to do in this campaign to restore the government of our country to the hands of the people, to restore this nation to peace and to bring some semblance of common sense to the way we are handling our economic and social priorities here at home. This is the thing that keeps me going night and day and I know--I don't have to be told--that we are the underdog in this campaign, but remember that was the same thing that was said about John Kennedy in 1960, it was the same thing that was said about Harry Truman in 1948, and it is the same thing that has been said about other people who have undertaken this race for the presidency of the United States. And if you stand with us and persevere and don't pay too much attention to these public opinion polls, I have no doubt that when the votes are counted on November 7th, Ohio will be in the Democratic column. And if we win Ohio, we are going to win the nation and we are going to make America once again the great and good land that it ought to be. ",1094,998
2251,Thank you and God bless you.,28,999
1980,"On the strength we build today rests the outcome of the contests of this century between the way of freedom and the ways of darkness. A strong nation, a united nation, a nation committed to the education, the enlightenment and the advancement of its people is the nation that will succeed in the struggle to win those contests between a world of war or a world of peace.",370,998
1758,"Finally, may I say to you, then, consider what I have said, what my opponent may say, and then go out and work in this campaign for the man that you think--not that can do the best job for the party--but the one that can do the best job for America.  If you vote for what's best for America, you'll also be voting for what's best for yourself, and for these children as well.  Thank you very much.",397,998
2537,Thank you very much.,20,998
2523,Thank you.,10,998
2245,"Now here tonight--I would like to say to all within the sound of my voice and to Americans everywhere who share our love for justice and peace and a better future for our land--resume your stations, we are going to bring America home. ",235,998
2245,Thank you very much. Thank you. Thank you very much.,52,999
1764,Thank you very much.,20,998
3173,And may God bless the United States of America. Thank you very much. Thank you.,79,998
1002,That's it. That's the whistle in the whistle-stop.,50,998
1016,"My friends, before I go, I should like very much to say one further word. You have a candidate, a Democratic candidate for Congress, from this district, Mr. Harry Johnson. I think if I should go to Washington, it would be a great comfort if he went with me.",257,998
3167,"Now I ask for your trust. I ask for your trust. I ask you to take this great Ohio enthusiasm to the polls on Tuesday. We are going to show these crazy media talking heads wrong. We are going to win the election. And then we will lead America and lift these kids up. I don't need the job, but I want to finish the job because I want to help every child here. They're living in a world now far less fearful of nuclear war. We've changed the world. Now let's help us strengthen every family in America and lift America up.",519,998
3167,"Thank you, and may God bless you on this beautiful day in Ohio. This is fantastic. Thank you. Great rally, Strongsville, fantastic. Thank you very much. Great day. Work now: Go to the polls. Get out and vote. We need you.",221,999
1770,Thank you very much. ,21,998
2090,"I think we have a ticket, and I think you can be proud of it.  And I want you not only to give me your money--God only knows we need that--but I want you to give us your faith, I want you to give us your enthusiasm.  I want you to know that your country needs you.  I want you to know that this election can be won.  And I want you to know that I intend, with your help, to win it.",381,998
2090,Thank you.  ,12,999
1599,"I don't send Senator Hugh Scott of Pennsylvania to campaign for me in the North and Senator Barry Goldwater to come South, and say we don't need any of this.  All these are important issues, but I must say what is most important is that the United States recognize in the 1960s that these are difficult and dangerous times, that it is going to require the best of all of us, whether we live in Massachusetts or whether we live in South Carolina.  I do not go to the American people--and it is upon your shoulders that the great decision will rest--promising that if I am elected life will be easy.  I think to be a citizen of the United States in the 1960s is going to be a burdensome and hazardous occupation.  But I have the greatest confidence in this country.  I have the greatest confidence in our system of government.  I know we can meet our responsibilities.  And I do not agree with those who say that we downgrade the United States when we downgrade Republican leadership.  I am not satisfied, in our most dangerous years, to have our steel mills working 50 percent, to have 35 percent of our brightest boys and girls never get to college, to be turning out half as many doctors and nurses as we now need, to find the largest agricultural surplus, $9 billion, stored away rotting while more than 5 million Americans go to bed every night on a substandard diet of 5 cents a day of surplus foods.  I am not satisfied to see the United States stand still, to see farmers' income driven down and given only for relief the same promises of Mr. Benson, applied with new lighting and new makeup.  ",1600,998
1599,"These are dangerous days, but it is upon us that the hope of freedom lies; it is upon the United States, it is upon our vitality and our vigor and our willingness to embrace the future.  I come as the candidate of the oldest political party on earth, in direct succession from Thomas Jefferson, in direct succession and standing where Woodrow Wilson and Franklin Roosevelt and Harry Truman stood in this century, and saying that we also in our day have a rendezvous with destiny.  Our generation of Americans must meet its responsibility, not only to ourselves, but to all those who wish to trod on freedom's road.  I want Mr. Khrushchev to know that a new generation of Americans has taken over in this country, men who fought in Italy and the South Pacific in order to maintain this country's freedom, men who have the greatest confidence in our country, men who want to see it move again, men who want to set it going again.  And I come to South Carolina and ask your help in this campaign.  I ask you to join us in building a stronger America, an America which will serve as an example to a watching world as we sit on a most conspicuous stage.  We will give leadership if we are successful, and I can promise you this country will start to move again.  Thank you.  ",1270,999
2084,"""Who shall speak for the people?""  Carl Sandburg asked.  And I answer:  I shall speak and I shall act.",102,998
2084,I ask your help.,16,999
2912,"The best America isn't behind us, because with your help on November 8, we will make sure that the best America is yet to come.",127,998
899,"The fact that my captors generously assault one another reminds me of a story I heard about a scout who was captured by a group of Indian tribes, who soon began to argue among themselves about which tribe he belonged to. Tempers rose and so did the tomahawks. The rival tribesmen laid each other on the ground and Davy Crockett, or whoever he was, made his escape. Maybe there's hope for me! Meanwhile, it's not too uncomfortable to be captured by most everybody--except the Republican Old Guard! ",497,998
899,"But I have kept you much too long. Let me just add that I have often wondered how best to describe the essential difference between our two major parties. But when I think about the contrast between the speaker at the Fair yesterday and the speaker at the Fair today, the meat of the difference becomes obvious. The Republican party is the party which makes even its young men seem old. The Democratic party is the party which makes even its old men seem young. It is my pride and pleasure to present to you the youngest of them all, our beloved Vice President, Mr. Democrat himself--Alben Barkley. ",599,999
2053,So let's get to work.,21,998
3359,Thank you very much. God bless America.,39,998
2047,I have come here to ask your help.,34,998
1228,Again I say to each of you in this great throng:  Thank you very much for coming out.  You have honored me.  Thank you.,119,998
2721,"What Italy symbolizes on this side of the Atlantic is described in the last words of the book.  To me, they sum up the values that this evening is all about.  Let me close by quoting them:  ""The love of country, and the love of freedom, kept pure by the one thing that can tame and yet not weaken them:  the tenderest humanity for all mankind.""  Thank you very much.",366,998
1200,"Above all, that government would promise this: to be honest--just honest.  It would want to stand before you at the end of its term so that you could look at it from top to bottom and say, ""They were fair; they were just; they were friendly and they didn't cheat.""",264,998
1200,Thank you a lot.,16,999
2709,"I don't pretend the government can do it alone.  We must work together.  Teachers must teach and restore discipline to the classrooms.  Students must do their homework.  Parents must turn off those TV sets.  We all have to pay our fair share.  I am standing up to everybody here today.  But together we can provide the best education in the world to every young American in this next generation, not just the ones who can afford it by themselves or who need no extra help.  It's your choice.  It's your country.  It's your future.  Today I ask you to let me take you there.  Thank you very much.",595,998
3371,"Well, why give anybody a chance? He's had a chance. Let's take it on what the performance has been thus far.",108,998
3371,"But I ask you this: Go out and go to work. We've got four days, ninety-six hours, ninety-six hours on the road to victory. We're going to make it with your help. Thank you very much, and God bless America.",205,999
1572,"Now, in 1960, in this state, in Missouri, in Ohio, and Pennsylvania and Michigan and New York and New Jersey, this fight is going to be won or lost.  You can make the greatest possible contribution, and in return we will work, this country and this state, from one end to another.  We will carry our message.  We will inform the American people that the choice is between standing still and moving forward, between yes and no, between progress and mediocrity.  I hope that you will join us in this effort.  It involves us all.  A stronger America involves us all.  Every governmental action affects our lives for good and for bad.  Every movement forward moves us all forward.  A rising tide lifts all the boats.  I hope a new Democratic administration can lift all the boats and all the states and all the people therein.  We ask your help in this campaign.  Thank you.",870,998
3365,"I remember, back in Arkansas, when Clinton was running for reelection for governor. He was twenty-two points ahead. He lost. He lost. It's going to happen, it's going to happen. There are going to be a lot of surprised pundits wake up on the 6th of November.",258,998
3365,"So, if you will stand with us on November 5, we will stand with you the next eight years, sixteen years, however long we're going to be around there. Thank you very much, and God bless America.",193,999
1214,"And now because you have been so kind, may I impose on you one moment further and ask Mrs. Ike to come out and wave to you.",123,998
3364,"Well, thank you very much for coming--I want to get all the local candidates up here--Jeff/Cliff...[missing text]...come on up here. Sue...[missing text]...candidates here. I also want to thank Bo Derek for coming along--Bo Derek or a different woman: thank you.",262,998
3364,"Bo Derek's been on one bus, and everybody wanted to be on that bus. I don't know--I can't--we've got one guy who won't get off the bus. That guy named P. F. Bentley over there with Time magazine, he's taking her picture right now. We can't get him off the bus because that's the bus that Bo's on. He knows if he gets off we won't put him back on that bus again. But in any event, we've had a great time. We're very excited. We want a better America the next century and we can have it. Go to work.",497,999
1573,"This campaign is an important one.  The American people have the choice of whether or not they are going to give the green light to the sixties, whether they are going to move ahead, as Woodrow Wilson moved, and Franklin Roosevelt, and Harry Truman, whether we are going to say yes to the 1960s whether we are going to move ahead.  I ask your help in this campaign.  Thank you.",377,998
